[
  {
    "page_url": "https://groww.in/mutual-funds/hdfc-mid-cap-fund-direct-growth",
    "fund_name": "HDFC Mid Cap Fund Direct Growth - NAV, Mutual Fund Performance & Portfolio",
    "amc_name": "HDFC Mutual Fund",
    "category": "Equity",
    "sub_category": "Mid Cap",
    "plan_type": "Direct",
    "option": "Growth",
    "latest_nav": null,
    "nav_date": "19 Dec 2025",
    "nav_change_pct": "+0.90%",
    "aum": "92,168.85Cr",
    "expense_ratio": "0.71%",
    "risk_level": "Very High Risk",
    "rating": "5",
    "min_investment": {
      "lump_sum": null,
      "sip": "100"
    },
    "exit_load": "Exit load of 1% if redeemed within 1 year.",
    "lock_in_period": null,
    "returns": {
      "1y": "25.8%",
      "3y": "25.8%",
      "5y": "26.4%"
    },
    "full_text": "Stocks\nF&O\nMutual Funds\nMore\nSearch Groww...\n\u2318K\nLogin/Sign up\nHDFC Mid Cap Fund Direct Growth\nEquity\nMid Cap\nVery High Risk\n+\n0\n1\n2\n3\n4\n5\n6\n7\n8\n9\n0\n1\n2\n3\n4\n5\n6\n7\n8\n9\n.\n0\n1\n2\n3\n4\n5\n6\n7\n8\n9\n0\n1\n2\n3\n4\n5\n6\n7\n8\n9\n%\n3Y annualised\n+0.90% 1D\n1M\n6M\n1Y\n3Y\n5Y\nAll\nNAV: 19 Dec 2025\n\u20b9224.13\nRating\n5\nMin. SIP amount\n\u20b9100\nFund size\n\u20b992,168.85Cr\nReturns calculator\nMonthly SIP\nOne-Time\n\u20b95,000 per month\nOver the past\n1 year\n3 years\n5 years\nTotal investment of \u20b960,000\nWould have become \u20b965,023 (+8.37%)\nHoldings (76)\nName Sector Instrument Assets\nMax Financial Services Ltd.\nFinancial Equity 4.76%\nAU Small Finance Bank Ltd.\nFinancial Equity 4.06%\nThe Federal Bank Ltd.\nFinancial Equity 3.58%\nIndian Bank\nFinancial Equity 3.48%\nBalkrishna Industries Ltd.\nAutomobile Equity 3.31%\nCoforge Ltd.\nTechnology Equity 3.23%\nIpca Laboratories Ltd.\nHealthcare Equity 2.81%\nFortis Healthcare Ltd.\nHealthcare Equity 2.78%\nHindustan Petroleum Corporation Ltd.\nEnergy Equity 2.76%\nGlenmark Pharmaceuticals Ltd.\nHealthcare Equity 2.67%\nSee All\nMinimum investment amounts\nMin. for 1st investment \u20b9100\nMin. for 2nd investment onwards \u20b9100\nMin. for SIP \u20b9100\nReturns and rankings\nCategory: Equity Mid Cap\nAnnualised returns\nAbsolute returns\n3Y 5Y 10Y All\nFund returns 25.8% 26.4% 19.4% 21.1%\nCategory average 20.9% 21.7% 16.3% NA\nRank with in category 5 3 4 NA\nUnderstand terms\nPeer Comparison\nEquity, Mid Cap funds Rating 1Y 3Y Fund Size(Cr)\nWhiteOak Capital Mid Cap Fund Direct Growth\n5\n5.5% 27.1% 4,075.13\nEdelweiss Mid Cap Direct Plan Growth\n5\n2.6% 26.4% 12,646.93\nMotilal Oswal Midcap Fund Direct Growth\n5\n-10.8% 25.8% 38,002.68\nHDFC Mid Cap Fund Direct Growth\n5\n6.3% 25.8% 92,168.85\nNippon India Growth Mid Cap Fund Direct Growth\n4\n2.1% 24.7% 42,041.60\nExpense ratio, exit load and tax\nExpense ratio: 0.71%\nInclusive of GST\nExit load\nExit load of 1% if redeemed within 1 year.\nStamp duty\n0.005% (from July 1st, 2020)\nTax implication\nIf you redeem within one year, returns are taxed at 20%. If you redeem after one year, returns exceeding Rs 1.25 lakh in a financial year are taxed at 12.5%.\nUnderstand terms\nCheck past data\nFund management\nChirag Setalvad\nDec 2012 - Present\nView details\nDhruv Muchhal\nJun 2023 - Present\nView details\nFund house & investment objective\nFund house contact details\nCompare funds\nHDFC Mid Cap Fund Direct Growth\nVS\nAdd mutual fund to compare\nFAQs\nHow to Invest in HDFC Mid Cap Fund Direct Growth?\nWhat kind of returns does HDFC Mid Cap Fund Direct Growth provide?\nHow much expense ratio is charged by HDFC Mid Cap Fund Direct Growth?\n\n\nWhat is the AUM of HDFC Mid Cap Fund Direct Growth?\nHow to Redeem HDFC Mid Cap Fund Direct Growth?\nCan I invest in SIP and Lump Sum of HDFC Mid Cap Fund Direct Growth?\nWhat is the NAV of HDFC Mid Cap Fund Direct Growth?\nWhat is the PE and PB ratio of HDFC Mid Cap Fund Direct Growth?\nLooking to invest in mutual funds?\nExplore diversified funds designed for every investor\nInvest Now\nHome\n>\nMutual Funds\n>\nHDFC Mutual Fund\n>\nHDFC Mid Cap Fund Direct Growth\nVaishnavi Tech Park, South Tower, 3rd Floor\nSarjapur Main Road, Bellandur, Bengaluru \u2013 560103\nKarnataka\nContact Us\nDownload the App\nGROWW\nAbout Us\nPricing\nBlog\nMedia & Press\nCareers\nHelp & Support\nTrust & Safety\nInvestor Relations\nPRODUCTS\nStocks\nF&O\nMTF\nETF\nIPO\nMutual Funds\nCommodities\nGroww Terminal\n915 Terminal\nStocks Screener\nAlgo Trading\nGroww Digest\nDemat Account\nGroww AMC\n\u00a9 2016-2025 Groww. All rights reserved.\nVersion: 7.0.6\nShare Market\nIndices\nF&O\nMutual Funds\nETFs\nFunds By Groww\nCalculators\nIPO\nMiscellaneous\nTop Gainers Stocks\n52 Weeks High Stocks\nTata Motors\nNHPC\nITC\nWipro\nTop Losers Stocks\n52 Weeks Low Stocks\nIREDA\nState Bank of India\nAdani Power\nCDSL\nMost Traded Stocks\nStocks Market Calender\nTata Steel\nTata Power\nBharat Heavy Electricals\nIndian Oil Corporation\nStocks Feed\nSuzlon Energy\nZomato (Eternal)\nYes Bank\nInfosys\nNBCC\nShow More\nOthers:\nNSE\nBSE\nMCX\nTerms and Conditions\nPolicies and Procedures\nRegulatory & Other Info\nPrivacy Policy\nDisclosure\nSMART ODR\nDownload Forms\nInformation Security Practices\nInvestor Charter and Grievance\nBug Bounty",
    "scraped_at": "2025-12-22T03:18:53Z",
    "fund_managers": [
      "Dhruv Muchhal",
      "Chirag Setalvad"
    ]
  },
  {
    "page_url": "https://groww.in/mutual-funds/hdfc-focused-fund-direct-growth",
    "fund_name": "HDFC Focused Fund Direct Growth - NAV, Mutual Fund Performance & Portfolio",
    "amc_name": "HDFC Mutual Fund",
    "category": "Equity",
    "sub_category": "Flexi Cap",
    "plan_type": "Direct",
    "option": "Growth",
    "latest_nav": null,
    "nav_date": "19 Dec 2025",
    "nav_change_pct": "+0.53%",
    "aum": "26,229.60Cr",
    "expense_ratio": "0.62%",
    "risk_level": "Very High Risk",
    "rating": "5",
    "min_investment": {
      "lump_sum": null,
      "sip": "100"
    },
    "exit_load": "Exit load of 1% if redeemed within 1 year",
    "lock_in_period": null,
    "returns": {
      "1y": "21.7%",
      "3y": "21.7%",
      "5y": "25.7%"
    },
    "full_text": "Stocks\nF&O\nMutual Funds\nMore\nSearch Groww...\n\u2318K\nLogin/Sign up\nHDFC Focused Fund Direct Growth\nEquity\nFlexi Cap\nVery High Risk\n+\n0\n1\n2\n3\n4\n5\n6\n7\n8\n9\n0\n1\n2\n3\n4\n5\n6\n7\n8\n9\n.\n0\n1\n2\n3\n4\n5\n6\n7\n8\n9\n0\n1\n2\n3\n4\n5\n6\n7\n8\n9\n%\n3Y annualised\n+0.53% 1D\n1M\n6M\n1Y\n3Y\n5Y\nAll\nNAV: 19 Dec 2025\n\u20b9269.56\nRating\n5\nMin. SIP amount\n\u20b9100\nFund size\n\u20b926,229.60Cr\nReturns calculator\nMonthly SIP\nOne-Time\n\u20b95,000 per month\nOver the past\n1 year\n3 years\n5 years\nTotal investment of \u20b960,000\nWould have become \u20b964,266 (+7.11%)\nHoldings (31)\nName Sector Instrument Assets\nICICI Bank Ltd.\nFinancial Equity 9.37%\nHDFC Bank Ltd.\nFinancial Equity 8.84%\nAxis Bank Ltd.\nFinancial Equity 7.32%\nState Bank of India\nFinancial Equity 5.11%\nHCL Technologies Ltd.\nTechnology Equity 4.61%\nKotak Mahindra Bank Ltd.\nFinancial Equity 4.13%\nMaruti Suzuki India Ltd.\nAutomobile Equity 3.79%\nSBI Life Insurance Company Ltd.\nInsurance Equity 3.52%\nCipla Ltd.\nHealthcare Equity 3.50%\nPower Grid Corporation Of India Ltd.\nEnergy Equity 2.78%\nSee All\nMinimum investment amounts\nMin. for 1st investment \u20b9100\nMin. for 2nd investment onwards \u20b9100\nMin. for SIP \u20b9100\nReturns and rankings\nCategory: Equity Flexi Cap\nAnnualised returns\nAbsolute returns\n3Y 5Y 10Y All\nFund returns 21.7% 25.7% 15.8% 15.8%\nCategory average 15.6% 16.1% 13.8% NA\nRank with in category 7 1 9 NA\nUnderstand terms\nPeer Comparison\nEquity, Flexi Cap funds Rating 1Y 3Y Fund Size(Cr)\nInvesco India Flexi Cap Fund Direct Growth\n5\n-0.5% 22.5% 4,680.24\nParag Parikh Flexi Cap Fund Direct Growth\n5\n7.3% 21.9% 1,25,799.63\nHDFC Flexi Cap Direct Plan Growth\n5\n10.2% 21.5% 94,068.73\nHSBC Flexi Cap Fund Direct Growth\n4\n-0.7% 19.5% 5,247.71\nFranklin India Flexi Cap Fund Direct Growth\n4\n2.8% 18.1% 20,021.75\nExpense ratio, exit load and tax\nExpense ratio: 0.62%\nInclusive of GST\nExit load\nExit load of 1% if redeemed within 1 year\nStamp duty\n0.005% (from July 1st, 2020)\nTax implication\nIf you redeem within one year, returns are taxed at 20%. If you redeem after one year, returns exceeding Rs 1.25 lakh in a financial year are taxed at 12.5%.\nUnderstand terms\nCheck past data\nFund management\nGopal Agrawal\nDec 2025 - Present\nView details\nFund house & investment objective\nFund house contact details\nCompare funds\nHDFC Focused Fund Direct Growth\nVS\nAdd mutual fund to compare\nRecently viewed\nHDFC Mid Cap Fund\n25.8%\n(3Y)\nFAQs\nHow to Invest in HDFC Focused Fund Direct Growth?\nWhat kind of returns does HDFC Focused Fund Direct Growth provide?\nHow much expense ratio is charged by HDFC Focused Fund Direct Growth?\n\n\nWhat is the AUM of HDFC Focused Fund Direct Growth?\nHow to Redeem HDFC Focused Fund Direct Growth?\nCan I invest in SIP and Lump Sum of HDFC Focused Fund Direct Growth?\nWhat is the NAV of HDFC Focused Fund Direct Growth?\nWhat is the PE and PB ratio of HDFC Focused Fund Direct Growth?\nLooking to invest in mutual funds?\nExplore diversified funds designed for every investor\nInvest Now\nHome\n>\nMutual Funds\n>\nHDFC Mutual Fund\n>\nHDFC Focused Fund Direct Growth\nVaishnavi Tech Park, South Tower, 3rd Floor\nSarjapur Main Road, Bellandur, Bengaluru \u2013 560103\nKarnataka\nContact Us\nDownload the App\nGROWW\nAbout Us\nPricing\nBlog\nMedia & Press\nCareers\nHelp & Support\nTrust & Safety\nInvestor Relations\nPRODUCTS\nStocks\nF&O\nMTF\nETF\nIPO\nMutual Funds\nCommodities\nGroww Terminal\n915 Terminal\nStocks Screener\nAlgo Trading\nGroww Digest\nDemat Account\nGroww AMC\n\u00a9 2016-2025 Groww. All rights reserved.\nVersion: 7.0.6\nShare Market\nIndices\nF&O\nMutual Funds\nETFs\nFunds By Groww\nCalculators\nIPO\nMiscellaneous\nTop Gainers Stocks\n52 Weeks High Stocks\nTata Motors\nNHPC\nITC\nWipro\nTop Losers Stocks\n52 Weeks Low Stocks\nIREDA\nState Bank of India\nAdani Power\nCDSL\nMost Traded Stocks\nStocks Market Calender\nTata Steel\nTata Power\nBharat Heavy Electricals\nIndian Oil Corporation\nStocks Feed\nSuzlon Energy\nZomato (Eternal)\nYes Bank\nInfosys\nNBCC\nShow More\nOthers:\nNSE\nBSE\nMCX\nTerms and Conditions\nPolicies and Procedures\nRegulatory & Other Info\nPrivacy Policy\nDisclosure\nSMART ODR\nDownload Forms\nInformation Security Practices\nInvestor Charter and Grievance\nBug Bounty",
    "scraped_at": "2025-12-22T03:19:02Z",
    "fund_managers": [
      "Gopal Agrawal"
    ]
  },
  {
    "page_url": "https://groww.in/mutual-funds/hdfc-equity-fund-direct-growth",
    "fund_name": "HDFC Flexi Cap Direct Plan Growth - NAV, Mutual Fund Performance & Portfolio",
    "amc_name": "HDFC Mutual Fund",
    "category": "Equity",
    "sub_category": "Flexi Cap",
    "plan_type": "Direct",
    "option": "Growth",
    "latest_nav": null,
    "nav_date": "19 Dec 2025",
    "nav_change_pct": "+0.51%",
    "aum": "94,068.73Cr",
    "expense_ratio": "0.65%",
    "risk_level": "Very High Risk",
    "rating": "5",
    "min_investment": {
      "lump_sum": null,
      "sip": "100"
    },
    "exit_load": "Exit load of 1% if redeemed within 1 year",
    "lock_in_period": null,
    "returns": {
      "1y": "21.5%",
      "3y": "21.5%",
      "5y": "24.5%"
    },
    "full_text": "Stocks\nF&O\nMutual Funds\nMore\nSearch Groww...\n\u2318K\nLogin/Sign up\nHDFC Flexi Cap Direct Plan Growth\nEquity\nFlexi Cap\nVery High Risk\n+\n0\n1\n2\n3\n4\n5\n6\n7\n8\n9\n0\n1\n2\n3\n4\n5\n6\n7\n8\n9\n.\n0\n1\n2\n3\n4\n5\n6\n7\n8\n9\n1\n2\n3\n4\n5\n6\n7\n8\n9\n%\n3Y annualised\n+0.51% 1D\n1M\n6M\n1Y\n3Y\n5Y\nAll\nNAV: 19 Dec 2025\n\u20b92,256.39\nRating\n5\nMin. SIP amount\n\u20b9100\nFund size\n\u20b994,068.73Cr\nReturns calculator\nMonthly SIP\nOne-Time\n\u20b95,000 per month\nOver the past\n1 year\n3 years\n5 years\nTotal investment of \u20b960,000\nWould have become \u20b963,818 (+6.36%)\nHoldings (55)\nName Sector Instrument Assets\nICICI Bank Ltd.\nFinancial Equity 9.45%\nHDFC Bank Ltd.\nFinancial Equity 8.78%\nAxis Bank Ltd.\nFinancial Equity 7.35%\nState Bank of India\nFinancial Equity 4.58%\nSBI Life Insurance Company Ltd.\nInsurance Equity 4.18%\nKotak Mahindra Bank Ltd.\nFinancial Equity 4.11%\nCipla Ltd.\nHealthcare Equity 3.42%\nMaruti Suzuki India Ltd.\nAutomobile Equity 3.38%\nHCL Technologies Ltd.\nTechnology Equity 3.11%\nPower Grid Corporation Of India Ltd.\nEnergy Equity 2.61%\nSee All\nMinimum investment amounts\nMin. for 1st investment \u20b9100\nMin. for 2nd investment onwards \u20b9100\nMin. for SIP \u20b9100\nReturns and rankings\nCategory: Equity Flexi Cap\nAnnualised returns\nAbsolute returns\n3Y 5Y 10Y All\nFund returns 21.5% 24.5% 17.5% 16.9%\nCategory average 15.6% 16.1% 13.8% NA\nRank with in category 8 3 4 NA\nUnderstand terms\nPeer Comparison\nEquity, Flexi Cap funds Rating 1Y 3Y Fund Size(Cr)\nInvesco India Flexi Cap Fund Direct Growth\n5\n-0.5% 22.5% 4,680.24\nParag Parikh Flexi Cap Fund Direct Growth\n5\n7.3% 21.9% 1,25,799.63\nHDFC Flexi Cap Direct Plan Growth\n5\n10.2% 21.5% 94,068.73\nHSBC Flexi Cap Fund Direct Growth\n4\n-0.7% 19.5% 5,247.71\nFranklin India Flexi Cap Fund Direct Growth\n4\n2.8% 18.1% 20,021.75\nExpense ratio, exit load and tax\nExpense ratio: 0.65%\nInclusive of GST\nExit load\nExit load of 1% if redeemed within 1 year\nStamp duty\n0.005% (from July 1st, 2020)\nTax implication\nIf you redeem within one year, returns are taxed at 20%. If you redeem after one year, returns exceeding Rs 1.25 lakh in a financial year are taxed at 12.5%.\nUnderstand terms\nCheck past data\nFund management\nChirag Setalvad\nDec 2025 - Present\nView details\nFund house & investment objective\nFund house contact details\nCompare funds\nHDFC Flexi Cap Direct Plan Growth\nVS\nAdd mutual fund to compare\nRecently viewed\nHDFC Focused Fund\n21.7%\n(3Y)\nHDFC Mid Cap Fund\n25.8%\n(3Y)\nFAQs\nHow to Invest in HDFC Flexi Cap Direct Plan Growth?\nWhat kind of returns does HDFC Flexi Cap Direct Plan Growth provide?\nHow much expense ratio is charged by HDFC Flexi Cap Direct Plan Growth?\n\n\nWhat is the AUM of HDFC Flexi Cap Direct Plan Growth?\nHow to Redeem HDFC Flexi Cap Direct Plan Growth?\nCan I invest in SIP and Lump Sum of HDFC Flexi Cap Direct Plan Growth?\nWhat is the NAV of HDFC Flexi Cap Direct Plan Growth?\nWhat is the PE and PB ratio of HDFC Flexi Cap Direct Plan Growth?\nLooking to invest in mutual funds?\nExplore diversified funds designed for every investor\nInvest Now\nHome\n>\nMutual Funds\n>\nHDFC Mutual Fund\n>\nHDFC Flexi Cap Direct Plan Growth\nVaishnavi Tech Park, South Tower, 3rd Floor\nSarjapur Main Road, Bellandur, Bengaluru \u2013 560103\nKarnataka\nContact Us\nDownload the App\nGROWW\nAbout Us\nPricing\nBlog\nMedia & Press\nCareers\nHelp & Support\nTrust & Safety\nInvestor Relations\nPRODUCTS\nStocks\nF&O\nMTF\nETF\nIPO\nMutual Funds\nCommodities\nGroww Terminal\n915 Terminal\nStocks Screener\nAlgo Trading\nGroww Digest\nDemat Account\nGroww AMC\n\u00a9 2016-2025 Groww. All rights reserved.\nVersion: 7.0.6\nShare Market\nIndices\nF&O\nMutual Funds\nETFs\nFunds By Groww\nCalculators\nIPO\nMiscellaneous\nTop Gainers Stocks\n52 Weeks High Stocks\nTata Motors\nNHPC\nITC\nWipro\nTop Losers Stocks\n52 Weeks Low Stocks\nIREDA\nState Bank of India\nAdani Power\nCDSL\nMost Traded Stocks\nStocks Market Calender\nTata Steel\nTata Power\nBharat Heavy Electricals\nIndian Oil Corporation\nStocks Feed\nSuzlon Energy\nZomato (Eternal)\nYes Bank\nInfosys\nNBCC\nShow More\nOthers:\nNSE\nBSE\nMCX\nTerms and Conditions\nPolicies and Procedures\nRegulatory & Other Info\nPrivacy Policy\nDisclosure\nSMART ODR\nDownload Forms\nInformation Security Practices\nInvestor Charter and Grievance\nBug Bounty",
    "scraped_at": "2025-12-22T03:19:12Z",
    "fund_managers": [
      "Chirag Setalvad"
    ]
  },
  {
    "page_url": "https://groww.in/mutual-funds/hdfc-elss-tax-saver-fund-direct-plan-growth",
    "fund_name": "HDFC ELSS Tax Saver Fund Direct Plan Growth - NAV, Mutual Fund Performance & Portfolio",
    "amc_name": "HDFC Mutual Fund",
    "category": "Equity",
    "sub_category": "ELSS",
    "plan_type": "Direct",
    "option": "Growth",
    "latest_nav": null,
    "nav_date": "19 Dec 2025",
    "nav_change_pct": "+0.48%",
    "aum": "17,241.17Cr",
    "expense_ratio": "1.08%",
    "risk_level": "Very High Risk",
    "rating": "5",
    "min_investment": {
      "lump_sum": null,
      "sip": "500"
    },
    "exit_load": "Nil",
    "lock_in_period": "period: 3Y\nCompare fu",
    "returns": {
      "1y": "20.9%",
      "3y": "20.9%",
      "5y": "22.7%"
    },
    "full_text": "Stocks\nF&O\nMutual Funds\nMore\nSearch Groww...\n\u2318K\nLogin/Sign up\nHDFC ELSS Tax Saver Fund Direct Plan Growth\nEquity\nELSS\nVery High Risk\n3Y Lock In\n+\n0\n1\n2\n3\n4\n5\n6\n7\n8\n9\n0\n1\n2\n3\n4\n5\n6\n7\n8\n9\n.\n2\n3\n4\n5\n6\n7\n8\n9\n0\n1\n2\n3\n4\n5\n6\n7\n8\n9\n%\n3Y annualised\n+0.48% 1D\n1M\n6M\n1Y\n3Y\n5Y\nAll\nNAV: 19 Dec 2025\n\u20b91,568.17\nRating\n5\nMin. SIP amount\n\u20b9500\nFund size\n\u20b917,241.17Cr\nReturns calculator\nMonthly SIP\nOne-Time\n\u20b95,000 per month\nOver the past\n1 year\n3 years\n5 years\nTotal investment of \u20b960,000\nWould have become \u20b963,420 (+5.70%)\nHoldings (56)\nName Sector Instrument Assets\nHDFC Bank Ltd.\nFinancial Equity 9.70%\nAxis Bank Ltd.\nFinancial Equity 8.91%\nICICI Bank Ltd.\nFinancial Equity 8.86%\nSBI Life Insurance Company Ltd.\nInsurance Equity 5.13%\nMaruti Suzuki India Ltd.\nAutomobile Equity 5.07%\nCipla Ltd.\nHealthcare Equity 4.80%\nKotak Mahindra Bank Ltd.\nFinancial Equity 4.31%\nBharti Airtel Ltd.\nCommunication Equity 4.14%\nState Bank of India\nFinancial Equity 3.97%\nHCL Technologies Ltd.\nTechnology Equity 3.16%\nSee All\nMinimum investment amounts\nMin. for 1st investment \u20b9500\nMin. for 2nd investment onwards \u20b9500\nMin. for SIP \u20b9500\nReturns and rankings\nCategory: Equity ELSS\nAnnualised returns\nAbsolute returns\n3Y 5Y 10Y All\nFund returns 20.9% 22.7% 15.3% 15.3%\nCategory average 16.1% 16.8% 14.1% NA\nRank with in category 4 2 11 NA\nUnderstand terms\nPeer Comparison\nEquity, ELSS funds Rating 1Y 3Y Fund Size(Cr)\nSBI ELSS Tax Saver Fund Direct Growth\n5\n4.8% 23.4% 32,326.50\nWhiteOak Capital ELSS Tax Saver Fund Direct Growth\n5\n3.3% 21.8% 437.92\nHDFC ELSS Tax Saver Fund Direct Plan Growth\n5\n8.6% 20.9% 17,241.17\nParag Parikh ELSS Tax Saver Fund Direct Growth\n5\n5.1% 17.7% 5,790.91\nQuantum ELSS Tax Saver Fund Direct Growth\n4\n3.1% 17.2% 226.78\nExpense ratio, exit load and tax\nExpense ratio: 1.08%\nInclusive of GST\nExit load\nNil\nStamp duty\n0.005% (from July 1st, 2020)\nTax implication\nIf you redeem within one year, returns are taxed at 20%. If you redeem after one year, returns exceeding Rs 1.25 lakh in a financial year are taxed at 12.5%.\nUnderstand terms\nCheck past data\nFund management\nAmar Kalkundrikar\nDec 2025 - Present\nView details\nFund house & investment objective\nFund house contact details\nPros and cons\nCategory: Equity ELSS\nPros\nExit load is zero\nLower expense ratio: 1.08%\nConsistently higher annualised returns than category average for the past 1Y, 3Y, 5Y and 10Y\nHigher alpha: 6.05 The fund has generated returns higher than benchmark - NIFTY 500 Total Return Index - in the last 3Y\nCons\nLock-in period: 3Y\nCompare funds\nHDFC ELSS Tax Saver Fund Direct Plan Growth\nVS\nAdd mutual fund to compare\nRecently viewed\nHDFC Flexi Cap Fund\n21.5%\n(3Y)\nHDFC Focused Fund\n21.7%\n(3Y)\nHDFC Mid Cap Fund\n25.8%\n(3Y)\nFAQs\nHow to Invest in HDFC ELSS Tax Saver Fund Direct Plan Growth?\nWhat kind of returns does HDFC ELSS Tax Saver Fund Direct Plan Growth provide?\nHow much expense ratio is charged by HDFC ELSS Tax Saver Fund Direct Plan Growth?\n\n\nWhat is the AUM of HDFC ELSS Tax Saver Fund Direct Plan Growth?\nHow to Redeem HDFC ELSS Tax Saver Fund Direct Plan Growth?\nCan I invest in SIP and Lump Sum of HDFC ELSS Tax Saver Fund Direct Plan Growth?\nWhat is the NAV of HDFC ELSS Tax Saver Fund Direct Plan Growth?\nWhat is the PE and PB ratio of HDFC ELSS Tax Saver Fund Direct Plan Growth?\nLooking to invest in mutual funds?\nExplore diversified funds designed for every investor\nInvest Now\nHome\n>\nMutual Funds\n>\nHDFC Mutual Fund\n>\nHDFC ELSS Tax Saver Fund Direct Plan Growth\nVaishnavi Tech Park, South Tower, 3rd Floor\nSarjapur Main Road, Bellandur, Bengaluru \u2013 560103\nKarnataka\nContact Us\nDownload the App\nGROWW\nAbout Us\nPricing\nBlog\nMedia & Press\nCareers\nHelp & Support\nTrust & Safety\nInvestor Relations\nPRODUCTS\nStocks\nF&O\nMTF\nETF\nIPO\nMutual Funds\nCommodities\nGroww Terminal\n915 Terminal\nStocks Screener\nAlgo Trading\nGroww Digest\nDemat Account\nGroww AMC\n\u00a9 2016-2025 Groww. All rights reserved.\nVersion: 7.0.6\nShare Market\nIndices\nF&O\nMutual Funds\nETFs\nFunds By Groww\nCalculators\nIPO\nMiscellaneous\nTop Gainers Stocks\n52 Weeks High Stocks\nTata Motors\nNHPC\nITC\nWipro\nTop Losers Stocks\n52 Weeks Low Stocks\nIREDA\nState Bank of India\nAdani Power\nCDSL\nMost Traded Stocks\nStocks Market Calender\nTata Steel\nTata Power\nBharat Heavy Electricals\nIndian Oil Corporation\nStocks Feed\nSuzlon Energy\nZomato (Eternal)\nYes Bank\nInfosys\nNBCC\nShow More\nOthers:\nNSE\nBSE\nMCX\nTerms and Conditions\nPolicies and Procedures\nRegulatory & Other Info\nPrivacy Policy\nDisclosure\nSMART ODR\nDownload Forms\nInformation Security Practices\nInvestor Charter and Grievance\nBug Bounty",
    "scraped_at": "2025-12-22T03:19:21Z",
    "fund_managers": [
      "Amar Kalkundrikar"
    ]
  },
  {
    "page_url": "https://groww.in/mutual-funds/hdfc-retirement-savings-fund-equity-plan-direct-growth",
    "fund_name": "HDFC Retirement Savings Fund Equity Plan Direct Growth - NAV, Mutual Fund Performance & Portfolio",
    "amc_name": "HDFC Mutual Fund",
    "category": "Equity",
    "sub_category": "Flexi Cap",
    "plan_type": "Direct",
    "option": "Growth",
    "latest_nav": null,
    "nav_date": "19 Dec 2025",
    "nav_change_pct": "+0.56%",
    "aum": "7,054.60Cr",
    "expense_ratio": "0.71%",
    "risk_level": "Very High Risk",
    "rating": "5",
    "min_investment": {
      "lump_sum": null,
      "sip": "100"
    },
    "exit_load": "Nil",
    "lock_in_period": "period: 5Y\nCompare fu",
    "returns": {
      "1y": "4.2%",
      "3y": "4.2%",
      "5y": "18.6%"
    },
    "full_text": "Stocks\nF&O\nMutual Funds\nMore\nSearch Groww...\n\u2318K\nLogin/Sign up\nHDFC Retirement Savings Fund Equity Plan Direct Growth\nEquity\nFlexi Cap\nVery High Risk\n5Y Lock In\n+\n0\n1\n2\n3\n4\n5\n6\n7\n8\n9\n1\n2\n3\n4\n5\n6\n7\n8\n9\n.\n0\n1\n2\n3\n4\n5\n6\n7\n8\n9\n0\n1\n2\n3\n4\n5\n6\n7\n8\n9\n%\n3Y annualised\n+0.56% 1D\n1M\n6M\n1Y\n3Y\n5Y\nAll\nNAV: 19 Dec 2025\n\u20b958.47\nRating\n5\nMin. SIP amount\n\u20b9100\nFund size\n\u20b97,054.60Cr\nReturns calculator\nMonthly SIP\nOne-Time\n\u20b95,000 per month\nOver the past\n1 year\n3 years\n5 years\nTotal investment of \u20b960,000\nWould have become \u20b956,446 (-5.92%)\nHoldings (69)\nName Sector Instrument Assets\nHDFC Bank Ltd.\nFinancial Equity 8.57%\nICICI Bank Ltd.\nFinancial Equity 6.30%\nReliance Industries Ltd.\nEnergy Equity 4.44%\nAxis Bank Ltd.\nFinancial Equity 4.35%\nMaruti Suzuki India Ltd.\nAutomobile Equity 3.38%\nInfosys Ltd.\nTechnology Equity 3.32%\nKotak Mahindra Bank Ltd.\nFinancial Equity 3.01%\nTata Consultancy Services Ltd.\nTechnology Equity 3.00%\nBharti Airtel Ltd.\nCommunication Equity 2.98%\nState Bank of India\nFinancial Equity 2.78%\nSee All\nMinimum investment amounts\nMin. for 1st investment \u20b9100\nMin. for 2nd investment onwards \u20b9100\nMin. for SIP \u20b9100\nReturns and rankings\nCategory: Equity Flexi Cap\nAnnualised returns\nAbsolute returns\n1Y 3Y 5Y All\nFund returns 4.2% 18.6% 22.1% 19.7%\nCategory average 1.2% 15.6% 16.1% NA\nRank with in category 39 22 8 NA\nUnderstand terms\nPeer Comparison\nEquity, Flexi Cap funds Rating 1Y 3Y Fund Size(Cr)\nInvesco India Flexi Cap Fund Direct Growth\n5\n-0.5% 22.5% 4,680.24\nParag Parikh Flexi Cap Fund Direct Growth\n5\n7.3% 21.9% 1,25,799.63\nHDFC Flexi Cap Direct Plan Growth\n5\n10.2% 21.5% 94,068.73\nHSBC Flexi Cap Fund Direct Growth\n4\n-0.7% 19.5% 5,247.71\nFranklin India Flexi Cap Fund Direct Growth\n4\n2.8% 18.1% 20,021.75\nExpense ratio, exit load and tax\nExpense ratio: 0.71%\nInclusive of GST\nExit load\nNil\nStamp duty\n0.005% (from July 1st, 2020)\nTax implication\nIf you redeem within one year, returns are taxed at 20%. If you redeem after one year, returns exceeding Rs 1.25 lakh in a financial year are taxed at 12.5%.\nUnderstand terms\nCheck past data\nFund management\nArun Agarwal\nMar 2025 - Present\nView details\nNandita Menezes\nMar 2025 - Present\nView details\nFund house & investment objective\nFund house contact details\nPros and cons\nCategory: Equity Flexi Cap\nPros\nConsistently higher annualised returns than category average for the past 1Y, 3Y and 5Y\nHigher alpha: 4.61 The fund has generated returns higher than benchmark - NIFTY 500 Total Return Index - in the last 3Y\nExit load is zero\nLower expense ratio: 0.71%\nCons\nLock-in period: 5Y\nCompare funds\nHDFC Retirement Savings Fund Equity Plan Direct Growth\nVS\nAdd mutual fund to compare\nRecently viewed\nHDFC ELSS Tax Saver Fund\n20.9%\n(3Y)\nHDFC Flexi Cap Fund\n21.5%\n(3Y)\nHDFC Focused Fund\n21.7%\n(3Y)\nHDFC Mid Cap Fund\n25.8%\n(3Y)\nFAQs\nHow to Invest in HDFC Retirement Savings Fund Equity Plan Direct Growth?\nWhat kind of returns does HDFC Retirement Savings Fund Equity Plan Direct Growth provide?\nHow much expense ratio is charged by HDFC Retirement Savings Fund Equity Plan Direct Growth?\n\n\nWhat is the AUM of HDFC Retirement Savings Fund Equity Plan Direct Growth?\nHow to Redeem HDFC Retirement Savings Fund Equity Plan Direct Growth?\nCan I invest in SIP and Lump Sum of HDFC Retirement Savings Fund Equity Plan Direct Growth?\nWhat is the NAV of HDFC Retirement Savings Fund Equity Plan Direct Growth?\nWhat is the PE and PB ratio of HDFC Retirement Savings Fund Equity Plan Direct Growth?\nLooking to invest in mutual funds?\nExplore diversified funds designed for every investor\nInvest Now\nHome\n>\nMutual Funds\n>\nHDFC Mutual Fund\n>\nHDFC Retirement Savings Fund Equity Plan Direct Growth\nVaishnavi Tech Park, South Tower, 3rd Floor\nSarjapur Main Road, Bellandur, Bengaluru \u2013 560103\nKarnataka\nContact Us\nDownload the App\nGROWW\nAbout Us\nPricing\nBlog\nMedia & Press\nCareers\nHelp & Support\nTrust & Safety\nInvestor Relations\nPRODUCTS\nStocks\nF&O\nMTF\nETF\nIPO\nMutual Funds\nCommodities\nGroww Terminal\n915 Terminal\nStocks Screener\nAlgo Trading\nGroww Digest\nDemat Account\nGroww AMC\n\u00a9 2016-2025 Groww. All rights reserved.\nVersion: 7.0.6\nShare Market\nIndices\nF&O\nMutual Funds\nETFs\nFunds By Groww\nCalculators\nIPO\nMiscellaneous\nTop Gainers Stocks\n52 Weeks High Stocks\nTata Motors\nNHPC\nITC\nWipro\nTop Losers Stocks\n52 Weeks Low Stocks\nIREDA\nState Bank of India\nAdani Power\nCDSL\nMost Traded Stocks\nStocks Market Calender\nTata Steel\nTata Power\nBharat Heavy Electricals\nIndian Oil Corporation\nStocks Feed\nSuzlon Energy\nZomato (Eternal)\nYes Bank\nInfosys\nNBCC\nShow More\nOthers:\nNSE\nBSE\nMCX\nTerms and Conditions\nPolicies and Procedures\nRegulatory & Other Info\nPrivacy Policy\nDisclosure\nSMART ODR\nDownload Forms\nInformation Security Practices\nInvestor Charter and Grievance\nBug Bounty",
    "scraped_at": "2025-12-22T03:19:30Z",
    "fund_managers": [
      "Arun Agarwal",
      "Nandita Menezes"
    ]
  },
  {
    "page_url": "https://groww.in/mutual-funds/hdfc-balanced-advantage-fund-direct-growth",
    "fund_name": "HDFC Balanced Advantage Fund Direct Growth - NAV, Mutual Fund Performance & Portfolio",
    "amc_name": "HDFC Mutual Fund",
    "category": "Hybrid",
    "sub_category": "Balanced",
    "plan_type": "Direct",
    "option": "Growth",
    "latest_nav": null,
    "nav_date": "19 Dec 2025",
    "nav_change_pct": "+0.49%",
    "aum": "1,07,971.20Cr",
    "expense_ratio": "0.73%",
    "risk_level": "Very High Risk",
    "rating": "5",
    "min_investment": {
      "lump_sum": null,
      "sip": "100"
    },
    "exit_load": "Exit Load for units in excess of 15% of the investment,1% will be charged for redemption within 1 year.",
    "lock_in_period": null,
    "returns": {
      "1y": "18.1%",
      "3y": "18.1%",
      "5y": "20.3%"
    },
    "full_text": "Stocks\nF&O\nMutual Funds\nMore\nSearch Groww...\n\u2318K\nLogin/Sign up\nHDFC Balanced Advantage Fund Direct Growth\nHybrid\nDynamic Asset Allocation\nVery High Risk\n+\n0\n1\n2\n3\n4\n5\n6\n7\n8\n9\n1\n2\n3\n4\n5\n6\n7\n8\n9\n.\n0\n1\n2\n3\n4\n5\n6\n7\n8\n9\n0\n1\n2\n3\n4\n5\n6\n7\n8\n9\n%\n3Y annualised\n+0.49% 1D\n1M\n6M\n1Y\n3Y\n5Y\nAll\nNAV: 19 Dec 2025\n\u20b9575.95\nRating\n5\nMin. SIP amount\n\u20b9100\nFund size\n\u20b91,07,971.20Cr\nReturns calculator\nMonthly SIP\nOne-Time\n\u20b95,000 per month\nOver the past\n1 year\n3 years\n5 years\nTotal investment of \u20b960,000\nWould have become \u20b960,035 (+0.06%)\nHoldings (338)\nName Sector Instrument Assets\nHDFC Bank Ltd.\nFinancial Equity 5.21%\nICICI Bank Ltd.\nFinancial Equity 4.47%\nReliance Industries Ltd.\nEnergy Equity 4.05%\nBharti Airtel Ltd.\nCommunication Equity 3.26%\nState Bank of India\nFinancial Equity 3.17%\nLarsen & Toubro Ltd.\nConstruction Equity 2.48%\nInfosys Ltd.\nTechnology Equity 2.42%\nAxis Bank Ltd.\nFinancial Equity 2.35%\nGOI\nSovereign GOI Sec 2.10%\nNTPC Ltd.\nEnergy Equity 2.07%\nSee All\nMinimum investment amounts\nMin. for 1st investment \u20b9100\nMin. for 2nd investment onwards \u20b9100\nMin. for SIP \u20b9100\nReturns and rankings\nCategory: Hybrid Dynamic Asset Allocation\nAnnualised returns\nAbsolute returns\n3Y 5Y 10Y All\nFund returns 18.1% 20.3% 15.3% 15.5%\nCategory average 11.7% 11.1% 9.8% NA\nRank with in category 1 1 NA NA\nUnderstand terms\nPeer Comparison\nHybrid, Dynamic Asset Allocation funds Rating 1Y 3Y Fund Size(Cr)\nHDFC Balanced Advantage Fund Direct Growth\n5\n6.4% 18.1% 1,07,971.20\nSBI Balanced Advantage Fund Direct Growth\n5\n9.9% 15.0% 39,337.41\nICICI Prudential Balanced Advantage Direct Growth\n4\n11.9% 14.1% 69,867.93\nDSP Dynamic Asset Allocation Fund Direct Growth\n4\n9.0% 13.7% 3,635.61\nNippon India Balanced Advantage Fund Direct Growth\n4\n7.3% 13.3% 9,662.22\nExpense ratio, exit load and tax\nExpense ratio: 0.73%\nInclusive of GST\nExit load\nExit Load for units in excess of 15% of the investment,1% will be charged for redemption within 1 year.\nStamp duty\n0.005% (from July 1st, 2020)\nTax implication\nIf you redeem within one year, returns are taxed at 20%. If you redeem after one year, returns exceeding Rs 1.25 lakh in a financial year are taxed at 12.5%.\nUnderstand terms\nCheck past data\nFund management\nNandita Menezes\nMar 2025 - Present\nView details\nFund house & investment objective\nFund house contact details\nCompare funds\nHDFC Balanced Advantage Fund Direct Growth\nVS\nAdd mutual fund to compare\nRecently viewed\nHDFC Retirement Savings Fund\n18.6%\n(3Y)\nHDFC ELSS Tax Saver Fund\n20.9%\n(3Y)\nHDFC Flexi Cap Fund\n21.5%\n(3Y)\nHDFC Focused Fund\n21.7%\n(3Y)\nFAQs\nHow to Invest in HDFC Balanced Advantage Fund Direct Growth?\nWhat kind of returns does HDFC Balanced Advantage Fund Direct Growth provide?\nHow much expense ratio is charged by HDFC Balanced Advantage Fund Direct Growth?\n\n\nWhat is the AUM of HDFC Balanced Advantage Fund Direct Growth?\nHow to Redeem HDFC Balanced Advantage Fund Direct Growth?\nCan I invest in SIP and Lump Sum of HDFC Balanced Advantage Fund Direct Growth?\nWhat is the NAV of HDFC Balanced Advantage Fund Direct Growth?\nWhat is the PE and PB ratio of HDFC Balanced Advantage Fund Direct Growth?\nLooking to invest in mutual funds?\nExplore diversified funds designed for every investor\nInvest Now\nHome\n>\nMutual Funds\n>\nHDFC Mutual Fund\n>\nHDFC Balanced Advantage Fund Direct Growth\nVaishnavi Tech Park, South Tower, 3rd Floor\nSarjapur Main Road, Bellandur, Bengaluru \u2013 560103\nKarnataka\nContact Us\nDownload the App\nGROWW\nAbout Us\nPricing\nBlog\nMedia & Press\nCareers\nHelp & Support\nTrust & Safety\nInvestor Relations\nPRODUCTS\nStocks\nF&O\nMTF\nETF\nIPO\nMutual Funds\nCommodities\nGroww Terminal\n915 Terminal\nStocks Screener\nAlgo Trading\nGroww Digest\nDemat Account\nGroww AMC\n\u00a9 2016-2025 Groww. All rights reserved.\nVersion: 7.0.6\nShare Market\nIndices\nF&O\nMutual Funds\nETFs\nFunds By Groww\nCalculators\nIPO\nMiscellaneous\nTop Gainers Stocks\n52 Weeks High Stocks\nTata Motors\nNHPC\nITC\nWipro\nTop Losers Stocks\n52 Weeks Low Stocks\nIREDA\nState Bank of India\nAdani Power\nCDSL\nMost Traded Stocks\nStocks Market Calender\nTata Steel\nTata Power\nBharat Heavy Electricals\nIndian Oil Corporation\nStocks Feed\nSuzlon Energy\nZomato (Eternal)\nYes Bank\nInfosys\nNBCC\nShow More\nOthers:\nNSE\nBSE\nMCX\nTerms and Conditions\nPolicies and Procedures\nRegulatory & Other Info\nPrivacy Policy\nDisclosure\nSMART ODR\nDownload Forms\nInformation Security Practices\nInvestor Charter and Grievance\nBug Bounty",
    "scraped_at": "2025-12-22T03:19:40Z",
    "fund_managers": [
      "Nandita Menezes"
    ]
  },
  {
    "page_url": "https://groww.in/mutual-funds/hdfc-large-cap-fund-direct-growth",
    "fund_name": "HDFC Large Cap Fund Direct Growth - NAV, Mutual Fund Performance & Portfolio",
    "amc_name": "HDFC Mutual Fund",
    "category": "Equity",
    "sub_category": "Large Cap",
    "plan_type": "Direct",
    "option": "Growth",
    "latest_nav": null,
    "nav_date": "19 Dec 2025",
    "nav_change_pct": "+0.56%",
    "aum": "40,617.55Cr",
    "expense_ratio": "0.95%",
    "risk_level": "Very High Risk",
    "rating": "5",
    "min_investment": {
      "lump_sum": null,
      "sip": "100"
    },
    "exit_load": "Exit load of 1% if redeemed within 1 year",
    "lock_in_period": null,
    "returns": {
      "1y": "15.9%",
      "3y": "15.9%",
      "5y": "18.1%"
    },
    "full_text": "Stocks\nF&O\nMutual Funds\nMore\nSearch Groww...\n\u2318K\nLogin/Sign up\nHDFC Large Cap Fund Direct Growth\nEquity\nLarge Cap\nVery High Risk\n+\n0\n1\n2\n3\n4\n5\n6\n7\n8\n9\n0\n1\n2\n3\n4\n5\n6\n7\n8\n9\n.\n2\n3\n4\n5\n6\n7\n8\n9\n0\n1\n2\n3\n4\n5\n6\n7\n8\n9\n%\n3Y annualised\n+0.56% 1D\n1M\n6M\n1Y\n3Y\n5Y\nAll\nNAV: 19 Dec 2025\n\u20b91,270.36\nRating\n5\nMin. SIP amount\n\u20b9100\nFund size\n\u20b940,617.55Cr\nReturns calculator\nMonthly SIP\nOne-Time\n\u20b95,000 per month\nOver the past\n1 year\n3 years\n5 years\nTotal investment of \u20b960,000\nWould have become \u20b959,141 (-1.43%)\nHoldings (50)\nName Sector Instrument Assets\nHDFC Bank Ltd.\nFinancial Equity 9.49%\nICICI Bank Ltd.\nFinancial Equity 9.31%\nBharti Airtel Ltd.\nCommunication Equity 6.17%\nReliance Industries Ltd.\nEnergy Equity 6.08%\nKotak Mahindra Bank Ltd.\nFinancial Equity 4.26%\nTitan Company Ltd.\nConsumer Discretionary Equity 3.97%\nAxis Bank Ltd.\nFinancial Equity 3.37%\nInfosys Ltd.\nTechnology Equity 3.31%\nAmbuja Cements Ltd.\nConstruction Equity 3.02%\nTorrent Pharmaceuticals Ltd.\nHealthcare Equity 2.91%\nSee All\nMinimum investment amounts\nMin. for 1st investment \u20b9100\nMin. for 2nd investment onwards \u20b9100\nMin. for SIP \u20b9100\nReturns and rankings\nCategory: Equity Large Cap\nAnnualised returns\nAbsolute returns\n3Y 5Y 10Y All\nFund returns 15.9% 18.1% 14.6% 14.1%\nCategory average 14.5% 15.2% 13.4% NA\nRank with in category 36 6 9 NA\nUnderstand terms\nPeer Comparison\nEquity, Large Cap funds Rating 1Y 3Y Fund Size(Cr)\nNippon India Large Cap Fund Direct Growth\n5\n7.5% 19.5% 50,312.32\nDSP Large Cap Fund Direct Growth\n5\n8.0% 18.5% 6,933.59\nICICI Prudential Large Cap Fund Direct Growth\n5\n9.7% 18.2% 78,159.80\nCanara Robeco Large Cap Fund Direct Growth\n4\n6.7% 16.2% 17,233.68\nHDFC Large Cap Fund Direct Growth\n5\n6.7% 15.9% 40,617.55\nExpense ratio, exit load and tax\nExpense ratio: 0.95%\nInclusive of GST\nExit load\nExit load of 1% if redeemed within 1 year\nStamp duty\n0.005% (from July 1st, 2020)\nTax implication\nIf you redeem within one year, returns are taxed at 20%. If you redeem after one year, returns exceeding Rs 1.25 lakh in a financial year are taxed at 12.5%.\nUnderstand terms\nCheck past data\nFund management\nRahul Baijal\nJul 2022 - Present\nView details\nDhruv Muchhal\nJun 2023 - Present\nView details\nFund house & investment objective\nFund house contact details\nCompare funds\nHDFC Large Cap Fund Direct Growth\nVS\nAdd mutual fund to compare\nRecently viewed\nHDFC Balanced Advantage Fund\n18.1%\n(3Y)\nHDFC Retirement Savings Fund\n18.6%\n(3Y)\nHDFC ELSS Tax Saver Fund\n20.9%\n(3Y)\nHDFC Flexi Cap Fund\n21.5%\n(3Y)\nFAQs\nHow to Invest in HDFC Large Cap Fund Direct Growth?\nWhat kind of returns does HDFC Large Cap Fund Direct Growth provide?\nHow much expense ratio is charged by HDFC Large Cap Fund Direct Growth?\n\n\nWhat is the AUM of HDFC Large Cap Fund Direct Growth?\nHow to Redeem HDFC Large Cap Fund Direct Growth?\nCan I invest in SIP and Lump Sum of HDFC Large Cap Fund Direct Growth?\nWhat is the NAV of HDFC Large Cap Fund Direct Growth?\nWhat is the PE and PB ratio of HDFC Large Cap Fund Direct Growth?\nLooking to invest in mutual funds?\nExplore diversified funds designed for every investor\nInvest Now\nHome\n>\nMutual Funds\n>\nHDFC Mutual Fund\n>\nHDFC Large Cap Fund Direct Growth\nVaishnavi Tech Park, South Tower, 3rd Floor\nSarjapur Main Road, Bellandur, Bengaluru \u2013 560103\nKarnataka\nContact Us\nDownload the App\nGROWW\nAbout Us\nPricing\nBlog\nMedia & Press\nCareers\nHelp & Support\nTrust & Safety\nInvestor Relations\nPRODUCTS\nStocks\nF&O\nMTF\nETF\nIPO\nMutual Funds\nCommodities\nGroww Terminal\n915 Terminal\nStocks Screener\nAlgo Trading\nGroww Digest\nDemat Account\nGroww AMC\n\u00a9 2016-2025 Groww. All rights reserved.\nVersion: 7.0.6\nShare Market\nIndices\nF&O\nMutual Funds\nETFs\nFunds By Groww\nCalculators\nIPO\nMiscellaneous\nTop Gainers Stocks\n52 Weeks High Stocks\nTata Motors\nNHPC\nITC\nWipro\nTop Losers Stocks\n52 Weeks Low Stocks\nIREDA\nState Bank of India\nAdani Power\nCDSL\nMost Traded Stocks\nStocks Market Calender\nTata Steel\nTata Power\nBharat Heavy Electricals\nIndian Oil Corporation\nStocks Feed\nSuzlon Energy\nZomato (Eternal)\nYes Bank\nInfosys\nNBCC\nShow More\nOthers:\nNSE\nBSE\nMCX\nTerms and Conditions\nPolicies and Procedures\nRegulatory & Other Info\nPrivacy Policy\nDisclosure\nSMART ODR\nDownload Forms\nInformation Security Practices\nInvestor Charter and Grievance\nBug Bounty",
    "scraped_at": "2025-12-22T03:19:50Z",
    "fund_managers": [
      "Rahul Baijal",
      "Dhruv Muchhal"
    ]
  },
  {
    "page_url": "https://groww.in/mutual-funds/hdfc-i-come-plus-arbitrage-active-fof-direct-growth",
    "fund_name": "HDFC Income Plus Arbitrage Active FoF Direct Growth - NAV, Mutual Fund Performance & Portfolio",
    "amc_name": "HDFC Mutual Fund",
    "category": "Debt",
    "sub_category": "Large Cap",
    "plan_type": "Direct",
    "option": "Growth",
    "latest_nav": null,
    "nav_date": "19 Dec 2025",
    "nav_change_pct": "+0.02%",
    "aum": "2,131.98Cr",
    "expense_ratio": "0.07%",
    "risk_level": "Moderate Risk",
    "rating": null,
    "min_investment": {
      "lump_sum": null,
      "sip": "100"
    },
    "exit_load": "Nil",
    "lock_in_period": null,
    "returns": {
      "1y": "12.4%",
      "3y": "12.4%",
      "5y": "13.8%"
    },
    "full_text": "Stocks\nF&O\nMutual Funds\nMore\nSearch Groww...\n\u2318K\nLogin/Sign up\nHDFC Income Plus Arbitrage Active FoF Direct Growth\nDebt\nOthers\nModerate Risk\n+\n0\n1\n2\n3\n4\n5\n6\n7\n8\n9\n0\n1\n2\n3\n4\n5\n6\n7\n8\n9\n.\n0\n1\n2\n3\n4\n5\n6\n7\n8\n9\n0\n1\n2\n3\n4\n5\n6\n7\n8\n9\n%\n3Y annualised\n+0.02% 1D\n1M\n6M\n1Y\n3Y\n5Y\nAll\nNAV: 19 Dec 2025\n\u20b943.98\nRating\nNA\nMin. SIP amount\n\u20b9100\nFund size\n\u20b92,131.98Cr\nReturns calculator\nMonthly SIP\nOne-Time\n\u20b95,000 per month\nOver the past\n1 year\n3 years\n5 years\nTotal investment of \u20b960,000\nWould have become \u20b961,136 (+1.89%)\nHoldings (3)\nName Sector Instrument Assets\nHDFC Corporate Bond Fund Direct Plan-Growth\nNA Mutual Fund 53.83%\nHDFC Arbitrage Fund Wholesale Direct-Growth\nNA Mutual Fund 39.19%\nHDFC Money Market Fund Direct-Growth\nNA Mutual Fund 6.66%\nMinimum investment amounts\nMin. for 1st investment \u20b9100\nMin. for 2nd investment onwards \u20b9100\nMin. for SIP \u20b9100\nReturns and rankings\nCategory: Debt Others\nAnnualised returns\nAbsolute returns\n3Y 5Y 10Y All\nFund returns 12.4% 13.8% 12.3% 11.4%\nCategory average NA NA NA NA\nRank with in category NA NA NA NA\nUnderstand terms\nExpense ratio, exit load and tax\nExpense ratio: 0.07%\nInclusive of GST\nExit load\nNil\nStamp duty\n0.005% (from July 1st, 2020)\nTax implication\nIf you redeem within two years, returns are taxed as per your Income Tax slab. If you redeem after two years, returns exceeding Rs 1.25 lakh in a financial year are taxed at 12.5%.\nUnderstand terms\nCheck past data\nFund management\nAnil Bamboli\nJun 2014 - Present\nView details\nSrinivasan Ramamurthy\nJan 2022 - Present\nView details\nFund house & investment objective\nFund house contact details\nPros and cons\nCategory: Debt Others\nPros\nHigher alpha: 4.59 The fund has generated returns higher than benchmark - NIFTY 50 Hybrid Composite Debt 65:35 Index - in the last 3Y\nLower expense ratio: 0.07%\nAverage credit rating of the fund's holdings: AAA This fund has holdings of the highest quality\nExit load is zero\nCons\n1Y annualised returns lower than category average by 6.39%\nCompare funds\nHDFC Income Plus Arbitrage Active FoF Direct Growth\nVS\nAdd mutual fund to compare\nRecently viewed\nHDFC Large Cap Fund\n15.9%\n(3Y)\nHDFC Balanced Advantage Fund\n18.1%\n(3Y)\nHDFC Retirement Savings Fund\n18.6%\n(3Y)\nHDFC ELSS Tax Saver Fund\n20.9%\n(3Y)\nFAQs\nHow to Invest in HDFC Income Plus Arbitrage Active FoF Direct Growth?\nWhat kind of returns does HDFC Income Plus Arbitrage Active FoF Direct Growth provide?\nHow much expense ratio is charged by HDFC Income Plus Arbitrage Active FoF Direct Growth?\n\n\nWhat is the AUM of HDFC Income Plus Arbitrage Active FoF Direct Growth?\nHow to Redeem HDFC Income Plus Arbitrage Active FoF Direct Growth?\nCan I invest in SIP and Lump Sum of HDFC Income Plus Arbitrage Active FoF Direct Growth?\nWhat is the NAV of HDFC Income Plus Arbitrage Active FoF Direct Growth?\nWhat is the PE and PB ratio of HDFC Income Plus Arbitrage Active FoF Direct Growth?\nLooking to invest in mutual funds?\nExplore diversified funds designed for every investor\nInvest Now\nHome\n>\nMutual Funds\n>\nHDFC Mutual Fund\n>\nHDFC Income Plus Arbitrage Active FoF Direct Growth\nVaishnavi Tech Park, South Tower, 3rd Floor\nSarjapur Main Road, Bellandur, Bengaluru \u2013 560103\nKarnataka\nContact Us\nDownload the App\nGROWW\nAbout Us\nPricing\nBlog\nMedia & Press\nCareers\nHelp & Support\nTrust & Safety\nInvestor Relations\nPRODUCTS\nStocks\nF&O\nMTF\nETF\nIPO\nMutual Funds\nCommodities\nGroww Terminal\n915 Terminal\nStocks Screener\nAlgo Trading\nGroww Digest\nDemat Account\nGroww AMC\n\u00a9 2016-2025 Groww. All rights reserved.\nVersion: 7.0.6\nShare Market\nIndices\nF&O\nMutual Funds\nETFs\nFunds By Groww\nCalculators\nIPO\nMiscellaneous\nTop Gainers Stocks\n52 Weeks High Stocks\nTata Motors\nNHPC\nITC\nWipro\nTop Losers Stocks\n52 Weeks Low Stocks\nIREDA\nState Bank of India\nAdani Power\nCDSL\nMost Traded Stocks\nStocks Market Calender\nTata Steel\nTata Power\nBharat Heavy Electricals\nIndian Oil Corporation\nStocks Feed\nSuzlon Energy\nZomato (Eternal)\nYes Bank\nInfosys\nNBCC\nShow More\nOthers:\nNSE\nBSE\nMCX\nTerms and Conditions\nPolicies and Procedures\nRegulatory & Other Info\nPrivacy Policy\nDisclosure\nSMART ODR\nDownload Forms\nInformation Security Practices\nInvestor Charter and Grievance\nBug Bounty",
    "scraped_at": "2025-12-22T03:19:59Z",
    "fund_managers": [
      "Anil Bamboli",
      "Srinivasan Ramamurthy"
    ]
  },
  {
    "page_url": "https://groww.in/mutual-funds/hdfc-short-term-opportunities-fund-direct-growth",
    "fund_name": "HDFC Short Term Debt Fund Direct Plan Growth - NAV, Mutual Fund Performance & Portfolio",
    "amc_name": "HDFC Mutual Fund",
    "category": "Debt",
    "sub_category": "Large Cap",
    "plan_type": "Direct",
    "option": "Growth",
    "latest_nav": null,
    "nav_date": "19 Dec 2025",
    "nav_change_pct": "+0.01%",
    "aum": "18,411.94Cr",
    "expense_ratio": "0.40%",
    "risk_level": "Moderate Risk",
    "rating": "5",
    "min_investment": {
      "lump_sum": null,
      "sip": "100"
    },
    "exit_load": "Nil",
    "lock_in_period": null,
    "returns": {
      "1y": "8.1%",
      "3y": "8.1%",
      "5y": "6.5%"
    },
    "full_text": "Stocks\nF&O\nMutual Funds\nMore\nSearch Groww...\n\u2318K\nLogin/Sign up\nHDFC Short Term Debt Fund Direct Plan Growth\nDebt\nShort Duration\nModerate Risk\n+\n1\n2\n3\n4\n5\n6\n7\n8\n9\n.\n0\n1\n2\n3\n4\n5\n6\n7\n8\n9\n0\n1\n2\n3\n4\n5\n6\n7\n8\n9\n%\n3Y annualised\n+0.01% 1D\n1M\n6M\n1Y\n3Y\n5Y\nAll\nNAV: 19 Dec 2025\n\u20b934.05\nRating\n5\nMin. SIP amount\n\u20b9100\nFund size\n\u20b918,411.94Cr\nReturns calculator\nMonthly SIP\nOne-Time\n\u20b95,000 per month\nOver the past\n1 year\n3 years\n5 years\nTotal investment of \u20b960,000\nWould have become \u20b962,119 (+3.53%)\nHoldings (159)\nName Sector Instrument Assets\nGOI\nSovereign GOI Sec 2.82%\nAditya Birla Renewables Ltd.\nEnergy Bonds/NCD 2.40%\nJubilant Beverages Ltd.\nConsumer Staples Debenture 2.23%\nJTPM Metal Traders Ltd.\nMetals & Mining Debenture 2.01%\nGOI\nSovereign GOI Sec 1.95%\nJamnagar Utilities and Power Pvt. Ltd.\nCapital Goods Debenture 1.95%\nShivshakti Securitisation Trust\nOthers Sec. Debt 1.95%\nGOI\nSovereign GOI Sec 1.40%\nNational Bank For Agriculture & Rural Development\nFinancial Debenture 1.39%\nPipeline Infrastructure (India) Pvt. Ltd.\nConstruction Debenture 1.38%\nSee All\nMinimum investment amounts\nMin. for 1st investment \u20b9100\nMin. for 2nd investment onwards \u20b9100\nMin. for SIP \u20b9100\nReturns and rankings\nCategory: Debt Short Duration\nAnnualised returns\nAbsolute returns\n3Y 5Y 10Y All\nFund returns 8.1% 6.5% 7.7% 8.1%\nCategory average 7.1% 5.8% 6.6% NA\nRank with in category 6 8 6 NA\nUnderstand terms\nPeer Comparison\nDebt, Short Duration funds Rating 1Y 3Y Fund Size(Cr)\nICICI Prudential Short Term Fund Direct Plan Growth\n5\n8.6% 8.3% 23,701.83\nNippon India Short Duration Fund Direct Growth\n4\n8.6% 8.2% 9,795.78\nAditya Birla Sun Life Short Term Direct Fund Direct Growth\n4\n8.4% 8.2% 11,363.45\nHDFC Short Term Debt Fund Direct Plan Growth\n5\n8.2% 8.1% 18,411.94\nBaroda BNP Paribas Short Duration Fund Direct Fund Growth\n4\n8.2% 8.0% 307.51\nExpense ratio, exit load and tax\nExpense ratio: 0.40%\nInclusive of GST\nExit load\nNil\nStamp duty\n0.005% (from July 1st, 2020)\nTax implication\nReturns are taxed as per your Income Tax slab.\nUnderstand terms\nCheck past data\nFund management\nAnil Bamboli\nDec 2012 - Present\nView details\nDhruv Muchhal\nJun 2023 - Present\nView details\nFund house & investment objective\nFund house contact details\nCompare funds\nHDFC Short Term Debt Fund Direct Plan Growth\nVS\nAdd mutual fund to compare\nRecently viewed\nHDFC Income Plus Arbitrage Active FoF Fund\n12.4%\n(3Y)\nHDFC Large Cap Fund\n15.9%\n(3Y)\nHDFC Balanced Advantage Fund\n18.1%\n(3Y)\nHDFC Retirement Savings Fund\n18.6%\n(3Y)\nFAQs\nHow to Invest in HDFC Short Term Debt Fund Direct Plan Growth?\nWhat kind of returns does HDFC Short Term Debt Fund Direct Plan Growth provide?\nHow much expense ratio is charged by HDFC Short Term Debt Fund Direct Plan Growth?\n\n\nWhat is the AUM of HDFC Short Term Debt Fund Direct Plan Growth?\nHow to Redeem HDFC Short Term Debt Fund Direct Plan Growth?\nCan I invest in SIP and Lump Sum of HDFC Short Term Debt Fund Direct Plan Growth?\nWhat is the NAV of HDFC Short Term Debt Fund Direct Plan Growth?\nWhat is the PE and PB ratio of HDFC Short Term Debt Fund Direct Plan Growth?\nLooking to invest in mutual funds?\nExplore diversified funds designed for every investor\nInvest Now\nHome\n>\nMutual Funds\n>\nHDFC Mutual Fund\n>\nHDFC Short Term Debt Fund Direct Plan Growth\nVaishnavi Tech Park, South Tower, 3rd Floor\nSarjapur Main Road, Bellandur, Bengaluru \u2013 560103\nKarnataka\nContact Us\nDownload the App\nGROWW\nAbout Us\nPricing\nBlog\nMedia & Press\nCareers\nHelp & Support\nTrust & Safety\nInvestor Relations\nPRODUCTS\nStocks\nF&O\nMTF\nETF\nIPO\nMutual Funds\nCommodities\nGroww Terminal\n915 Terminal\nStocks Screener\nAlgo Trading\nGroww Digest\nDemat Account\nGroww AMC\n\u00a9 2016-2025 Groww. All rights reserved.\nVersion: 7.0.6\nShare Market\nIndices\nF&O\nMutual Funds\nETFs\nFunds By Groww\nCalculators\nIPO\nMiscellaneous\nTop Gainers Stocks\n52 Weeks High Stocks\nTata Motors\nNHPC\nITC\nWipro\nTop Losers Stocks\n52 Weeks Low Stocks\nIREDA\nState Bank of India\nAdani Power\nCDSL\nMost Traded Stocks\nStocks Market Calender\nTata Steel\nTata Power\nBharat Heavy Electricals\nIndian Oil Corporation\nStocks Feed\nSuzlon Energy\nZomato (Eternal)\nYes Bank\nInfosys\nNBCC\nShow More\nOthers:\nNSE\nBSE\nMCX\nTerms and Conditions\nPolicies and Procedures\nRegulatory & Other Info\nPrivacy Policy\nDisclosure\nSMART ODR\nDownload Forms\nInformation Security Practices\nInvestor Charter and Grievance\nBug Bounty",
    "scraped_at": "2025-12-22T03:20:09Z",
    "fund_managers": [
      "Anil Bamboli",
      "Dhruv Muchhal"
    ]
  },
  {
    "page_url": "https://groww.in/mutual-funds/hdfc-infrastructure-fund-direct-growth",
    "fund_name": "HDFC Infrastructure Fund Direct Growth - NAV, Mutual Fund Performance & Portfolio",
    "amc_name": "HDFC Mutual Fund",
    "category": "Equity",
    "sub_category": "Large Cap",
    "plan_type": "Direct",
    "option": "Growth",
    "latest_nav": null,
    "nav_date": "19 Dec 2025",
    "nav_change_pct": "+0.87%",
    "aum": "2,514.15Cr",
    "expense_ratio": "1.15%",
    "risk_level": "Very High Risk",
    "rating": "4",
    "min_investment": {
      "lump_sum": null,
      "sip": "100"
    },
    "exit_load": "Exit load of 1%, if redeemed within 30 days.",
    "lock_in_period": null,
    "returns": {
      "1y": "24.6%",
      "3y": "24.6%",
      "5y": "28.4%"
    },
    "full_text": "Stocks\nF&O\nMutual Funds\nMore\nSearch Groww...\n\u2318K\nLogin/Sign up\nHDFC Infrastructure Fund Direct Growth\nEquity\nSectoral\nVery High Risk\n+\n0\n1\n2\n3\n4\n5\n6\n7\n8\n9\n0\n1\n2\n3\n4\n5\n6\n7\n8\n9\n.\n0\n1\n2\n3\n4\n5\n6\n7\n8\n9\n2\n3\n4\n5\n6\n7\n8\n9\n%\n3Y annualised\n+0.87% 1D\n1M\n6M\n1Y\n3Y\n5Y\nAll\nNAV: 19 Dec 2025\n\u20b952.04\nRating\n4\nMin. SIP amount\n\u20b9100\nFund size\n\u20b92,514.15Cr\nReturns calculator\nMonthly SIP\nOne-Time\n\u20b95,000 per month\nOver the past\n1 year\n3 years\n5 years\nTotal investment of \u20b960,000\nWould have become \u20b961,671 (+2.79%)\nHoldings (57)\nName Sector Instrument Assets\nLarsen & Toubro Ltd.\nConstruction Equity 6.15%\nICICI Bank Ltd.\nFinancial Equity 6.08%\nHDFC Bank Ltd.\nFinancial Equity 5.61%\nKalpataru Projects International Ltd.\nCapital Goods Equity 3.62%\nInterglobe Aviation Ltd.\nServices Equity 3.52%\nJ Kumar Infraprojects Ltd.\nConstruction Equity 3.26%\nReliance Industries Ltd.\nEnergy Equity 3.12%\nBharti Airtel Ltd.\nCommunication Equity 2.93%\nNTPC Ltd.\nEnergy Equity 2.86%\nState Bank of India\nFinancial Equity 2.74%\nSee All\nMinimum investment amounts\nMin. for 1st investment \u20b9100\nMin. for 2nd investment onwards \u20b9100\nMin. for SIP \u20b9100\nReturns and rankings\nCategory: Equity Sectoral\nAnnualised returns\nAbsolute returns\n3Y 5Y 10Y All\nFund returns 24.6% 28.4% 12.4% 12.6%\nCategory average 21.2% 24.9% 15.6% NA\nRank with in category 6 3 19 NA\nUnderstand terms\nExpense ratio, exit load and tax\nExpense ratio: 1.15%\nInclusive of GST\nExit load\nExit load of 1%, if redeemed within 30 days.\nStamp duty\n0.005% (from July 1st, 2020)\nTax implication\nIf you redeem within one year, returns are taxed at 20%. If you redeem after one year, returns exceeding Rs 1.25 lakh in a financial year are taxed at 12.5%.\nUnderstand terms\nCheck past data\nFund management\nAshish Shah\nOct 2025 - Present\nView details\nFund house & investment objective\nFund house contact details\nPros and cons\nCategory: Equity Sectoral\nPros\nLower expense ratio: 1.15%\nConsistently higher annualised returns than category average for the past 1Y, 3Y and 5Y\nHigher alpha: 7.12 The fund has generated returns higher than benchmark - BSE India Infrastructure Total Return Index - in the last 3Y\nCons\n10Y annualised returns lower than category average by 3.23%\nCompare funds\nHDFC Infrastructure Fund Direct Growth\nVS\nAdd mutual fund to compare\nRecently viewed\nHDFC Short Term Debt Fund\n8.1%\n(3Y)\nHDFC Income Plus Arbitrage Active FoF Fund\n12.4%\n(3Y)\nHDFC Large Cap Fund\n15.9%\n(3Y)\nHDFC Balanced Advantage Fund\n18.1%\n(3Y)\nFAQs\nHow to Invest in HDFC Infrastructure Fund Direct Growth?\nWhat kind of returns does HDFC Infrastructure Fund Direct Growth provide?\nHow much expense ratio is charged by HDFC Infrastructure Fund Direct Growth?\n\n\nWhat is the AUM of HDFC Infrastructure Fund Direct Growth?\nHow to Redeem HDFC Infrastructure Fund Direct Growth?\nCan I invest in SIP and Lump Sum of HDFC Infrastructure Fund Direct Growth?\nWhat is the NAV of HDFC Infrastructure Fund Direct Growth?\nWhat is the PE and PB ratio of HDFC Infrastructure Fund Direct Growth?\nLooking to invest in mutual funds?\nExplore diversified funds designed for every investor\nInvest Now\nHome\n>\nMutual Funds\n>\nHDFC Mutual Fund\n>\nHDFC Infrastructure Fund Direct Growth\nVaishnavi Tech Park, South Tower, 3rd Floor\nSarjapur Main Road, Bellandur, Bengaluru \u2013 560103\nKarnataka\nContact Us\nDownload the App\nGROWW\nAbout Us\nPricing\nBlog\nMedia & Press\nCareers\nHelp & Support\nTrust & Safety\nInvestor Relations\nPRODUCTS\nStocks\nF&O\nMTF\nETF\nIPO\nMutual Funds\nCommodities\nGroww Terminal\n915 Terminal\nStocks Screener\nAlgo Trading\nGroww Digest\nDemat Account\nGroww AMC\n\u00a9 2016-2025 Groww. All rights reserved.\nVersion: 7.0.6\nShare Market\nIndices\nF&O\nMutual Funds\nETFs\nFunds By Groww\nCalculators\nIPO\nMiscellaneous\nTop Gainers Stocks\n52 Weeks High Stocks\nTata Motors\nNHPC\nITC\nWipro\nTop Losers Stocks\n52 Weeks Low Stocks\nIREDA\nState Bank of India\nAdani Power\nCDSL\nMost Traded Stocks\nStocks Market Calender\nTata Steel\nTata Power\nBharat Heavy Electricals\nIndian Oil Corporation\nStocks Feed\nSuzlon Energy\nZomato (Eternal)\nYes Bank\nInfosys\nNBCC\nShow More\nOthers:\nNSE\nBSE\nMCX\nTerms and Conditions\nPolicies and Procedures\nRegulatory & Other Info\nPrivacy Policy\nDisclosure\nSMART ODR\nDownload Forms\nInformation Security Practices\nInvestor Charter and Grievance\nBug Bounty",
    "scraped_at": "2025-12-22T03:20:18Z",
    "fund_managers": [
      "Ashish Shah"
    ]
  },
  {
    "page_url": "https://groww.in/mutual-funds/hdfc-multi-cap-fund-direct-growth",
    "fund_name": "HDFC Multi Cap Fund Direct Growth - NAV, Mutual Fund Performance & Portfolio",
    "amc_name": "HDFC Mutual Fund",
    "category": "Equity",
    "sub_category": "Large Cap",
    "plan_type": "Direct",
    "option": "Growth",
    "latest_nav": null,
    "nav_date": "19 Dec 2025",
    "nav_change_pct": "+0.79%",
    "aum": "19,910.92Cr",
    "expense_ratio": "0.77%",
    "risk_level": "Very High Risk",
    "rating": "4",
    "min_investment": {
      "lump_sum": null,
      "sip": "100"
    },
    "exit_load": "Exit load of 1% if redeemed within 1 year.",
    "lock_in_period": null,
    "returns": {
      "1y": null,
      "3y": null,
      "5y": null
    },
    "full_text": "Stocks\nF&O\nMutual Funds\nMore\nSearch Groww...\n\u2318K\nLogin/Sign up\nHDFC Multi Cap Fund Direct Growth\nEquity\nMulti Cap\nVery High Risk\n+\n0\n1\n2\n3\n4\n5\n6\n7\n8\n9\n0\n1\n2\n3\n4\n5\n6\n7\n8\n9\n.\n0\n1\n2\n3\n4\n5\n6\n7\n8\n9\n0\n1\n2\n3\n4\n5\n6\n7\n8\n9\n%\n3Y annualised\n+0.79% 1D\n1M\n6M\n1Y\n3Y\nAll\nNAV: 19 Dec 2025\n\u20b920.08\nRating\n4\nMin. SIP amount\n\u20b9100\nFund size\n\u20b919,910.92Cr\nReturns calculator\nMonthly SIP\nOne-Time\n\u20b95,000 per month\nOver the past\n6 months\n1 year\n3 years\nTotal investment of \u20b930,000\nWould have become \u20b930,208 (+0.69%)\nHoldings (162)\nName Sector Instrument Assets\nHDFC Bank Ltd.\nFinancial Equity 4.56%\nICICI Bank Ltd.\nFinancial Equity 3.03%\nReliance Industries Ltd.\nEnergy Equity 2.83%\nAxis Bank Ltd.\nFinancial Equity 2.50%\nBritannia Industries Ltd.\nConsumer Staples Equity 2.31%\nBharti Airtel Ltd.\nCommunication Equity 2.21%\nInfosys Ltd.\nTechnology Equity 1.83%\nMahindra & Mahindra Ltd.\nAutomobile Equity 1.57%\nKotak Mahindra Bank Ltd.\nFinancial Equity 1.44%\nICICI Lombard General Insurance Company Ltd.\nInsurance Equity 1.41%\nSee All\nMinimum investment amounts\nMin. for 1st investment \u20b9100\nMin. for 2nd investment onwards \u20b9100\nMin. for SIP \u20b9100\nReturns and rankings\nCategory: Equity Multi Cap\nAnnualised returns\nAbsolute returns\n6M 1Y 3Y All\nFund returns NA 1.3% 20.7% 18.9%\nCategory average NA -0.3% 17.9% NA\nRank with in category NA 22 5 NA\nUnderstand terms\nPeer Comparison\nEquity, Multi Cap funds Rating 1Y 3Y Fund Size(Cr)\nKotak Multicap Fund Direct Growth\n4\n4.0% 24.1% 21,541.46\nAxis Multicap Fund Direct Growth\n4\n0.8% 22.9% 9,099.31\nNippon India Multi Cap Fund Direct Growth\n5\n2.5% 21.7% 50,048.31\nHDFC Multi Cap Fund Direct Growth\n4\n1.3% 20.7% 19,910.92\nICICI Prudential Multicap Fund Direct Plan Growth\n4\n3.2% 19.6% 16,148.21\nExpense ratio, exit load and tax\nExpense ratio: 0.77%\nInclusive of GST\nExit load\nExit load of 1% if redeemed within 1 year.\nStamp duty\n0.005% (from July 1st, 2020)\nTax implication\nIf you redeem within one year, returns are taxed at 20%. If you redeem after one year, returns exceeding Rs 1.25 lakh in a financial year are taxed at 12.5%.\nUnderstand terms\nCheck past data\nFund management\nAmar Kalkundrikar\nAug 2025 - Present\nView details\nFund house & investment objective\nFund house contact details\nCompare funds\nHDFC Multi Cap Fund Direct Growth\nVS\nAdd mutual fund to compare\nRecently viewed\nHDFC Infrastructure Fund\n24.6%\n(3Y)\nHDFC Short Term Debt Fund\n8.1%\n(3Y)\nHDFC Income Plus Arbitrage Active FoF Fund\n12.4%\n(3Y)\nHDFC Large Cap Fund\n15.9%\n(3Y)\nFAQs\nHow to Invest in HDFC Multi Cap Fund Direct Growth?\nWhat kind of returns does HDFC Multi Cap Fund Direct Growth provide?\nHow much expense ratio is charged by HDFC Multi Cap Fund Direct Growth?\n\n\nWhat is the AUM of HDFC Multi Cap Fund Direct Growth?\nHow to Redeem HDFC Multi Cap Fund Direct Growth?\nCan I invest in SIP and Lump Sum of HDFC Multi Cap Fund Direct Growth?\nWhat is the NAV of HDFC Multi Cap Fund Direct Growth?\nWhat is the PE and PB ratio of HDFC Multi Cap Fund Direct Growth?\nLooking to invest in mutual funds?\nExplore diversified funds designed for every investor\nInvest Now\nHome\n>\nMutual Funds\n>\nHDFC Mutual Fund\n>\nHDFC Multi Cap Fund Direct Growth\nVaishnavi Tech Park, South Tower, 3rd Floor\nSarjapur Main Road, Bellandur, Bengaluru \u2013 560103\nKarnataka\nContact Us\nDownload the App\nGROWW\nAbout Us\nPricing\nBlog\nMedia & Press\nCareers\nHelp & Support\nTrust & Safety\nInvestor Relations\nPRODUCTS\nStocks\nF&O\nMTF\nETF\nIPO\nMutual Funds\nCommodities\nGroww Terminal\n915 Terminal\nStocks Screener\nAlgo Trading\nGroww Digest\nDemat Account\nGroww AMC\n\u00a9 2016-2025 Groww. All rights reserved.\nVersion: 7.0.6\nShare Market\nIndices\nF&O\nMutual Funds\nETFs\nFunds By Groww\nCalculators\nIPO\nMiscellaneous\nTop Gainers Stocks\n52 Weeks High Stocks\nTata Motors\nNHPC\nITC\nWipro\nTop Losers Stocks\n52 Weeks Low Stocks\nIREDA\nState Bank of India\nAdani Power\nCDSL\nMost Traded Stocks\nStocks Market Calender\nTata Steel\nTata Power\nBharat Heavy Electricals\nIndian Oil Corporation\nStocks Feed\nSuzlon Energy\nZomato (Eternal)\nYes Bank\nInfosys\nNBCC\nShow More\nOthers:\nNSE\nBSE\nMCX\nTerms and Conditions\nPolicies and Procedures\nRegulatory & Other Info\nPrivacy Policy\nDisclosure\nSMART ODR\nDownload Forms\nInformation Security Practices\nInvestor Charter and Grievance\nBug Bounty",
    "scraped_at": "2025-12-22T03:20:27Z",
    "fund_managers": [
      "Amar Kalkundrikar"
    ]
  },
  {
    "page_url": "https://groww.in/mutual-funds/hdfc-small-cap-fund-direct-growth",
    "fund_name": "HDFC Small Cap Fund Direct Growth - NAV, Mutual Fund Performance & Portfolio",
    "amc_name": "HDFC Mutual Fund",
    "category": "Equity",
    "sub_category": "Small Cap",
    "plan_type": "Direct",
    "option": "Growth",
    "latest_nav": null,
    "nav_date": "19 Dec 2025",
    "nav_change_pct": "+0.93%",
    "aum": "38,020.31Cr",
    "expense_ratio": "0.67%",
    "risk_level": "Very High Risk",
    "rating": "4",
    "min_investment": {
      "lump_sum": null,
      "sip": "100"
    },
    "exit_load": "Exit load of 1% if redeemed within 1 year",
    "lock_in_period": null,
    "returns": {
      "1y": "20.8%",
      "3y": "20.8%",
      "5y": "26.3%"
    },
    "full_text": "Stocks\nF&O\nMutual Funds\nMore\nSearch Groww...\n\u2318K\nLogin/Sign up\nHDFC Small Cap Fund Direct Growth\nEquity\nSmall Cap\nVery High Risk\n+\n0\n1\n2\n3\n4\n5\n6\n7\n8\n9\n0\n1\n2\n3\n4\n5\n6\n7\n8\n9\n.\n1\n2\n3\n4\n5\n6\n7\n8\n9\n0\n1\n2\n3\n4\n5\n6\n7\n8\n9\n%\n3Y annualised\n+0.93% 1D\n1M\n6M\n1Y\n3Y\n5Y\nAll\nNAV: 19 Dec 2025\n\u20b9157.60\nRating\n4\nMin. SIP amount\n\u20b9100\nFund size\n\u20b938,020.31Cr\nReturns calculator\nMonthly SIP\nOne-Time\n\u20b95,000 per month\nOver the past\n1 year\n3 years\n5 years\nTotal investment of \u20b960,000\nWould have become \u20b953,126 (-11.46%)\nHoldings (83)\nName Sector Instrument Assets\nFirstsource Solutions Ltd.\nServices Equity 5.03%\nAster DM Healthcare Ltd.\nHealthcare Equity 4.19%\neClerx Services Ltd.\nServices Equity 3.94%\nBank Of Baroda\nFinancial Equity 3.57%\nEris Lifesciences Ltd.\nHealthcare Equity 2.72%\nGabriel India Ltd.\nAutomobile Equity 2.52%\nFortis Healthcare Ltd.\nHealthcare Equity 2.28%\nIndian Bank\nFinancial Equity 2.22%\nKrishna Institute of Medical Sciences Ltd\nHealthcare Equity 2.01%\nSonata Software Ltd.\nTechnology Equity 1.82%\nSee All\nMinimum investment amounts\nMin. for 1st investment \u20b9100\nMin. for 2nd investment onwards \u20b9100\nMin. for SIP \u20b9100\nReturns and rankings\nCategory: Equity Small Cap\nAnnualised returns\nAbsolute returns\n3Y 5Y 10Y All\nFund returns 20.8% 26.3% 19.1% 19.3%\nCategory average 18.6% 23.1% 16.3% NA\nRank with in category 8 5 3 NA\nUnderstand terms\nPeer Comparison\nEquity, Small Cap funds Rating 1Y 3Y Fund Size(Cr)\nBandhan Small Cap Fund Direct Growth\n5\n-2.6% 30.4% 17,380.29\nInvesco India Smallcap Fund Direct Growth\n5\n-3.3% 25.5% 9,000.49\nNippon India Small Cap Fund Direct Growth\n4\n-7.2% 21.1% 68,571.85\nQuant Small Cap Fund Direct Plan Growth\n4\n-3.8% 20.6% 30,169.71\nFranklin India Small Cap Fund Direct Growth\n4\n-9.4% 19.9% 13,529.48\nExpense ratio, exit load and tax\nExpense ratio: 0.67%\nInclusive of GST\nExit load\nExit load of 1% if redeemed within 1 year\nStamp duty\n0.005% (from July 1st, 2020)\nTax implication\nIf you redeem within one year, returns are taxed at 20%. If you redeem after one year, returns exceeding Rs 1.25 lakh in a financial year are taxed at 12.5%.\nUnderstand terms\nCheck past data\nFund management\nChirag Setalvad\nJun 2014 - Present\nView details\nDhruv Muchhal\nJun 2023 - Present\nView details\nFund house & investment objective\nFund house contact details\nCompare funds\nHDFC Small Cap Fund Direct Growth\nVS\nAdd mutual fund to compare\nRecently viewed\nHDFC Multi Cap Fund\n20.7%\n(3Y)\nHDFC Infrastructure Fund\n24.6%\n(3Y)\nHDFC Short Term Debt Fund\n8.1%\n(3Y)\nHDFC Income Plus Arbitrage Active FoF Fund\n12.4%\n(3Y)\nFAQs\nHow to Invest in HDFC Small Cap Fund Direct Growth?\nWhat kind of returns does HDFC Small Cap Fund Direct Growth provide?\nHow much expense ratio is charged by HDFC Small Cap Fund Direct Growth?\n\n\nWhat is the AUM of HDFC Small Cap Fund Direct Growth?\nHow to Redeem HDFC Small Cap Fund Direct Growth?\nCan I invest in SIP and Lump Sum of HDFC Small Cap Fund Direct Growth?\nWhat is the NAV of HDFC Small Cap Fund Direct Growth?\nWhat is the PE and PB ratio of HDFC Small Cap Fund Direct Growth?\nLooking to invest in mutual funds?\nExplore diversified funds designed for every investor\nInvest Now\nHome\n>\nMutual Funds\n>\nHDFC Mutual Fund\n>\nHDFC Small Cap Fund Direct Growth\nVaishnavi Tech Park, South Tower, 3rd Floor\nSarjapur Main Road, Bellandur, Bengaluru \u2013 560103\nKarnataka\nContact Us\nDownload the App\nGROWW\nAbout Us\nPricing\nBlog\nMedia & Press\nCareers\nHelp & Support\nTrust & Safety\nInvestor Relations\nPRODUCTS\nStocks\nF&O\nMTF\nETF\nIPO\nMutual Funds\nCommodities\nGroww Terminal\n915 Terminal\nStocks Screener\nAlgo Trading\nGroww Digest\nDemat Account\nGroww AMC\n\u00a9 2016-2025 Groww. All rights reserved.\nVersion: 7.0.6\nShare Market\nIndices\nF&O\nMutual Funds\nETFs\nFunds By Groww\nCalculators\nIPO\nMiscellaneous\nTop Gainers Stocks\n52 Weeks High Stocks\nTata Motors\nNHPC\nITC\nWipro\nTop Losers Stocks\n52 Weeks Low Stocks\nIREDA\nState Bank of India\nAdani Power\nCDSL\nMost Traded Stocks\nStocks Market Calender\nTata Steel\nTata Power\nBharat Heavy Electricals\nIndian Oil Corporation\nStocks Feed\nSuzlon Energy\nZomato (Eternal)\nYes Bank\nInfosys\nNBCC\nShow More\nOthers:\nNSE\nBSE\nMCX\nTerms and Conditions\nPolicies and Procedures\nRegulatory & Other Info\nPrivacy Policy\nDisclosure\nSMART ODR\nDownload Forms\nInformation Security Practices\nInvestor Charter and Grievance\nBug Bounty",
    "scraped_at": "2025-12-22T03:20:37Z",
    "fund_managers": [
      "Dhruv Muchhal",
      "Chirag Setalvad"
    ]
  },
  {
    "page_url": "https://groww.in/mutual-funds/hdfc-large-and-mid-cap-fund-direct-growth",
    "fund_name": "HDFC Large and Mid Cap Fund Direct Growth - NAV, Mutual Fund Performance & Portfolio",
    "amc_name": "HDFC Mutual Fund",
    "category": "Equity",
    "sub_category": "Mid Cap",
    "plan_type": "Direct",
    "option": "Growth",
    "latest_nav": null,
    "nav_date": "19 Dec 2025",
    "nav_change_pct": "+0.88%",
    "aum": "28,486.64Cr",
    "expense_ratio": "0.83%",
    "risk_level": "Very High Risk",
    "rating": "4",
    "min_investment": {
      "lump_sum": null,
      "sip": "100"
    },
    "exit_load": "Exit load of 1% if redeemed within 1 year",
    "lock_in_period": null,
    "returns": {
      "1y": "20.3%",
      "3y": "20.3%",
      "5y": "22.9%"
    },
    "full_text": "Stocks\nF&O\nMutual Funds\nMore\nSearch Groww...\n\u2318K\nLogin/Sign up\nHDFC Large and Mid Cap Fund Direct Growth\nEquity\nLarge & MidCap\nVery High Risk\n+\n0\n1\n2\n3\n4\n5\n6\n7\n8\n9\n0\n1\n2\n3\n4\n5\n6\n7\n8\n9\n.\n0\n1\n2\n3\n4\n5\n6\n7\n8\n9\n0\n1\n2\n3\n4\n5\n6\n7\n8\n9\n%\n3Y annualised\n+0.88% 1D\n1M\n6M\n1Y\n3Y\n5Y\nAll\nNAV: 19 Dec 2025\n\u20b9365.63\nRating\n4\nMin. SIP amount\n\u20b9100\nFund size\n\u20b928,486.64Cr\nReturns calculator\nMonthly SIP\nOne-Time\n\u20b95,000 per month\nOver the past\n1 year\n3 years\n5 years\nTotal investment of \u20b960,000\nWould have become \u20b963,385 (+5.64%)\nHoldings (232)\nName Sector Instrument Assets\nHDFC Bank Ltd.\nFinancial Equity 5.11%\nICICI Bank Ltd.\nFinancial Equity 3.32%\nBharti Airtel Ltd.\nCommunication Equity 2.08%\nAxis Bank Ltd.\nFinancial Equity 1.88%\nInfosys Ltd.\nTechnology Equity 1.80%\nMax Financial Services Ltd.\nFinancial Equity 1.53%\nFortis Healthcare Ltd.\nHealthcare Equity 1.51%\nMphasis Ltd.\nTechnology Equity 1.50%\nState Bank of India\nFinancial Equity 1.43%\nMaruti Suzuki India Ltd.\nAutomobile Equity 1.34%\nSee All\nMinimum investment amounts\nMin. for 1st investment \u20b9100\nMin. for 2nd investment onwards \u20b9100\nMin. for SIP \u20b9100\nReturns and rankings\nCategory: Equity Large & MidCap\nAnnualised returns\nAbsolute returns\n3Y 5Y 10Y All\nFund returns 20.3% 22.9% 15.9% 14.0%\nCategory average 16.9% 18.3% 15.0% NA\nRank with in category 9 4 12 NA\nUnderstand terms\nPeer Comparison\nEquity, Large & MidCap funds Rating 1Y 3Y Fund Size(Cr)\nMotilal Oswal Large and Midcap Fund Direct Growth\n5\n-4.8% 25.5% 15,146.47\nBandhan Large & Mid Cap Fund Direct Growth\n5\n6.7% 24.1% 11,799.16\nICICI Prudential Large & Mid Cap Fund Direct Plan Growth\n5\n12.2% 21.4% 26,939.23\nNippon India Vision Large & Mid Cap Direct Growth\n4\n3.7% 20.9% 6,866.18\nSBI Large & Midcap Fund Direct Plan Growth\n4\n8.3% 18.1% 37,044.60\nExpense ratio, exit load and tax\nExpense ratio: 0.83%\nInclusive of GST\nExit load\nExit load of 1% if redeemed within 1 year\nStamp duty\n0.005% (from July 1st, 2020)\nTax implication\nIf you redeem within one year, returns are taxed at 20%. If you redeem after one year, returns exceeding Rs 1.25 lakh in a financial year are taxed at 12.5%.\nUnderstand terms\nCheck past data\nFund management\nGopal Agrawal\nJul 2020 - Present\nView details\nDhruv Muchhal\nJun 2023 - Present\nView details\nFund house & investment objective\nFund house contact details\nCompare funds\nHDFC Large and Mid Cap Fund Direct Growth\nVS\nAdd mutual fund to compare\nRecently viewed\nHDFC Small Cap Fund\n20.8%\n(3Y)\nHDFC Multi Cap Fund\n20.7%\n(3Y)\nHDFC Infrastructure Fund\n24.6%\n(3Y)\nHDFC Short Term Debt Fund\n8.1%\n(3Y)\nFAQs\nHow to Invest in HDFC Large and Mid Cap Fund Direct Growth?\nWhat kind of returns does HDFC Large and Mid Cap Fund Direct Growth provide?\nHow much expense ratio is charged by HDFC Large and Mid Cap Fund Direct Growth?\n\n\nWhat is the AUM of HDFC Large and Mid Cap Fund Direct Growth?\nHow to Redeem HDFC Large and Mid Cap Fund Direct Growth?\nCan I invest in SIP and Lump Sum of HDFC Large and Mid Cap Fund Direct Growth?\nWhat is the NAV of HDFC Large and Mid Cap Fund Direct Growth?\nWhat is the PE and PB ratio of HDFC Large and Mid Cap Fund Direct Growth?\nLooking to invest in mutual funds?\nExplore diversified funds designed for every investor\nInvest Now\nHome\n>\nMutual Funds\n>\nHDFC Mutual Fund\n>\nHDFC Large and Mid Cap Fund Direct Growth\nVaishnavi Tech Park, South Tower, 3rd Floor\nSarjapur Main Road, Bellandur, Bengaluru \u2013 560103\nKarnataka\nContact Us\nDownload the App\nGROWW\nAbout Us\nPricing\nBlog\nMedia & Press\nCareers\nHelp & Support\nTrust & Safety\nInvestor Relations\nPRODUCTS\nStocks\nF&O\nMTF\nETF\nIPO\nMutual Funds\nCommodities\nGroww Terminal\n915 Terminal\nStocks Screener\nAlgo Trading\nGroww Digest\nDemat Account\nGroww AMC\n\u00a9 2016-2025 Groww. All rights reserved.\nVersion: 7.0.6\nShare Market\nIndices\nF&O\nMutual Funds\nETFs\nFunds By Groww\nCalculators\nIPO\nMiscellaneous\nTop Gainers Stocks\n52 Weeks High Stocks\nTata Motors\nNHPC\nITC\nWipro\nTop Losers Stocks\n52 Weeks Low Stocks\nIREDA\nState Bank of India\nAdani Power\nCDSL\nMost Traded Stocks\nStocks Market Calender\nTata Steel\nTata Power\nBharat Heavy Electricals\nIndian Oil Corporation\nStocks Feed\nSuzlon Energy\nZomato (Eternal)\nYes Bank\nInfosys\nNBCC\nShow More\nOthers:\nNSE\nBSE\nMCX\nTerms and Conditions\nPolicies and Procedures\nRegulatory & Other Info\nPrivacy Policy\nDisclosure\nSMART ODR\nDownload Forms\nInformation Security Practices\nInvestor Charter and Grievance\nBug Bounty",
    "scraped_at": "2025-12-22T03:20:47Z",
    "fund_managers": [
      "Gopal Agrawal",
      "Dhruv Muchhal"
    ]
  },
  {
    "page_url": "https://groww.in/mutual-funds/hdfc-multi-asset-active-fof-direct-growth",
    "fund_name": "HDFC Multi Asset Active FoF Direct Growth - NAV, Mutual Fund Performance & Portfolio",
    "amc_name": "HDFC Mutual Fund",
    "category": "Hybrid",
    "sub_category": "Large Cap",
    "plan_type": "Direct",
    "option": "Growth",
    "latest_nav": null,
    "nav_date": "19 Dec 2025",
    "nav_change_pct": "+0.30%",
    "aum": "5,036.65Cr",
    "expense_ratio": "0.07%",
    "risk_level": "High Risk",
    "rating": "4",
    "min_investment": {
      "lump_sum": null,
      "sip": "100"
    },
    "exit_load": "Exit Load for units in excess of 15% of the investment,1% will be charged for redemption within 365 days.",
    "lock_in_period": null,
    "returns": {
      "1y": "0.32%",
      "3y": "0.04%",
      "5y": null
    },
    "full_text": "Stocks\nF&O\nMutual Funds\nMore\nSearch Groww...\n\u2318K\nLogin/Sign up\nHDFC Multi Asset Active FoF Direct Growth\nHybrid\nMulti Asset Allocation\nHigh Risk\n+\n0\n1\n2\n3\n4\n5\n6\n7\n8\n9\n0\n1\n2\n3\n4\n5\n6\n7\n8\n9\n.\n0\n1\n2\n3\n4\n5\n6\n7\n8\n9\n0\n1\n2\n3\n4\n5\n6\n7\n8\n9\n%\n3Y annualised\n+0.30% 1D\n1M\n6M\n1Y\n3Y\nAll\nNAV: 19 Dec 2025\n\u20b920.28\nRating\n4\nMin. SIP amount\n\u20b9100\nFund size\n\u20b95,036.65Cr\nReturns calculator\nMonthly SIP\nOne-Time\n\u20b95,000 per month\nOver the past\n6 months\n1 year\n3 years\nTotal investment of \u20b930,000\nWould have become \u20b931,236 (+4.12%)\nHoldings (19)\nName Sector Instrument Assets\nHDFC Large Cap Fund Direct-Growth\nNA Mutual Fund 17.07%\nHDFC Flexi Cap Direct Plan-Growth\nNA Mutual Fund 15.54%\nHDFC Gold ETF\nNA Mutual Fund 11.04%\nHDFC Short Term Debt Fund Direct Plan-Growth\nNA Mutual Fund 9.93%\nHDFC Corporate Bond Fund Direct Plan-Growth\nNA Mutual Fund 9.87%\nHDFC Medium Term Debt Fund Direct-Growth\nNA Mutual Fund 4.42%\nHDFC Low Duration Fund Direct-Growth\nNA Mutual Fund 3.63%\nHDFC Banking & Financial Services Fund Direct - Growth\nNA Mutual Fund 3.04%\nHDFC Technology Fund Direct - Growth\nNA Mutual Fund 2.91%\nHDFC Mid Cap Fund Direct-Growth\nNA Mutual Fund 2.90%\nSee All\nMinimum investment amounts\nMin. for 1st investment \u20b9100\nMin. for 2nd investment onwards \u20b9100\nMin. for SIP \u20b9100\nReturns and rankings\nCategory: Hybrid Multi Asset Allocation\nAnnualised returns\nAbsolute returns\n6M 1Y 3Y All\nFund returns NA 14.0% 17.1% 16.5%\nCategory average NA 14.3% 17.0% NA\nRank with in category NA 24 11 NA\nUnderstand terms\nPeer Comparison\nHybrid, Multi Asset Allocation funds Rating 1Y 3Y Fund Size(Cr)\nNippon India Multi Asset Allocation Fund Direct Growth\n4\n18.9% 21.6% 8,722.27\nUTI Multi Asset Allocation Fund Direct Growth\n3\n11.1% 20.5% 6,551.14\nICICI Prudential Multi Asset Fund Direct Growth\n5\n17.7% 19.9% 75,067.36\nSBI Multi Asset Allocation Fund Direct Growth\n4\n17.9% 18.6% 12,011.68\nHDFC Multi Asset Allocation Fund Direct Growth\n3\n13.3% 15.7% 5,303.17\nExpense ratio, exit load and tax\nExpense ratio: 0.07%\nInclusive of GST\nExit load\nExit Load for units in excess of 15% of the investment,1% will be charged for redemption within 365 days.\nStamp duty\n0.005% (from July 1st, 2020)\nTax implication\nIf you redeem within two years, returns are taxed as per your Income Tax slab. If you redeem after two years, returns exceeding Rs 1.25 lakh in a financial year are taxed at 12.5%.\nUnderstand terms\nCheck past data\nFund management\nAnil Bamboli\nApr 2021 - Present\nView details\nSrinivasan Ramamurthy\nJan 2022 - Present\nView details\nBhagyesh Kagalkar\nFeb 2022 - Present\nView details\nFund house & investment objective\nFund house contact details\nPros and cons\nCategory: Hybrid Multi Asset Allocation\nPros\nLower expense ratio: 0.07%\nAverage credit rating of the fund's holdings: AAA This fund has holdings of the highest quality\n3Y annualised returns higher than category average by 0.04%\nHigher alpha: 4.85 The fund has generated returns higher than benchmark - null - in the last 3Y\nCons\n1Y annualised returns lower than category average by 0.32%\nCompare funds\nHDFC Multi Asset Active FoF Direct Growth\nVS\nAdd mutual fund to compare\nRecently viewed\nHDFC Large and Mid Cap Fund\n20.3%\n(3Y)\nHDFC Small Cap Fund\n20.8%\n(3Y)\nHDFC Multi Cap Fund\n20.7%\n(3Y)\nHDFC Infrastructure Fund\n24.6%\n(3Y)\nFAQs\nHow to Invest in HDFC Multi Asset Active FoF Direct Growth?\nWhat kind of returns does HDFC Multi Asset Active FoF Direct Growth provide?\nHow much expense ratio is charged by HDFC Multi Asset Active FoF Direct Growth?\n\n\nWhat is the AUM of HDFC Multi Asset Active FoF Direct Growth?\nHow to Redeem HDFC Multi Asset Active FoF Direct Growth?\nCan I invest in SIP and Lump Sum of HDFC Multi Asset Active FoF Direct Growth?\nWhat is the NAV of HDFC Multi Asset Active FoF Direct Growth?\nWhat is the PE and PB ratio of HDFC Multi Asset Active FoF Direct Growth?\nLooking to invest in mutual funds?\nExplore diversified funds designed for every investor\nInvest Now\nHome\n>\nMutual Funds\n>\nHDFC Mutual Fund\n>\nHDFC Multi Asset Active FoF Direct Growth\nVaishnavi Tech Park, South Tower, 3rd Floor\nSarjapur Main Road, Bellandur, Bengaluru \u2013 560103\nKarnataka\nContact Us\nDownload the App\nGROWW\nAbout Us\nPricing\nBlog\nMedia & Press\nCareers\nHelp & Support\nTrust & Safety\nInvestor Relations\nPRODUCTS\nStocks\nF&O\nMTF\nETF\nIPO\nMutual Funds\nCommodities\nGroww Terminal\n915 Terminal\nStocks Screener\nAlgo Trading\nGroww Digest\nDemat Account\nGroww AMC\n\u00a9 2016-2025 Groww. All rights reserved.\nVersion: 7.0.6\nShare Market\nIndices\nF&O\nMutual Funds\nETFs\nFunds By Groww\nCalculators\nIPO\nMiscellaneous\nTop Gainers Stocks\n52 Weeks High Stocks\nTata Motors\nNHPC\nITC\nWipro\nTop Losers Stocks\n52 Weeks Low Stocks\nIREDA\nState Bank of India\nAdani Power\nCDSL\nMost Traded Stocks\nStocks Market Calender\nTata Steel\nTata Power\nBharat Heavy Electricals\nIndian Oil Corporation\nStocks Feed\nSuzlon Energy\nZomato (Eternal)\nYes Bank\nInfosys\nNBCC\nShow More\nOthers:\nNSE\nBSE\nMCX\nTerms and Conditions\nPolicies and Procedures\nRegulatory & Other Info\nPrivacy Policy\nDisclosure\nSMART ODR\nDownload Forms\nInformation Security Practices\nInvestor Charter and Grievance\nBug Bounty",
    "scraped_at": "2025-12-22T03:20:56Z",
    "fund_managers": [
      "Bhagyesh Kagalkar",
      "Anil Bamboli",
      "Srinivasan Ramamurthy"
    ]
  },
  {
    "page_url": "https://groww.in/mutual-funds/hdfc-nifty50-equal-weight-index-fund-direct-growth",
    "fund_name": "HDFC NIFTY50 Equal Weight Index Fund Direct Growth - NAV, Mutual Fund Performance & Portfolio",
    "amc_name": "HDFC Mutual Fund",
    "category": "Equity",
    "sub_category": "Large Cap",
    "plan_type": "Direct",
    "option": "Growth",
    "latest_nav": null,
    "nav_date": "19 Dec 2025",
    "nav_change_pct": "+0.72%",
    "aum": "1,645.59Cr",
    "expense_ratio": "0.40%",
    "risk_level": "Very High Risk",
    "rating": "4",
    "min_investment": {
      "lump_sum": null,
      "sip": "100"
    },
    "exit_load": "Nil",
    "lock_in_period": null,
    "returns": {
      "1y": null,
      "3y": null,
      "5y": null
    },
    "full_text": "Stocks\nF&O\nMutual Funds\nMore\nSearch Groww...\n\u2318K\nLogin/Sign up\nHDFC NIFTY50 Equal Weight Index Fund Direct Growth\nEquity\nLarge Cap\nVery High Risk\n+\n0\n1\n2\n3\n4\n5\n6\n7\n8\n9\n0\n1\n2\n3\n4\n5\n6\n7\n8\n9\n.\n0\n1\n2\n3\n4\n5\n6\n7\n8\n9\n0\n1\n2\n3\n4\n5\n6\n7\n8\n9\n%\n3Y annualised\n+0.72% 1D\n1M\n6M\n1Y\n3Y\nAll\nNAV: 19 Dec 2025\n\u20b918.62\nRating\n4\nMin. SIP amount\n\u20b9100\nFund size\n\u20b91,645.59Cr\nReturns calculator\nMonthly SIP\nOne-Time\n\u20b95,000 per month\nOver the past\n6 months\n1 year\n3 years\nTotal investment of \u20b930,000\nWould have become \u20b930,736 (+2.45%)\nHoldings (50)\nName Sector Instrument Assets\nShriram Finance Ltd\nFinancial Equity 2.65%\nAsian Paints Ltd.\nChemicals Equity 2.28%\nTitan Company Ltd.\nConsumer Discretionary Equity 2.20%\nReliance Industries Ltd.\nEnergy Equity 2.18%\nHCL Technologies Ltd.\nTechnology Equity 2.17%\nState Bank of India\nFinancial Equity 2.17%\nSun Pharmaceutical Industries Ltd.\nHealthcare Equity 2.14%\nLarsen & Toubro Ltd.\nConstruction Equity 2.13%\nAxis Bank Ltd.\nFinancial Equity 2.09%\nBharti Airtel Ltd.\nCommunication Equity 2.07%\nSee All\nMinimum investment amounts\nMin. for 1st investment \u20b9100\nMin. for 2nd investment onwards \u20b9100\nMin. for SIP \u20b9100\nReturns and rankings\nCategory: Equity Large Cap\nAnnualised returns\nAbsolute returns\n6M 1Y 3Y All\nFund returns NA 11.7% 16.8% 15.4%\nCategory average NA 6.1% 14.5% NA\nRank with in category NA 3 16 NA\nUnderstand terms\nPeer Comparison\nEquity, Large Cap funds Rating 1Y 3Y Fund Size(Cr)\nNippon India Large Cap Fund Direct Growth\n5\n7.5% 19.5% 50,312.32\nDSP Large Cap Fund Direct Growth\n5\n8.0% 18.5% 6,933.59\nICICI Prudential Large Cap Fund Direct Growth\n5\n9.7% 18.2% 78,159.80\nCanara Robeco Large Cap Fund Direct Growth\n4\n6.7% 16.2% 17,233.68\nHDFC Large Cap Fund Direct Growth\n5\n6.7% 15.9% 40,617.55\nExpense ratio, exit load and tax\nExpense ratio: 0.40%\nInclusive of GST\nExit load\nNil\nStamp duty\n0.005% (from July 1st, 2020)\nTax implication\nIf you redeem within one year, returns are taxed at 20%. If you redeem after one year, returns exceeding Rs 1.25 lakh in a financial year are taxed at 12.5%.\nUnderstand terms\nCheck past data\nFund management\nNandita Menezes\nMar 2025 - Present\nView details\nFund house & investment objective\nFund house contact details\nCompare funds\nHDFC NIFTY50 Equal Weight Index Fund Direct Growth\nVS\nAdd mutual fund to compare\nRecently viewed\nHDFC Multi-Asset Active FoF Fund\n17.1%\n(3Y)\nHDFC Large and Mid Cap Fund\n20.3%\n(3Y)\nHDFC Small Cap Fund\n20.8%\n(3Y)\nHDFC Multi Cap Fund\n20.7%\n(3Y)\nFAQs\nHow to Invest in HDFC NIFTY50 Equal Weight Index Fund Direct Growth?\nWhat kind of returns does HDFC NIFTY50 Equal Weight Index Fund Direct Growth provide?\nHow much expense ratio is charged by HDFC NIFTY50 Equal Weight Index Fund Direct Growth?\n\n\nWhat is the AUM of HDFC NIFTY50 Equal Weight Index Fund Direct Growth?\nHow to Redeem HDFC NIFTY50 Equal Weight Index Fund Direct Growth?\nCan I invest in SIP and Lump Sum of HDFC NIFTY50 Equal Weight Index Fund Direct Growth?\nWhat is the NAV of HDFC NIFTY50 Equal Weight Index Fund Direct Growth?\nWhat is the PE and PB ratio of HDFC NIFTY50 Equal Weight Index Fund Direct Growth?\nLooking to invest in mutual funds?\nExplore diversified funds designed for every investor\nInvest Now\nHome\n>\nMutual Funds\n>\nHDFC Mutual Fund\n>\nHDFC NIFTY50 Equal Weight Index Fund Direct Growth\nVaishnavi Tech Park, South Tower, 3rd Floor\nSarjapur Main Road, Bellandur, Bengaluru \u2013 560103\nKarnataka\nContact Us\nDownload the App\nGROWW\nAbout Us\nPricing\nBlog\nMedia & Press\nCareers\nHelp & Support\nTrust & Safety\nInvestor Relations\nPRODUCTS\nStocks\nF&O\nMTF\nETF\nIPO\nMutual Funds\nCommodities\nGroww Terminal\n915 Terminal\nStocks Screener\nAlgo Trading\nGroww Digest\nDemat Account\nGroww AMC\n\u00a9 2016-2025 Groww. All rights reserved.\nVersion: 7.0.6\nShare Market\nIndices\nF&O\nMutual Funds\nETFs\nFunds By Groww\nCalculators\nIPO\nMiscellaneous\nTop Gainers Stocks\n52 Weeks High Stocks\nTata Motors\nNHPC\nITC\nWipro\nTop Losers Stocks\n52 Weeks Low Stocks\nIREDA\nState Bank of India\nAdani Power\nCDSL\nMost Traded Stocks\nStocks Market Calender\nTata Steel\nTata Power\nBharat Heavy Electricals\nIndian Oil Corporation\nStocks Feed\nSuzlon Energy\nZomato (Eternal)\nYes Bank\nInfosys\nNBCC\nShow More\nOthers:\nNSE\nBSE\nMCX\nTerms and Conditions\nPolicies and Procedures\nRegulatory & Other Info\nPrivacy Policy\nDisclosure\nSMART ODR\nDownload Forms\nInformation Security Practices\nInvestor Charter and Grievance\nBug Bounty",
    "scraped_at": "2025-12-22T03:21:06Z",
    "fund_managers": [
      "Nandita Menezes"
    ]
  },
  {
    "page_url": "https://groww.in/mutual-funds/hdfc-banking-financial-services-fund-direct-growth",
    "fund_name": "HDFC Banking & Financial Services Fund Direct Growth - NAV, Mutual Fund Performance & Portfolio",
    "amc_name": "HDFC Mutual Fund",
    "category": "Equity",
    "sub_category": "Mid Cap",
    "plan_type": "Direct",
    "option": "Growth",
    "latest_nav": null,
    "nav_date": "19 Dec 2025",
    "nav_change_pct": "+0.94%",
    "aum": "4,512.97Cr",
    "expense_ratio": "0.80%",
    "risk_level": "Very High Risk",
    "rating": "4",
    "min_investment": {
      "lump_sum": null,
      "sip": "100"
    },
    "exit_load": "Exit load of 1%, if redeemed within 30 days.",
    "lock_in_period": null,
    "returns": {
      "1y": null,
      "3y": null,
      "5y": null
    },
    "full_text": "Stocks\nF&O\nMutual Funds\nMore\nSearch Groww...\n\u2318K\nLogin/Sign up\nHDFC Banking & Financial Services Fund Direct Growth\nEquity\nSectoral\nVery High Risk\n+\n0\n1\n2\n3\n4\n5\n6\n7\n8\n9\n0\n1\n2\n3\n4\n5\n6\n7\n8\n9\n.\n0\n1\n2\n3\n4\n5\n6\n7\n8\n9\n0\n1\n2\n3\n4\n5\n6\n7\n8\n9\n%\n3Y annualised\n+0.94% 1D\n1M\n6M\n1Y\n3Y\nAll\nNAV: 19 Dec 2025\n\u20b919.15\nRating\n4\nMin. SIP amount\n\u20b9100\nFund size\n\u20b94,512.97Cr\nReturns calculator\nMonthly SIP\nOne-Time\n\u20b95,000 per month\nOver the past\n6 months\n1 year\n3 years\nTotal investment of \u20b930,000\nWould have become \u20b928,252 (-5.83%)\nHoldings (31)\nName Sector Instrument Assets\nHDFC Bank Ltd.\nFinancial Equity 20.32%\nICICI Bank Ltd.\nFinancial Equity 16.00%\nAxis Bank Ltd.\nFinancial Equity 8.04%\nKotak Mahindra Bank Ltd.\nFinancial Equity 7.94%\nState Bank of India\nFinancial Equity 6.07%\nAU Small Finance Bank Ltd.\nFinancial Equity 3.91%\nShriram Finance Ltd\nFinancial Equity 3.37%\nBajaj Finance Ltd.\nFinancial Equity 3.28%\nSBI Life Insurance Company Ltd.\nInsurance Equity 3.01%\nFive-Star Business Finance Ltd.\nFinancial Equity 2.40%\nSee All\nMinimum investment amounts\nMin. for 1st investment \u20b9100\nMin. for 2nd investment onwards \u20b9100\nMin. for SIP \u20b9100\nReturns and rankings\nCategory: Equity Sectoral\nAnnualised returns\nAbsolute returns\n6M 1Y 3Y All\nFund returns NA 15.7% 16.7% 15.6%\nCategory average NA 15.6% 14.1% NA\nRank with in category NA 11 9 NA\nUnderstand terms\nExpense ratio, exit load and tax\nExpense ratio: 0.80%\nInclusive of GST\nExit load\nExit load of 1%, if redeemed within 30 days.\nStamp duty\n0.005% (from July 1st, 2020)\nTax implication\nIf you redeem within one year, returns are taxed at 20%. If you redeem after one year, returns exceeding Rs 1.25 lakh in a financial year are taxed at 12.5%.\nUnderstand terms\nCheck past data\nFund management\nAnand Laddha\nJun 2021 - Present\nView details\nDhruv Muchhal\nJun 2023 - Present\nView details\nFund house & investment objective\nFund house contact details\nCompare funds\nHDFC Banking & Financial Services Fund Direct Growth\nVS\nAdd mutual fund to compare\nRecently viewed\nHDFC NIFTY50 Equal Weight Index Fund\n16.8%\n(3Y)\nHDFC Multi-Asset Active FoF Fund\n17.1%\n(3Y)\nHDFC Large and Mid Cap Fund\n20.3%\n(3Y)\nHDFC Small Cap Fund\n20.8%\n(3Y)\nFAQs\nHow to Invest in HDFC Banking & Financial Services Fund Direct Growth?\nWhat kind of returns does HDFC Banking & Financial Services Fund Direct Growth provide?\nHow much expense ratio is charged by HDFC Banking & Financial Services Fund Direct Growth?\n\n\nWhat is the AUM of HDFC Banking & Financial Services Fund Direct Growth?\nHow to Redeem HDFC Banking & Financial Services Fund Direct Growth?\nCan I invest in SIP and Lump Sum of HDFC Banking & Financial Services Fund Direct Growth?\nWhat is the NAV of HDFC Banking & Financial Services Fund Direct Growth?\nWhat is the PE and PB ratio of HDFC Banking & Financial Services Fund Direct Growth?\nLooking to invest in mutual funds?\nExplore diversified funds designed for every investor\nInvest Now\nHome\n>\nMutual Funds\n>\nHDFC Mutual Fund\n>\nHDFC Banking & Financial Services Fund Direct Growth\nVaishnavi Tech Park, South Tower, 3rd Floor\nSarjapur Main Road, Bellandur, Bengaluru \u2013 560103\nKarnataka\nContact Us\nDownload the App\nGROWW\nAbout Us\nPricing\nBlog\nMedia & Press\nCareers\nHelp & Support\nTrust & Safety\nInvestor Relations\nPRODUCTS\nStocks\nF&O\nMTF\nETF\nIPO\nMutual Funds\nCommodities\nGroww Terminal\n915 Terminal\nStocks Screener\nAlgo Trading\nGroww Digest\nDemat Account\nGroww AMC\n\u00a9 2016-2025 Groww. All rights reserved.\nVersion: 7.0.6\nShare Market\nIndices\nF&O\nMutual Funds\nETFs\nFunds By Groww\nCalculators\nIPO\nMiscellaneous\nTop Gainers Stocks\n52 Weeks High Stocks\nTata Motors\nNHPC\nITC\nWipro\nTop Losers Stocks\n52 Weeks Low Stocks\nIREDA\nState Bank of India\nAdani Power\nCDSL\nMost Traded Stocks\nStocks Market Calender\nTata Steel\nTata Power\nBharat Heavy Electricals\nIndian Oil Corporation\nStocks Feed\nSuzlon Energy\nZomato (Eternal)\nYes Bank\nInfosys\nNBCC\nShow More\nOthers:\nNSE\nBSE\nMCX\nTerms and Conditions\nPolicies and Procedures\nRegulatory & Other Info\nPrivacy Policy\nDisclosure\nSMART ODR\nDownload Forms\nInformation Security Practices\nInvestor Charter and Grievance\nBug Bounty",
    "scraped_at": "2025-12-22T03:21:16Z",
    "fund_managers": [
      "Anand Laddha",
      "Dhruv Muchhal"
    ]
  },
  {
    "page_url": "https://groww.in/mutual-funds/hdfc-nifty-100-equal-weight-index-fund-direct-growth",
    "fund_name": "HDFC NIFTY 100 Equal Weight Index Fund Direct Growth - NAV, Mutual Fund Performance & Portfolio",
    "amc_name": "HDFC Mutual Fund",
    "category": "Equity",
    "sub_category": "Large Cap",
    "plan_type": "Direct",
    "option": "Growth",
    "latest_nav": null,
    "nav_date": "19 Dec 2025",
    "nav_change_pct": "+0.75%",
    "aum": "414.04Cr",
    "expense_ratio": "0.40%",
    "risk_level": "Very High Risk",
    "rating": "4",
    "min_investment": {
      "lump_sum": null,
      "sip": "100"
    },
    "exit_load": "Nil",
    "lock_in_period": null,
    "returns": {
      "1y": "0.55%",
      "3y": "2.31%",
      "5y": null
    },
    "full_text": "Stocks\nF&O\nMutual Funds\nMore\nSearch Groww...\n\u2318K\nLogin/Sign up\nHDFC NIFTY 100 Equal Weight Index Fund Direct Growth\nEquity\nLarge Cap\nVery High Risk\n+\n0\n1\n2\n3\n4\n5\n6\n7\n8\n9\n0\n1\n2\n3\n4\n5\n6\n7\n8\n9\n.\n0\n1\n2\n3\n4\n5\n6\n7\n8\n9\n0\n1\n2\n3\n4\n5\n6\n7\n8\n9\n%\n3Y annualised\n+0.75% 1D\n1M\n6M\n1Y\n3Y\nAll\nNAV: 19 Dec 2025\n\u20b916.98\nRating\n4\nMin. SIP amount\n\u20b9100\nFund size\n\u20b9414.04Cr\nReturns calculator\nMonthly SIP\nOne-Time\n\u20b95,000 per month\nOver the past\n6 months\n1 year\n3 years\nTotal investment of \u20b930,000\nWould have become \u20b930,320 (+1.07%)\nHoldings (101)\nName Sector Instrument Assets\nShriram Finance Ltd\nFinancial Equity 1.36%\nCanara Bank\nFinancial Equity 1.22%\nAsian Paints Ltd.\nChemicals Equity 1.17%\nLTIMindtree Ltd.\nTechnology Equity 1.15%\nTitan Company Ltd.\nConsumer Discretionary Equity 1.13%\nBank Of Baroda\nFinancial Equity 1.12%\nReliance Industries Ltd.\nEnergy Equity 1.12%\nVedanta Ltd.\nMetals & Mining Equity 1.12%\nState Bank of India\nFinancial Equity 1.12%\nHCL Technologies Ltd.\nTechnology Equity 1.12%\nSee All\nMinimum investment amounts\nMin. for 1st investment \u20b9100\nMin. for 2nd investment onwards \u20b9100\nMin. for SIP \u20b9100\nReturns and rankings\nCategory: Equity Large Cap\nAnnualised returns\nAbsolute returns\n6M 1Y 3Y All\nFund returns NA 5.6% 16.8% 14.9%\nCategory average NA 6.1% 14.5% NA\nRank with in category NA 68 17 NA\nUnderstand terms\nPeer Comparison\nEquity, Large Cap funds Rating 1Y 3Y Fund Size(Cr)\nNippon India Large Cap Fund Direct Growth\n5\n7.5% 19.5% 50,312.32\nDSP Large Cap Fund Direct Growth\n5\n8.0% 18.5% 6,933.59\nICICI Prudential Large Cap Fund Direct Growth\n5\n9.7% 18.2% 78,159.80\nCanara Robeco Large Cap Fund Direct Growth\n4\n6.7% 16.2% 17,233.68\nHDFC Large Cap Fund Direct Growth\n5\n6.7% 15.9% 40,617.55\nExpense ratio, exit load and tax\nExpense ratio: 0.40%\nInclusive of GST\nExit load\nNil\nStamp duty\n0.005% (from July 1st, 2020)\nTax implication\nIf you redeem within one year, returns are taxed at 20%. If you redeem after one year, returns exceeding Rs 1.25 lakh in a financial year are taxed at 12.5%.\nUnderstand terms\nCheck past data\nFund management\nNandita Menezes\nMar 2025 - Present\nView details\nFund house & investment objective\nFund house contact details\nPros and cons\nCategory: Equity Large Cap\nPros\nExit load is zero\nLower expense ratio: 0.4%\n3Y annualised returns higher than category average by 2.31%\nCons\n1Y annualised returns lower than category average by 0.55%\nCompare funds\nHDFC NIFTY 100 Equal Weight Index Fund Direct Growth\nVS\nAdd mutual fund to compare\nRecently viewed\nHDFC Banking & Financial Services Fund\n16.7%\n(3Y)\nHDFC NIFTY50 Equal Weight Index Fund\n16.8%\n(3Y)\nHDFC Multi-Asset Active FoF Fund\n17.1%\n(3Y)\nHDFC Large and Mid Cap Fund\n20.3%\n(3Y)\nFAQs\nHow to Invest in HDFC NIFTY 100 Equal Weight Index Fund Direct Growth?\nWhat kind of returns does HDFC NIFTY 100 Equal Weight Index Fund Direct Growth provide?\nHow much expense ratio is charged by HDFC NIFTY 100 Equal Weight Index Fund Direct Growth?\n\n\nWhat is the AUM of HDFC NIFTY 100 Equal Weight Index Fund Direct Growth?\nHow to Redeem HDFC NIFTY 100 Equal Weight Index Fund Direct Growth?\nCan I invest in SIP and Lump Sum of HDFC NIFTY 100 Equal Weight Index Fund Direct Growth?\nWhat is the NAV of HDFC NIFTY 100 Equal Weight Index Fund Direct Growth?\nWhat is the PE and PB ratio of HDFC NIFTY 100 Equal Weight Index Fund Direct Growth?\nLooking to invest in mutual funds?\nExplore diversified funds designed for every investor\nInvest Now\nHome\n>\nMutual Funds\n>\nHDFC Mutual Fund\n>\nHDFC NIFTY 100 Equal Weight Index Fund Direct Growth\nVaishnavi Tech Park, South Tower, 3rd Floor\nSarjapur Main Road, Bellandur, Bengaluru \u2013 560103\nKarnataka\nContact Us\nDownload the App\nGROWW\nAbout Us\nPricing\nBlog\nMedia & Press\nCareers\nHelp & Support\nTrust & Safety\nInvestor Relations\nPRODUCTS\nStocks\nF&O\nMTF\nETF\nIPO\nMutual Funds\nCommodities\nGroww Terminal\n915 Terminal\nStocks Screener\nAlgo Trading\nGroww Digest\nDemat Account\nGroww AMC\n\u00a9 2016-2025 Groww. All rights reserved.\nVersion: 7.0.6\nShare Market\nIndices\nF&O\nMutual Funds\nETFs\nFunds By Groww\nCalculators\nIPO\nMiscellaneous\nTop Gainers Stocks\n52 Weeks High Stocks\nTata Motors\nNHPC\nITC\nWipro\nTop Losers Stocks\n52 Weeks Low Stocks\nIREDA\nState Bank of India\nAdani Power\nCDSL\nMost Traded Stocks\nStocks Market Calender\nTata Steel\nTata Power\nBharat Heavy Electricals\nIndian Oil Corporation\nStocks Feed\nSuzlon Energy\nZomato (Eternal)\nYes Bank\nInfosys\nNBCC\nShow More\nOthers:\nNSE\nBSE\nMCX\nTerms and Conditions\nPolicies and Procedures\nRegulatory & Other Info\nPrivacy Policy\nDisclosure\nSMART ODR\nDownload Forms\nInformation Security Practices\nInvestor Charter and Grievance\nBug Bounty",
    "scraped_at": "2025-12-22T03:21:26Z",
    "fund_managers": [
      "Nandita Menezes"
    ]
  },
  {
    "page_url": "https://groww.in/mutual-funds/hdfc-nifty-next-50-index-fund-direct-growth",
    "fund_name": "HDFC NIFTY Next 50 Index Fund Direct Growth - NAV, Mutual Fund Performance & Portfolio",
    "amc_name": "HDFC Mutual Fund",
    "category": "Equity",
    "sub_category": "Large Cap",
    "plan_type": "Direct",
    "option": "Growth",
    "latest_nav": null,
    "nav_date": "19 Dec 2025",
    "nav_change_pct": "+0.81%",
    "aum": "2,153.45Cr",
    "expense_ratio": "0.30%",
    "risk_level": "Very High Risk",
    "rating": "1",
    "min_investment": {
      "lump_sum": null,
      "sip": "100"
    },
    "exit_load": "Nil",
    "lock_in_period": null,
    "returns": {
      "1y": "8.96%",
      "3y": "2.07%",
      "5y": null
    },
    "full_text": "Stocks\nF&O\nMutual Funds\nMore\nSearch Groww...\n\u2318K\nLogin/Sign up\nHDFC NIFTY Next 50 Index Fund Direct Growth\nEquity\nLarge Cap\nVery High Risk\n+\n0\n1\n2\n3\n4\n5\n6\n7\n8\n9\n0\n1\n2\n3\n4\n5\n6\n7\n8\n9\n.\n0\n1\n2\n3\n4\n5\n6\n7\n8\n9\n0\n1\n2\n3\n4\n5\n6\n7\n8\n9\n%\n3Y annualised\n+0.81% 1D\n1M\n6M\n1Y\n3Y\nAll\nNAV: 19 Dec 2025\n\u20b916.11\nRating\n1\nMin. SIP amount\n\u20b9100\nFund size\n\u20b92,153.45Cr\nReturns calculator\nMonthly SIP\nOne-Time\n\u20b95,000 per month\nOver the past\n6 months\n1 year\n3 years\nTotal investment of \u20b930,000\nWould have become \u20b926,783 (-10.72%)\nHoldings (51)\nName Sector Instrument Assets\nVedanta Ltd.\nMetals & Mining Equity 3.86%\nHindustan Aeronautics Ltd.\nCapital Goods Equity 3.73%\nTVS Motor Company Ltd.\nAutomobile Equity 3.59%\nDivi's Laboratories Ltd.\nHealthcare Equity 3.56%\nCholamandalam Investment and Finance Company Ltd.\nFinancial Equity 3.17%\nBharat Petroleum Corporation Ltd.\nEnergy Equity 3.01%\nBritannia Industries Ltd.\nConsumer Staples Equity 2.98%\nTata Power Company Ltd.\nEnergy Equity 2.84%\nThe Indian Hotels Company Ltd.\nServices Equity 2.83%\nVarun Beverages Ltd.\nConsumer Staples Equity 2.82%\nSee All\nMinimum investment amounts\nMin. for 1st investment \u20b9100\nMin. for 2nd investment onwards \u20b9100\nMin. for SIP \u20b9100\nReturns and rankings\nCategory: Equity Large Cap\nAnnualised returns\nAbsolute returns\n6M 1Y 3Y All\nFund returns NA -2.9% 16.5% 12.2%\nCategory average NA 6.1% 14.5% NA\nRank with in category NA 94 27 NA\nUnderstand terms\nPeer Comparison\nEquity, Large Cap funds Rating 1Y 3Y Fund Size(Cr)\nNippon India Large Cap Fund Direct Growth\n5\n7.5% 19.5% 50,312.32\nDSP Large Cap Fund Direct Growth\n5\n8.0% 18.5% 6,933.59\nICICI Prudential Large Cap Fund Direct Growth\n5\n9.7% 18.2% 78,159.80\nCanara Robeco Large Cap Fund Direct Growth\n4\n6.7% 16.2% 17,233.68\nHDFC Large Cap Fund Direct Growth\n5\n6.7% 15.9% 40,617.55\nExpense ratio, exit load and tax\nExpense ratio: 0.30%\nInclusive of GST\nExit load\nNil\nStamp duty\n0.005% (from July 1st, 2020)\nTax implication\nIf you redeem within one year, returns are taxed at 20%. If you redeem after one year, returns exceeding Rs 1.25 lakh in a financial year are taxed at 12.5%.\nUnderstand terms\nCheck past data\nFund management\nNandita Menezes\nMar 2025 - Present\nView details\nFund house & investment objective\nFund house contact details\nPros and cons\nCategory: Equity Large Cap\nPros\nExit load is zero\nLower expense ratio: 0.3%\n3Y annualised returns higher than category average by 2.07%\nCons\nLow rating: 1\n1Y annualised returns lower than category average by 8.96%\nCompare funds\nHDFC NIFTY Next 50 Index Fund Direct Growth\nVS\nAdd mutual fund to compare\nRecently viewed\nHDFC NIFTY 100 Equal Weight Index Fund\n16.8%\n(3Y)\nHDFC Banking & Financial Services Fund\n16.7%\n(3Y)\nHDFC NIFTY50 Equal Weight Index Fund\n16.8%\n(3Y)\nHDFC Multi-Asset Active FoF Fund\n17.1%\n(3Y)\nFAQs\nHow to Invest in HDFC NIFTY Next 50 Index Fund Direct Growth?\nWhat kind of returns does HDFC NIFTY Next 50 Index Fund Direct Growth provide?\nHow much expense ratio is charged by HDFC NIFTY Next 50 Index Fund Direct Growth?\n\n\nWhat is the AUM of HDFC NIFTY Next 50 Index Fund Direct Growth?\nHow to Redeem HDFC NIFTY Next 50 Index Fund Direct Growth?\nCan I invest in SIP and Lump Sum of HDFC NIFTY Next 50 Index Fund Direct Growth?\nWhat is the NAV of HDFC NIFTY Next 50 Index Fund Direct Growth?\nWhat is the PE and PB ratio of HDFC NIFTY Next 50 Index Fund Direct Growth?\nLooking to invest in mutual funds?\nExplore diversified funds designed for every investor\nInvest Now\nHome\n>\nMutual Funds\n>\nHDFC Mutual Fund\n>\nHDFC NIFTY Next 50 Index Fund Direct Growth\nVaishnavi Tech Park, South Tower, 3rd Floor\nSarjapur Main Road, Bellandur, Bengaluru \u2013 560103\nKarnataka\nContact Us\nDownload the App\nGROWW\nAbout Us\nPricing\nBlog\nMedia & Press\nCareers\nHelp & Support\nTrust & Safety\nInvestor Relations\nPRODUCTS\nStocks\nF&O\nMTF\nETF\nIPO\nMutual Funds\nCommodities\nGroww Terminal\n915 Terminal\nStocks Screener\nAlgo Trading\nGroww Digest\nDemat Account\nGroww AMC\n\u00a9 2016-2025 Groww. All rights reserved.\nVersion: 7.0.6\nShare Market\nIndices\nF&O\nMutual Funds\nETFs\nFunds By Groww\nCalculators\nIPO\nMiscellaneous\nTop Gainers Stocks\n52 Weeks High Stocks\nTata Motors\nNHPC\nITC\nWipro\nTop Losers Stocks\n52 Weeks Low Stocks\nIREDA\nState Bank of India\nAdani Power\nCDSL\nMost Traded Stocks\nStocks Market Calender\nTata Steel\nTata Power\nBharat Heavy Electricals\nIndian Oil Corporation\nStocks Feed\nSuzlon Energy\nZomato (Eternal)\nYes Bank\nInfosys\nNBCC\nShow More\nOthers:\nNSE\nBSE\nMCX\nTerms and Conditions\nPolicies and Procedures\nRegulatory & Other Info\nPrivacy Policy\nDisclosure\nSMART ODR\nDownload Forms\nInformation Security Practices\nInvestor Charter and Grievance\nBug Bounty",
    "scraped_at": "2025-12-22T03:21:35Z",
    "fund_managers": [
      "Nandita Menezes"
    ]
  },
  {
    "page_url": "https://groww.in/mutual-funds/hdfc-corporate-debt-opportunities-fund-direct-growth",
    "fund_name": "HDFC Credit Risk Debt Fund Direct Growth - NAV, Mutual Fund Performance & Portfolio",
    "amc_name": "HDFC Mutual Fund",
    "category": "Debt",
    "sub_category": null,
    "plan_type": "Direct",
    "option": "Growth",
    "latest_nav": null,
    "nav_date": "19 Dec 2025",
    "nav_change_pct": "+0.02%",
    "aum": "7,012.56Cr",
    "expense_ratio": "1.02%",
    "risk_level": "High Risk",
    "rating": "3",
    "min_investment": {
      "lump_sum": null,
      "sip": "100"
    },
    "exit_load": "Exit load for units in excess of 15% of the investment, 1% will be charged for redemption within 12 months and 0.50% if redeemed after 12 months but within 18 months.",
    "lock_in_period": null,
    "returns": {
      "1y": "8.2%",
      "3y": "8.2%",
      "5y": "7.3%"
    },
    "full_text": "Stocks\nF&O\nMutual Funds\nMore\nSearch Groww...\n\u2318K\nLogin/Sign up\nHDFC Credit Risk Debt Fund Direct Growth\nDebt\nCredit Risk\nHigh Risk\n+\n1\n2\n3\n4\n5\n6\n7\n8\n9\n.\n0\n1\n2\n3\n4\n5\n6\n7\n8\n9\n1\n2\n3\n4\n5\n6\n7\n8\n9\n%\n3Y annualised\n+0.02% 1D\n1M\n6M\n1Y\n3Y\n5Y\nAll\nNAV: 19 Dec 2025\n\u20b926.87\nRating\n3\nMin. SIP amount\n\u20b9100\nFund size\n\u20b97,012.56Cr\nReturns calculator\nMonthly SIP\nOne-Time\n\u20b95,000 per month\nOver the past\n1 year\n3 years\n5 years\nTotal investment of \u20b960,000\nWould have become \u20b962,546 (+4.24%)\nHoldings (76)\nName Sector Instrument Assets\nSandur Manganese & Iron Ores Ltd.\nMetals & Mining NCD 4.12%\nGMR Airports Ltd.\nConstruction Bonds 3.85%\nTata Projects Ltd.\nConstruction NCD 3.61%\nTata Power Company Ltd.\nEnergy Debenture 3.31%\nJubilant Beverages Ltd.\nConsumer Staples Debenture 2.91%\nBamboo Hotel And Global Centre (Delhi) Pvt Ltd. Class A\nServices Debenture 2.90%\nKalpataru Projects International Ltd.\nCapital Goods NCD 2.88%\nSK Finance Ltd.\nFinancial NCD 2.87%\nJubilant Bevco Ltd.\nConsumer Staples Debenture 2.70%\nSiddhivinayak Securitisation Trust\nOthers Sec. Debt 2.57%\nSee All\nMinimum investment amounts\nMin. for 1st investment \u20b9100\nMin. for 2nd investment onwards \u20b9100\nMin. for SIP \u20b9100\nReturns and rankings\nCategory: Debt Credit Risk\nAnnualised returns\nAbsolute returns\n3Y 5Y 10Y All\nFund returns 8.2% 7.3% 8.3% 8.8%\nCategory average 8.6% 9.0% 6.4% NA\nRank with in category 11 12 5 NA\nUnderstand terms\nPeer Comparison\nDebt, Credit Risk funds Rating 1Y 3Y Fund Size(Cr)\nNippon India Credit Risk Fund Direct Growth\n5\n9.8% 9.1% 1,013.27\nICICI Prudential Credit Risk Fund Direct Plan Growth\n3\n10.0% 9.0% 5,936.30\nSBI Credit Risk Fund Direct Growth\n3\n8.7% 8.7% 2,182.37\nAxis Credit Risk Fund Direct Growth\n4\n9.4% 8.7% 366.48\nBaroda BNP Paribas Credit Risk Fund Direct Growth\n4\n8.8% 8.7% 199.04\nExpense ratio, exit load and tax\nExpense ratio: 1.02%\nInclusive of GST\nExit load\nExit load for units in excess of 15% of the investment, 1% will be charged for redemption within 12 months and 0.50% if redeemed after 12 months but within 18 months.\nStamp duty\n0.005% (from July 1st, 2020)\nTax implication\nReturns are taxed as per your Income Tax slab.\nUnderstand terms\nCheck past data\nFund management\nShobhit Mehrotra\nMar 2014 - Present\nView details\nDhruv Muchhal\nJun 2023 - Present\nView details\nFund house & investment objective\nFund house contact details\nPros and cons\nCategory: Debt Credit Risk\nPros\n10Y annualised returns higher than category average by 1.88%\nCons\nConsistently lower annualised returns than category average for the past 1Y, 3Y and 5Y\nHigher expense ratio: 1.02%\nCompare funds\nHDFC Credit Risk Debt Fund Direct Growth\nVS\nAdd mutual fund to compare\nRecently viewed\nHDFC NIFTY Next 50 Index Fund\n16.5%\n(3Y)\nHDFC NIFTY 100 Equal Weight Index Fund\n16.8%\n(3Y)\nHDFC Banking & Financial Services Fund\n16.7%\n(3Y)\nHDFC NIFTY50 Equal Weight Index Fund\n16.8%\n(3Y)\nFAQs\nHow to Invest in HDFC Credit Risk Debt Fund Direct Growth?\nWhat kind of returns does HDFC Credit Risk Debt Fund Direct Growth provide?\nHow much expense ratio is charged by HDFC Credit Risk Debt Fund Direct Growth?\n\n\nWhat is the AUM of HDFC Credit Risk Debt Fund Direct Growth?\nHow to Redeem HDFC Credit Risk Debt Fund Direct Growth?\nCan I invest in SIP and Lump Sum of HDFC Credit Risk Debt Fund Direct Growth?\nWhat is the NAV of HDFC Credit Risk Debt Fund Direct Growth?\nWhat is the PE and PB ratio of HDFC Credit Risk Debt Fund Direct Growth?\nLooking to invest in mutual funds?\nExplore diversified funds designed for every investor\nInvest Now\nHome\n>\nMutual Funds\n>\nHDFC Mutual Fund\n>\nHDFC Credit Risk Debt Fund Direct Growth\nVaishnavi Tech Park, South Tower, 3rd Floor\nSarjapur Main Road, Bellandur, Bengaluru \u2013 560103\nKarnataka\nContact Us\nDownload the App\nGROWW\nAbout Us\nPricing\nBlog\nMedia & Press\nCareers\nHelp & Support\nTrust & Safety\nInvestor Relations\nPRODUCTS\nStocks\nF&O\nMTF\nETF\nIPO\nMutual Funds\nCommodities\nGroww Terminal\n915 Terminal\nStocks Screener\nAlgo Trading\nGroww Digest\nDemat Account\nGroww AMC\n\u00a9 2016-2025 Groww. All rights reserved.\nVersion: 7.0.6\nShare Market\nIndices\nF&O\nMutual Funds\nETFs\nFunds By Groww\nCalculators\nIPO\nMiscellaneous\nTop Gainers Stocks\n52 Weeks High Stocks\nTata Motors\nNHPC\nITC\nWipro\nTop Losers Stocks\n52 Weeks Low Stocks\nIREDA\nState Bank of India\nAdani Power\nCDSL\nMost Traded Stocks\nStocks Market Calender\nTata Steel\nTata Power\nBharat Heavy Electricals\nIndian Oil Corporation\nStocks Feed\nSuzlon Energy\nZomato (Eternal)\nYes Bank\nInfosys\nNBCC\nShow More\nOthers:\nNSE\nBSE\nMCX\nTerms and Conditions\nPolicies and Procedures\nRegulatory & Other Info\nPrivacy Policy\nDisclosure\nSMART ODR\nDownload Forms\nInformation Security Practices\nInvestor Charter and Grievance\nBug Bounty",
    "scraped_at": "2025-12-22T03:21:44Z",
    "fund_managers": [
      "Shobhit Mehrotra",
      "Dhruv Muchhal"
    ]
  }
]