[
  {
    "page_url": "https://groww.in/mutual-funds/hdfc-mid-cap-fund-direct-growth",
    "fund_name": "HDFC Mid Cap Fund Direct Growth - NAV, Mutual Fund Performance & Portfolio",
    "amc_name": "HDFC Mutual Fund",
    "category": "Equity",
    "sub_category": "Mid Cap",
    "plan_type": "Direct",
    "option": "Growth",
    "latest_nav": null,
    "nav_date": null,
    "nav_change_pct": "+0.23%",
    "aum": null,
    "expense_ratio": "0.76%",
    "risk_level": "Very High Risk",
    "rating": null,
    "min_investment": {
      "lump_sum": null,
      "sip": null
    },
    "exit_load": "Exit load of 1% if redeemed within 1 year.",
    "lock_in_period": null,
    "returns": {
      "1y": null,
      "3y": null,
      "5y": null
    },
    "full_text": "Stocks\nF&O\nMutual Funds\nMore\nSearch Groww...\n\u2318K\nLogin/Sign up\nHDFC Mid Cap Fund Direct Growth\nEquity\nMid Cap\nVery High Risk\n+\n0\n1\n2\n3\n4\n5\n6\n7\n8\n9\n0\n1\n2\n3\n4\n5\n6\n7\n8\n9\n.\n0\n1\n2\n3\n4\n5\n6\n7\n8\n9\n1\n2\n3\n4\n5\n6\n7\n8\n9\n%\n3Y annualised\n+0.23%\n1D\n1M\n6M\n1Y\n3Y\n5Y\nAll\nNAV: 20 Feb '26\n\u20b9224.11\nMin. for SIP\n\u20b9100\nFund size\n\u20b992,186.87 Cr\nExpense ratio\n0.76%\nReturn calculator\nMonthly SIP\nOne time\nMonthly investment\n\u20b9100\nOver the past Total investment Would've become Historic returns Returns\n1 year \u20b91,200 \u20b91,280\n+6.67%\n3 years \u20b93,600 \u20b94,648\n+29.11%\n5 years \u20b96,000 \u20b910,182\n+69.70%\nHoldings (77)\nName Sector Instruments Assets\nMax Financial Services Ltd. Financial Equity 4.51%\nAU Small Finance Bank Ltd. Financial Equity 4.19%\nThe Federal Bank Ltd. Financial Equity 3.99%\nIndian Bank Financial Equity 3.64%\nBalkrishna Industries Ltd. Automobile Equity 3.31%\nIpca Laboratories Ltd. Healthcare Equity 2.87%\nCoforge Ltd. Technology Equity 2.80%\nGlenmark Pharmaceuticals Ltd. Healthcare Equity 2.77%\nFortis Healthcare Ltd. Healthcare Equity 2.62%\nHindustan Petroleum Corporation Ltd. Energy Equity 2.57%\nSee All\nMinimum investments\nMin. for 1st investment\n\u20b9100\nMin. for 2nd investment\n\u20b9100\nMin. for SIP\n\u20b9100\nReturns and rankings\nAnnualised returns\nAbsolute returns\nName 3Y 5Y 10Y All\nFund returns +26.7% +23.7% +20.7% +20.7%\nCategory average (Equity Mid Cap) +21.6% +21.5% +16.0% --\nRank (Equity Mid Cap) 5 2 5 --\nExit load, stamp duty and tax\nExit load\nExit load of 1% if redeemed within 1 year.\nStamp duty on investment: 0.005% (from July 1st, 2020)\nfrom July 1st 2020\nTax implication\nIf you redeem within one year, returns are taxed at 20%. If you redeem after one year, returns exceeding Rs 1.25 lakh in a financial year are taxed at 12.5%.\nCheck past data\nCompare similar funds\nName 1Y 3Y Fund Size(Cr)\nWhiteOak Capital Mid Cap Fund Direct Growth\n+19.11% +27.54% 4,467.89\nEdelweiss Mid Cap Direct Plan Growth\n+19.06% +27.36% 13,801.71\nNippon India Growth Mid Cap Fund Direct Growth\n+20.03% +27.19% 41,727.36\nHDFC Mid Cap Fund Direct Growth\n+19.35% +26.69% 92,186.87\nSundaram Mid Cap Fund Direct Growth\n+19.34% +25.90% 12,917.24\nCompare\nFund management\nCS\nChirag Setalvad\nDec 2012 - Present\nView details\nDM\nDhruv Muchhal\nJun 2023 - Present\nView details\nAbout HDFC Mid Cap Fund Direct Growth\nFund house\nOther plans in the same fund\nFAQs\nHow to Invest in HDFC Mid Cap Fund Direct Growth?\nWhat kind of returns does HDFC Mid Cap Fund Direct Growth provide?\nHow much expense ratio is charged by HDFC Mid Cap Fund Direct Growth?\n\n\nWhat is the AUM of HDFC Mid Cap Fund Direct Growth?\nHow to Redeem HDFC Mid Cap Fund Direct Growth?\nCan I invest in SIP and Lump Sum of HDFC Mid Cap Fund Direct Growth?\nWhat is the NAV of HDFC Mid Cap Fund Direct Growth?\nWhat is the PE and PB ratio of HDFC Mid Cap Fund Direct Growth?\nLooking to invest in mutual funds?\nExplore diversified funds designed for every investor\nInvest Now\nVaishnavi Tech Park, South Tower, 3rd Floor\nSarjapur Main Road, Bellandur, Bengaluru \u2013 560103\nKarnataka\nContact Us\nDownload the App\nGROWW\nAbout Us\nPricing\nBlog\nMedia & Press\nCareers\nHelp & Support\nTrust & Safety\nInvestor Relations\nPRODUCTS\nStocks\nF&O\nMTF\nETF\nIPO\nMutual Funds\nCommodities\nGroww Terminal\n915 Terminal\nStock Screens\nAlgo Trading\nGroww Digest\nDemat Account\nGroww AMC\n\u00a9 2016-2026 Groww. All rights reserved.\nVersion: 7.3.0\nShare Market\nIndices\nF&O\nMutual Funds\nETFs\nFunds By Groww\nCalculators\nIPO\nMiscellaneous\nTop Gainers Stocks\n52 Weeks High Stocks\nTata Motors\nNHPC\nITC\nWipro\nTop Losers Stocks\n52 Weeks Low Stocks\nIREDA\nState Bank of India\nAdani Power\nCDSL\nMost Traded Stocks\nStocks Market Calender\nTata Steel\nTata Power\nBharat Heavy Electricals\nIndian Oil Corporation\nStocks Feed\nSuzlon Energy\nZomato (Eternal)\nYes Bank\nInfosys\nNBCC\nShow More\nOthers:\nNSE\nBSE\nMCX\nTerms and Conditions\nPolicies and Procedures\nRegulatory & Other Info\nPrivacy Policy\nDisclosure\nSMART ODR\nDownload Forms\nInformation Security Practices\nInvestor Charter and Grievance\nBug Bounty",
    "scraped_at": "2026-02-21T03:39:35Z",
    "fund_managers": [
      "Dhruv Muchhal",
      "Chirag Setalvad"
    ]
  },
  {
    "page_url": "https://groww.in/mutual-funds/hdfc-focused-fund-direct-growth",
    "fund_name": "HDFC Focused Fund Direct Growth - NAV, Mutual Fund Performance & Portfolio",
    "amc_name": "HDFC Mutual Fund",
    "category": "Equity",
    "sub_category": "Flexi Cap",
    "plan_type": "Direct",
    "option": "Growth",
    "latest_nav": null,
    "nav_date": null,
    "nav_change_pct": "+0.43%",
    "aum": null,
    "expense_ratio": "0.63%",
    "risk_level": "Very High Risk",
    "rating": null,
    "min_investment": {
      "lump_sum": null,
      "sip": null
    },
    "exit_load": "Exit load of 1% if redeemed within 1 year",
    "lock_in_period": null,
    "returns": {
      "1y": null,
      "3y": null,
      "5y": null
    },
    "full_text": "Stocks\nF&O\nMutual Funds\nMore\nSearch Groww...\n\u2318K\nLogin/Sign up\nHDFC Focused Fund Direct Growth\nEquity\nFlexi Cap\nVery High Risk\n+\n0\n1\n2\n3\n4\n5\n6\n7\n8\n9\n0\n1\n2\n3\n4\n5\n6\n7\n8\n9\n.\n0\n1\n2\n3\n4\n5\n6\n7\n8\n9\n0\n1\n2\n3\n4\n5\n6\n7\n8\n9\n%\n3Y annualised\n+0.43%\n1D\n1M\n6M\n1Y\n3Y\n5Y\nAll\nNAV: 20 Feb '26\n\u20b9274.18\nMin. for SIP\n\u20b9100\nFund size\n\u20b926,332.20 Cr\nExpense ratio\n0.63%\nReturn calculator\nMonthly SIP\nOne time\nMonthly investment\n\u20b9100\nOver the past Total investment Would've become Historic returns Returns\n1 year \u20b91,200 \u20b91,285\n+7.08%\n3 years \u20b93,600 \u20b95,123\n+42.31%\n5 years \u20b96,000 \u20b911,506\n+91.77%\nHoldings (31)\nName Sector Instruments Assets\nHDFC Bank Ltd. Financial Equity 9.89%\nICICI Bank Ltd. Financial Equity 9.62%\nAxis Bank Ltd. Financial Equity 7.81%\nKotak Mahindra Bank Ltd. Financial Equity 5.85%\nState Bank of India Financial Equity 5.60%\nHCL Technologies Ltd. Technology Equity 4.80%\nCipla Ltd. Healthcare Equity 3.84%\nMaruti Suzuki India Ltd. Automobile Equity 3.79%\nBharti Airtel Ltd. Communication Equity 3.60%\nSBI Life Insurance Company Ltd. Insurance Equity 3.57%\nSee All\nMinimum investments\nMin. for 1st investment\n\u20b9100\nMin. for 2nd investment\n\u20b9100\nMin. for SIP\n\u20b9100\nReturns and rankings\nAnnualised returns\nAbsolute returns\nName 3Y 5Y 10Y All\nFund returns +23.2% +23.1% +18.1% +15.7%\nCategory average (Equity Flexi Cap) +16.0% +15.6% +13.5% --\nRank (Equity Flexi Cap) 5 1 5 --\nExit load, stamp duty and tax\nExit load\nExit load of 1% if redeemed within 1 year\nStamp duty on investment: 0.005% (from July 1st, 2020)\nfrom July 1st 2020\nTax implication\nIf you redeem within one year, returns are taxed at 20%. If you redeem after one year, returns exceeding Rs 1.25 lakh in a financial year are taxed at 12.5%.\nCheck past data\nCompare similar funds\nName 1Y 3Y Fund Size(Cr)\nHDFC Flexi Cap Direct Plan Growth\n+16.67% +22.97% 97,451.56\nInvesco India Flexi Cap Fund Direct Growth\n+11.16% +21.80% 4,584.14\nParag Parikh Flexi Cap Fund Direct Growth\n+7.88% +20.56% 1,33,969.81\nHSBC Flexi Cap Fund Direct Growth\n+13.71% +19.70% 5,317.76\nFranklin India Flexi Cap Fund Direct Growth\n+11.45% +19.65% 19,528.04\nCompare\nFund management\nAG\nAmit Ganatra\nJan 2026 - Present\nView details\nDM\nDhruv Muchhal\nJun 2023 - Present\nView details\nAbout HDFC Focused Fund Direct Growth\nFund house\nOther plans in the same fund\nRecently viewed\nHDFC Mid Cap Fund Direct Growth\n26.7%\n(3Y)\nFAQs\nHow to Invest in HDFC Focused Fund Direct Growth?\nWhat kind of returns does HDFC Focused Fund Direct Growth provide?\nHow much expense ratio is charged by HDFC Focused Fund Direct Growth?\n\n\nWhat is the AUM of HDFC Focused Fund Direct Growth?\nHow to Redeem HDFC Focused Fund Direct Growth?\nCan I invest in SIP and Lump Sum of HDFC Focused Fund Direct Growth?\nWhat is the NAV of HDFC Focused Fund Direct Growth?\nWhat is the PE and PB ratio of HDFC Focused Fund Direct Growth?\nLooking to invest in mutual funds?\nExplore diversified funds designed for every investor\nInvest Now\nVaishnavi Tech Park, South Tower, 3rd Floor\nSarjapur Main Road, Bellandur, Bengaluru \u2013 560103\nKarnataka\nContact Us\nDownload the App\nGROWW\nAbout Us\nPricing\nBlog\nMedia & Press\nCareers\nHelp & Support\nTrust & Safety\nInvestor Relations\nPRODUCTS\nStocks\nF&O\nMTF\nETF\nIPO\nMutual Funds\nCommodities\nGroww Terminal\n915 Terminal\nStock Screens\nAlgo Trading\nGroww Digest\nDemat Account\nGroww AMC\n\u00a9 2016-2026 Groww. All rights reserved.\nVersion: 7.3.0\nShare Market\nIndices\nF&O\nMutual Funds\nETFs\nFunds By Groww\nCalculators\nIPO\nMiscellaneous\nTop Gainers Stocks\n52 Weeks High Stocks\nTata Motors\nNHPC\nITC\nWipro\nTop Losers Stocks\n52 Weeks Low Stocks\nIREDA\nState Bank of India\nAdani Power\nCDSL\nMost Traded Stocks\nStocks Market Calender\nTata Steel\nTata Power\nBharat Heavy Electricals\nIndian Oil Corporation\nStocks Feed\nSuzlon Energy\nZomato (Eternal)\nYes Bank\nInfosys\nNBCC\nShow More\nOthers:\nNSE\nBSE\nMCX\nTerms and Conditions\nPolicies and Procedures\nRegulatory & Other Info\nPrivacy Policy\nDisclosure\nSMART ODR\nDownload Forms\nInformation Security Practices\nInvestor Charter and Grievance\nBug Bounty",
    "scraped_at": "2026-02-21T03:39:48Z",
    "fund_managers": [
      "Amit Ganatra",
      "Dhruv Muchhal"
    ]
  },
  {
    "page_url": "https://groww.in/mutual-funds/hdfc-equity-fund-direct-growth",
    "fund_name": "HDFC Flexi Cap Direct Plan Growth - NAV, Mutual Fund Performance & Portfolio",
    "amc_name": "HDFC Mutual Fund",
    "category": "Equity",
    "sub_category": "Flexi Cap",
    "plan_type": "Direct",
    "option": "Growth",
    "latest_nav": null,
    "nav_date": null,
    "nav_change_pct": "+0.42%",
    "aum": null,
    "expense_ratio": "0.70%",
    "risk_level": "Very High Risk",
    "rating": null,
    "min_investment": {
      "lump_sum": null,
      "sip": null
    },
    "exit_load": "Exit load of 1% if redeemed within 1 year",
    "lock_in_period": null,
    "returns": {
      "1y": null,
      "3y": null,
      "5y": null
    },
    "full_text": "Stocks\nF&O\nMutual Funds\nMore\nSearch Groww...\n\u2318K\nLogin/Sign up\nHDFC Flexi Cap Direct Plan Growth\nEquity\nFlexi Cap\nVery High Risk\n+\n0\n1\n2\n3\n4\n5\n6\n7\n8\n9\n0\n1\n2\n3\n4\n5\n6\n7\n8\n9\n.\n1\n2\n3\n4\n5\n6\n7\n8\n9\n0\n1\n2\n3\n4\n5\n6\n7\n8\n9\n%\n3Y annualised\n+0.42%\n1D\n1M\n6M\n1Y\n3Y\n5Y\nAll\nNAV: 20 Feb '26\n\u20b92,282.94\nMin. for SIP\n\u20b9100\nFund size\n\u20b997,451.56 Cr\nExpense ratio\n0.70%\nReturn calculator\nMonthly SIP\nOne time\nMonthly investment\n\u20b9100\nOver the past Total investment Would've become Historic returns Returns\n1 year \u20b91,200 \u20b91,267\n+5.58%\n3 years \u20b93,600 \u20b94,612\n+28.11%\n5 years \u20b96,000 \u20b99,787\n+63.12%\nHoldings (55)\nName Sector Instruments Assets\nICICI Bank Ltd. Financial Equity 8.90%\nHDFC Bank Ltd. Financial Equity 7.82%\nAxis Bank Ltd. Financial Equity 7.59%\nState Bank of India Financial Equity 4.86%\nSBI Life Insurance Company Ltd. Insurance Equity 4.10%\nKotak Mahindra Bank Ltd. Financial Equity 3.81%\nHCL Technologies Ltd. Technology Equity 3.13%\nMaruti Suzuki India Ltd. Automobile Equity 3.00%\nCipla Ltd. Healthcare Equity 2.85%\nPower Grid Corporation Of India Ltd. Energy Equity 2.40%\nSee All\nMinimum investments\nMin. for 1st investment\n\u20b9100\nMin. for 2nd investment\n\u20b9100\nMin. for SIP\n\u20b9100\nReturns and rankings\nAnnualised returns\nAbsolute returns\nName 3Y 5Y 10Y All\nFund returns +23.0% +21.2% +19.5% +16.8%\nCategory average (Equity Flexi Cap) +16.0% +15.6% +13.5% --\nRank (Equity Flexi Cap) 6 3 1 --\nExit load, stamp duty and tax\nExit load\nExit load of 1% if redeemed within 1 year\nStamp duty on investment: 0.005% (from July 1st, 2020)\nfrom July 1st 2020\nTax implication\nIf you redeem within one year, returns are taxed at 20%. If you redeem after one year, returns exceeding Rs 1.25 lakh in a financial year are taxed at 12.5%.\nCheck past data\nCompare similar funds\nName 1Y 3Y Fund Size(Cr)\nHDFC Flexi Cap Direct Plan Growth\n+16.67% +22.97% 97,451.56\nInvesco India Flexi Cap Fund Direct Growth\n+11.16% +21.80% 4,584.14\nParag Parikh Flexi Cap Fund Direct Growth\n+7.88% +20.56% 1,33,969.81\nHSBC Flexi Cap Fund Direct Growth\n+13.71% +19.70% 5,317.76\nFranklin India Flexi Cap Fund Direct Growth\n+11.45% +19.65% 19,528.04\nCompare\nFund management\nAG\nAmit Ganatra\nJan 2026 - Present\nView details\nDM\nDhruv Muchhal\nJun 2023 - Present\nView details\nAbout HDFC Flexi Cap Direct Plan Growth\nFund house\nRecently viewed\nHDFC Focused Fund Direct Growth\n23.2%\n(3Y)\nHDFC Mid Cap Fund Direct Growth\n26.7%\n(3Y)\nFAQs\nHow to Invest in HDFC Flexi Cap Direct Plan Growth?\nWhat kind of returns does HDFC Flexi Cap Direct Plan Growth provide?\nHow much expense ratio is charged by HDFC Flexi Cap Direct Plan Growth?\n\n\nWhat is the AUM of HDFC Flexi Cap Direct Plan Growth?\nHow to Redeem HDFC Flexi Cap Direct Plan Growth?\nCan I invest in SIP and Lump Sum of HDFC Flexi Cap Direct Plan Growth?\nWhat is the NAV of HDFC Flexi Cap Direct Plan Growth?\nWhat is the PE and PB ratio of HDFC Flexi Cap Direct Plan Growth?\nLooking to invest in mutual funds?\nExplore diversified funds designed for every investor\nInvest Now\nVaishnavi Tech Park, South Tower, 3rd Floor\nSarjapur Main Road, Bellandur, Bengaluru \u2013 560103\nKarnataka\nContact Us\nDownload the App\nGROWW\nAbout Us\nPricing\nBlog\nMedia & Press\nCareers\nHelp & Support\nTrust & Safety\nInvestor Relations\nPRODUCTS\nStocks\nF&O\nMTF\nETF\nIPO\nMutual Funds\nCommodities\nGroww Terminal\n915 Terminal\nStock Screens\nAlgo Trading\nGroww Digest\nDemat Account\nGroww AMC\n\u00a9 2016-2026 Groww. All rights reserved.\nVersion: 7.3.0\nShare Market\nIndices\nF&O\nMutual Funds\nETFs\nFunds By Groww\nCalculators\nIPO\nMiscellaneous\nTop Gainers Stocks\n52 Weeks High Stocks\nTata Motors\nNHPC\nITC\nWipro\nTop Losers Stocks\n52 Weeks Low Stocks\nIREDA\nState Bank of India\nAdani Power\nCDSL\nMost Traded Stocks\nStocks Market Calender\nTata Steel\nTata Power\nBharat Heavy Electricals\nIndian Oil Corporation\nStocks Feed\nSuzlon Energy\nZomato (Eternal)\nYes Bank\nInfosys\nNBCC\nShow More\nOthers:\nNSE\nBSE\nMCX\nTerms and Conditions\nPolicies and Procedures\nRegulatory & Other Info\nPrivacy Policy\nDisclosure\nSMART ODR\nDownload Forms\nInformation Security Practices\nInvestor Charter and Grievance\nBug Bounty",
    "scraped_at": "2026-02-21T03:39:57Z",
    "fund_managers": [
      "Amit Ganatra",
      "Dhruv Muchhal"
    ]
  },
  {
    "page_url": "https://groww.in/mutual-funds/hdfc-elss-tax-saver-fund-direct-plan-growth",
    "fund_name": "HDFC ELSS Tax Saver Fund Direct Plan Growth - NAV, Mutual Fund Performance & Portfolio",
    "amc_name": "HDFC Mutual Fund",
    "category": "Equity",
    "sub_category": "ELSS",
    "plan_type": "Direct",
    "option": "Growth",
    "latest_nav": null,
    "nav_date": null,
    "nav_change_pct": "+0.45%",
    "aum": null,
    "expense_ratio": "1.08%",
    "risk_level": "Very High Risk",
    "rating": null,
    "min_investment": {
      "lump_sum": null,
      "sip": null
    },
    "exit_load": "Nil",
    "lock_in_period": "Equity\nELSS\nVery High Risk\n+\n0\n1\n2\n3\n4\n5\n6\n7\n8\n9\n0\n1\n2\n3\n4\n5\n6\n7\n8\n9\n.\n1\n2\n3\n4\n5\n6\n7\n8\n9\n0\n1\n2\n3\n4\n5\n6\n7\n8\n9\n%\n3Y a",
    "returns": {
      "1y": null,
      "3y": null,
      "5y": null
    },
    "full_text": "Stocks\nF&O\nMutual Funds\nMore\nSearch Groww...\n\u2318K\nLogin/Sign up\nHDFC ELSS Tax Saver Fund Direct Plan Growth\nELSS \u2022 3Y Lock-in\nEquity\nELSS\nVery High Risk\n+\n0\n1\n2\n3\n4\n5\n6\n7\n8\n9\n0\n1\n2\n3\n4\n5\n6\n7\n8\n9\n.\n1\n2\n3\n4\n5\n6\n7\n8\n9\n0\n1\n2\n3\n4\n5\n6\n7\n8\n9\n%\n3Y annualised\n+0.45%\n1D\n1M\n6M\n1Y\n3Y\n5Y\nAll\nNAV: 20 Feb '26\n\u20b91,563.22\nMin. for SIP\n\u20b9500\nFund size\n\u20b916,749.21 Cr\nExpense ratio\n1.08%\nReturn calculator\nMonthly SIP\nOne time\nMonthly investment\n\u20b9500\nOver the past Total investment Would've become Historic returns Returns\n1 year \u20b96,000 \u20b96,226\n+3.77%\n3 years \u20b918,000 \u20b922,393\n+24.41%\n5 years \u20b930,000 \u20b946,982\n+56.61%\nHoldings (58)\nName Sector Instruments Assets\nHDFC Bank Ltd. Financial Equity 9.21%\nICICI Bank Ltd. Financial Equity 8.90%\nAxis Bank Ltd. Financial Equity 8.63%\nSBI Life Insurance Company Ltd. Insurance Equity 5.37%\nMaruti Suzuki India Ltd. Automobile Equity 4.79%\nState Bank of India Financial Equity 4.50%\nKotak Mahindra Bank Ltd. Financial Equity 4.26%\nBharti Airtel Ltd. Communication Equity 4.00%\nHCL Technologies Ltd. Technology Equity 3.39%\nReliance Industries Ltd. Energy Equity 2.77%\nSee All\nMinimum investments\nMin. for 1st investment\n\u20b9500\nMin. for 2nd investment\n\u20b9500\nMin. for SIP\n\u20b9500\nReturns and rankings\nAnnualised returns\nAbsolute returns\nName 3Y 5Y 10Y All\nFund returns +21.9% +20.2% +16.9% +15.1%\nCategory average (Equity ELSS) +16.4% +16.5% +14.0% --\nRank (Equity ELSS) 4 2 12 --\nExit load, stamp duty and tax\nExit load\nNil\nStamp duty on investment: 0.005% (from July 1st, 2020)\nfrom July 1st 2020\nTax implication\nIf you redeem within one year, returns are taxed at 20%. If you redeem after one year, returns exceeding Rs 1.25 lakh in a financial year are taxed at 12.5%.\nCheck past data\nCompare similar funds\nName 1Y 3Y Fund Size(Cr)\nSBI ELSS Tax Saver Fund Direct Growth\n+12.10% +24.50% 31,861.52\nWhiteOak Capital ELSS Tax Saver Fund Direct Growth\n+12.02% +22.06% 437.94\nHDFC ELSS Tax Saver Fund Direct Plan Growth\n+14.13% +21.90% 16,749.21\nQuantum ELSS Tax Saver Fund Direct Growth\n+6.16% +17.12% 221.03\nParag Parikh ELSS Tax Saver Fund Direct Growth\n+5.62% +16.67% 5,768.08\nCompare\nFund management\nAK\nAmar Kalkundrikar\nDec 2025 - Present\nView details\nDM\nDhruv Muchhal\nJun 2023 - Present\nView details\nAbout HDFC ELSS Tax Saver Fund Direct Plan Growth\nFund house\nOther plans in the same fund\nRecently viewed\nHDFC Flexi Cap Direct Plan Growth\n23.0%\n(3Y)\nHDFC Focused Fund Direct Growth\n23.2%\n(3Y)\nHDFC Mid Cap Fund Direct Growth\n26.7%\n(3Y)\nFAQs\nHow to Invest in HDFC ELSS Tax Saver Fund Direct Plan Growth?\nWhat kind of returns does HDFC ELSS Tax Saver Fund Direct Plan Growth provide?\nHow much expense ratio is charged by HDFC ELSS Tax Saver Fund Direct Plan Growth?\n\n\nWhat is the AUM of HDFC ELSS Tax Saver Fund Direct Plan Growth?\nHow to Redeem HDFC ELSS Tax Saver Fund Direct Plan Growth?\nCan I invest in SIP and Lump Sum of HDFC ELSS Tax Saver Fund Direct Plan Growth?\nWhat is the NAV of HDFC ELSS Tax Saver Fund Direct Plan Growth?\nWhat is the PE and PB ratio of HDFC ELSS Tax Saver Fund Direct Plan Growth?\nLooking to invest in mutual funds?\nExplore diversified funds designed for every investor\nInvest Now\nVaishnavi Tech Park, South Tower, 3rd Floor\nSarjapur Main Road, Bellandur, Bengaluru \u2013 560103\nKarnataka\nContact Us\nDownload the App\nGROWW\nAbout Us\nPricing\nBlog\nMedia & Press\nCareers\nHelp & Support\nTrust & Safety\nInvestor Relations\nPRODUCTS\nStocks\nF&O\nMTF\nETF\nIPO\nMutual Funds\nCommodities\nGroww Terminal\n915 Terminal\nStock Screens\nAlgo Trading\nGroww Digest\nDemat Account\nGroww AMC\n\u00a9 2016-2026 Groww. All rights reserved.\nVersion: 7.3.0\nShare Market\nIndices\nF&O\nMutual Funds\nETFs\nFunds By Groww\nCalculators\nIPO\nMiscellaneous\nTop Gainers Stocks\n52 Weeks High Stocks\nTata Motors\nNHPC\nITC\nWipro\nTop Losers Stocks\n52 Weeks Low Stocks\nIREDA\nState Bank of India\nAdani Power\nCDSL\nMost Traded Stocks\nStocks Market Calender\nTata Steel\nTata Power\nBharat Heavy Electricals\nIndian Oil Corporation\nStocks Feed\nSuzlon Energy\nZomato (Eternal)\nYes Bank\nInfosys\nNBCC\nShow More\nOthers:\nNSE\nBSE\nMCX\nTerms and Conditions\nPolicies and Procedures\nRegulatory & Other Info\nPrivacy Policy\nDisclosure\nSMART ODR\nDownload Forms\nInformation Security Practices\nInvestor Charter and Grievance\nBug Bounty",
    "scraped_at": "2026-02-21T03:40:06Z",
    "fund_managers": [
      "Amar Kalkundrikar",
      "Dhruv Muchhal"
    ]
  },
  {
    "page_url": "https://groww.in/mutual-funds/hdfc-retirement-savings-fund-equity-plan-direct-growth",
    "fund_name": "HDFC Retirement Savings Fund Equity Plan Direct Growth - NAV, Mutual Fund Performance & Portfolio",
    "amc_name": "HDFC Mutual Fund",
    "category": "Equity",
    "sub_category": "ELSS",
    "plan_type": "Direct",
    "option": "Growth",
    "latest_nav": null,
    "nav_date": null,
    "nav_change_pct": "+0.29%",
    "aum": null,
    "expense_ratio": "0.78%",
    "risk_level": "Very High Risk",
    "rating": null,
    "min_investment": {
      "lump_sum": null,
      "sip": null
    },
    "exit_load": "Nil",
    "lock_in_period": "Equity\nFlexi Cap\nVery High Risk\n+\n0\n1\n2\n3\n4\n5\n6\n7\n8\n9\n0\n1\n2\n3\n4\n5\n6\n7\n8\n9\n.\n0\n1\n2\n3\n4\n5\n6\n7\n8\n9\n0\n1\n2\n3\n4\n5\n6\n7\n8\n9\n%\n3Y a",
    "returns": {
      "1y": null,
      "3y": null,
      "5y": null
    },
    "full_text": "Stocks\nF&O\nMutual Funds\nMore\nSearch Groww...\n\u2318K\nLogin/Sign up\nHDFC Retirement Savings Fund Equity Plan Direct Growth\nELSS \u2022 5Y Lock-in\nEquity\nFlexi Cap\nVery High Risk\n+\n0\n1\n2\n3\n4\n5\n6\n7\n8\n9\n0\n1\n2\n3\n4\n5\n6\n7\n8\n9\n.\n0\n1\n2\n3\n4\n5\n6\n7\n8\n9\n0\n1\n2\n3\n4\n5\n6\n7\n8\n9\n%\n3Y annualised\n+0.29%\n1D\n1M\n6M\n1Y\n3Y\n5Y\nAll\nNAV: 20 Feb '26\n\u20b957.95\nMin. for SIP\n\u20b9100\nFund size\n\u20b96,941.17 Cr\nExpense ratio\n0.78%\nReturn calculator\nMonthly SIP\nOne time\nMonthly investment\n\u20b9100\nOver the past Total investment Would've become Historic returns Returns\n1 year \u20b91,200 \u20b91,129\n-5.92%\n3 years \u20b93,600 \u20b94,447\n+23.53%\n5 years \u20b96,000 \u20b99,925\n+65.42%\nHoldings (76)\nName Sector Instruments Assets\nHDFC Bank Ltd. Financial Equity 8.03%\nICICI Bank Ltd. Financial Equity 6.25%\nAxis Bank Ltd. Financial Equity 4.74%\nReliance Industries Ltd. Energy Equity 4.02%\nInfosys Ltd. Technology Equity 3.78%\nKotak Mahindra Bank Ltd. Financial Equity 3.35%\nTata Consultancy Services Ltd. Technology Equity 3.15%\nMaruti Suzuki India Ltd. Automobile Equity 3.15%\nState Bank of India Financial Equity 3.10%\nBharti Airtel Ltd. Communication Equity 2.84%\nSee All\nMinimum investments\nMin. for 1st investment\n\u20b9100\nMin. for 2nd investment\n\u20b9100\nMin. for SIP\n\u20b9100\nReturns and rankings\nAnnualised returns\nAbsolute returns\nName 1Y 3Y 5Y All\nFund returns +11.4% +18.3% +19.2% +19.2%\nCategory average (Equity Flexi Cap) +2.2% +16.0% +15.6% --\nRank (Equity Flexi Cap) 62 31 7 --\nExit load, stamp duty and tax\nExit load\nNil\nStamp duty on investment: 0.005% (from July 1st, 2020)\nfrom July 1st 2020\nTax implication\nIf you redeem within one year, returns are taxed at 20%. If you redeem after one year, returns exceeding Rs 1.25 lakh in a financial year are taxed at 12.5%.\nCheck past data\nCompare similar funds\nName 1Y 3Y Fund Size(Cr)\nHDFC Flexi Cap Direct Plan Growth\n+16.67% +22.97% 97,451.56\nInvesco India Flexi Cap Fund Direct Growth\n+11.16% +21.80% 4,584.14\nParag Parikh Flexi Cap Fund Direct Growth\n+7.88% +20.56% 1,33,969.81\nHSBC Flexi Cap Fund Direct Growth\n+13.71% +19.70% 5,317.76\nFranklin India Flexi Cap Fund Direct Growth\n+11.45% +19.65% 19,528.04\nCompare\nFund management\nSM\nShobhit Mehrotra\nFeb 2016 - Present\nView details\nAA\nArun Agarwal\nMar 2025 - Present\nView details\nSR\nSrinivasan Ramamurthy\nDec 2021 - Present\nView details\nDM\nDhruv Muchhal\nJun 2023 - Present\nView details\nNM\nNandita Menezes\nMar 2025 - Present\nView details\nAbout HDFC Retirement Savings Fund Equity Plan Direct Growth\nFund house\nOther plans in the same fund\nRecently viewed\nHDFC ELSS Tax Saver Fund Direct Plan Growth\n21.9%\n(3Y)\nHDFC Flexi Cap Direct Plan Growth\n23.0%\n(3Y)\nHDFC Focused Fund Direct Growth\n23.2%\n(3Y)\nHDFC Mid Cap Fund Direct Growth\n26.7%\n(3Y)\nFAQs\nHow to Invest in HDFC Retirement Savings Fund Equity Plan Direct Growth?\nWhat kind of returns does HDFC Retirement Savings Fund Equity Plan Direct Growth provide?\nHow much expense ratio is charged by HDFC Retirement Savings Fund Equity Plan Direct Growth?\n\n\nWhat is the AUM of HDFC Retirement Savings Fund Equity Plan Direct Growth?\nHow to Redeem HDFC Retirement Savings Fund Equity Plan Direct Growth?\nCan I invest in SIP and Lump Sum of HDFC Retirement Savings Fund Equity Plan Direct Growth?\nWhat is the NAV of HDFC Retirement Savings Fund Equity Plan Direct Growth?\nWhat is the PE and PB ratio of HDFC Retirement Savings Fund Equity Plan Direct Growth?\nLooking to invest in mutual funds?\nExplore diversified funds designed for every investor\nInvest Now\nVaishnavi Tech Park, South Tower, 3rd Floor\nSarjapur Main Road, Bellandur, Bengaluru \u2013 560103\nKarnataka\nContact Us\nDownload the App\nGROWW\nAbout Us\nPricing\nBlog\nMedia & Press\nCareers\nHelp & Support\nTrust & Safety\nInvestor Relations\nPRODUCTS\nStocks\nF&O\nMTF\nETF\nIPO\nMutual Funds\nCommodities\nGroww Terminal\n915 Terminal\nStock Screens\nAlgo Trading\nGroww Digest\nDemat Account\nGroww AMC\n\u00a9 2016-2026 Groww. All rights reserved.\nVersion: 7.3.0\nShare Market\nIndices\nF&O\nMutual Funds\nETFs\nFunds By Groww\nCalculators\nIPO\nMiscellaneous\nTop Gainers Stocks\n52 Weeks High Stocks\nTata Motors\nNHPC\nITC\nWipro\nTop Losers Stocks\n52 Weeks Low Stocks\nIREDA\nState Bank of India\nAdani Power\nCDSL\nMost Traded Stocks\nStocks Market Calender\nTata Steel\nTata Power\nBharat Heavy Electricals\nIndian Oil Corporation\nStocks Feed\nSuzlon Energy\nZomato (Eternal)\nYes Bank\nInfosys\nNBCC\nShow More\nOthers:\nNSE\nBSE\nMCX\nTerms and Conditions\nPolicies and Procedures\nRegulatory & Other Info\nPrivacy Policy\nDisclosure\nSMART ODR\nDownload Forms\nInformation Security Practices\nInvestor Charter and Grievance\nBug Bounty",
    "scraped_at": "2026-02-21T03:40:16Z",
    "fund_managers": [
      "Nandita Menezes",
      "Srinivasan Ramamurthy",
      "Shobhit Mehrotra"
    ]
  },
  {
    "page_url": "https://groww.in/mutual-funds/hdfc-balanced-advantage-fund-direct-growth",
    "fund_name": "HDFC Balanced Advantage Fund Direct Growth - NAV, Mutual Fund Performance & Portfolio",
    "amc_name": "HDFC Mutual Fund",
    "category": "Hybrid",
    "sub_category": "Balanced",
    "plan_type": "Direct",
    "option": "Growth",
    "latest_nav": null,
    "nav_date": null,
    "nav_change_pct": "+0.30%",
    "aum": null,
    "expense_ratio": "0.76%",
    "risk_level": "Very High Risk",
    "rating": null,
    "min_investment": {
      "lump_sum": null,
      "sip": null
    },
    "exit_load": "Exit Load for units in excess of 15% of the investment,1% will be charged for redemption within 1 year.",
    "lock_in_period": null,
    "returns": {
      "1y": null,
      "3y": null,
      "5y": null
    },
    "full_text": "Stocks\nF&O\nMutual Funds\nMore\nSearch Groww...\n\u2318K\nLogin/Sign up\nHDFC Balanced Advantage Fund Direct Growth\nHybrid\nDynamic Asset Allocation\nVery High Risk\n+\n0\n1\n2\n3\n4\n5\n6\n7\n8\n9\n0\n1\n2\n3\n4\n5\n6\n7\n8\n9\n.\n0\n1\n2\n3\n4\n5\n6\n7\n8\n9\n0\n1\n2\n3\n4\n5\n6\n7\n8\n9\n%\n3Y annualised\n+0.30%\n1D\n1M\n6M\n1Y\n3Y\n5Y\nAll\nNAV: 20 Feb '26\n\u20b9576.21\nMin. for SIP\n\u20b9100\nFund size\n\u20b91,06,820.61 Cr\nExpense ratio\n0.76%\nReturn calculator\nMonthly SIP\nOne time\nMonthly investment\n\u20b9100\nOver the past Total investment Would've become Historic returns Returns\n1 year \u20b91,200 \u20b91,201\n+0.08%\n3 years \u20b93,600 \u20b94,664\n+29.56%\n5 years \u20b96,000 \u20b910,139\n+68.98%\nHoldings (305)\nName Sector Instruments Assets\nHDFC Bank Ltd. Financial Equity 4.48%\nICICI Bank Ltd. Financial Equity 4.09%\nReliance Industries Ltd. Energy Equity 3.67%\nState Bank of India Financial Equity 3.53%\nBharti Airtel Ltd. Communication Equity 2.80%\nAxis Bank Ltd. Financial Equity 2.54%\nInfosys Ltd. Technology Equity 2.50%\nLarsen & Toubro Ltd. Construction Equity 2.42%\nNTPC Ltd. Energy Equity 2.12%\nGOI Sovereign GOI Sec 2.10%\nSee All\nMinimum investments\nMin. for 1st investment\n\u20b9100\nMin. for 2nd investment\n\u20b9100\nMin. for SIP\n\u20b9100\nReturns and rankings\nAnnualised returns\nAbsolute returns\nName 3Y 5Y 10Y All\nFund returns +18.6% +17.8% +16.7% +15.3%\nCategory average (Hybrid Dynamic Asset Allocation) +11.9% +10.7% +9.6% --\nRank (Hybrid Dynamic Asset Allocation) 1 1 -- --\nExit load, stamp duty and tax\nExit load\nExit Load for units in excess of 15% of the investment,1% will be charged for redemption within 1 year.\nStamp duty on investment: 0.005% (from July 1st, 2020)\nfrom July 1st 2020\nTax implication\nIf you redeem within one year, returns are taxed at 20%. If you redeem after one year, returns exceeding Rs 1.25 lakh in a financial year are taxed at 12.5%.\nCheck past data\nCompare similar funds\nName 1Y 3Y Fund Size(Cr)\nHDFC Balanced Advantage Fund Direct Growth\n+11.56% +18.62% 1,06,820.61\nSBI Balanced Advantage Fund Direct Growth\n+12.24% +15.08% 40,202.72\nNippon India Balanced Advantage Fund Direct Growth\n+11.43% +14.23% 9,597.81\nICICI Prudential Balanced Advantage Direct Growth\n+13.64% +14.19% 70,343.40\nDSP Dynamic Asset Allocation Fund Direct Growth\n+11.20% +13.66% 3,701.59\nCompare\nFund management\nAB\nAnil Bamboli\nJul 2022 - Present\nView details\nGA\nGopal Agrawal\nJul 2022 - Present\nView details\nAA\nArun Agarwal\nOct 2022 - Present\nView details\nSR\nSrinivasan Ramamurthy\nJul 2022 - Present\nView details\nDM\nDhruv Muchhal\nJun 2023 - Present\nView details\nNM\nNandita Menezes\nMar 2025 - Present\nView details\nAbout HDFC Balanced Advantage Fund Direct Growth\nFund house\nOther plans in the same fund\nRecently viewed\nHDFC Retirement Savings Fund Equity Plan Direct Growth\n18.3%\n(3Y)\nHDFC ELSS Tax Saver Fund Direct Plan Growth\n21.9%\n(3Y)\nHDFC Flexi Cap Direct Plan Growth\n23.0%\n(3Y)\nHDFC Focused Fund Direct Growth\n23.2%\n(3Y)\nFAQs\nHow to Invest in HDFC Balanced Advantage Fund Direct Growth?\nWhat kind of returns does HDFC Balanced Advantage Fund Direct Growth provide?\nHow much expense ratio is charged by HDFC Balanced Advantage Fund Direct Growth?\n\n\nWhat is the AUM of HDFC Balanced Advantage Fund Direct Growth?\nHow to Redeem HDFC Balanced Advantage Fund Direct Growth?\nCan I invest in SIP and Lump Sum of HDFC Balanced Advantage Fund Direct Growth?\nWhat is the NAV of HDFC Balanced Advantage Fund Direct Growth?\nWhat is the PE and PB ratio of HDFC Balanced Advantage Fund Direct Growth?\nLooking to invest in mutual funds?\nExplore diversified funds designed for every investor\nInvest Now\nVaishnavi Tech Park, South Tower, 3rd Floor\nSarjapur Main Road, Bellandur, Bengaluru \u2013 560103\nKarnataka\nContact Us\nDownload the App\nGROWW\nAbout Us\nPricing\nBlog\nMedia & Press\nCareers\nHelp & Support\nTrust & Safety\nInvestor Relations\nPRODUCTS\nStocks\nF&O\nMTF\nETF\nIPO\nMutual Funds\nCommodities\nGroww Terminal\n915 Terminal\nStock Screens\nAlgo Trading\nGroww Digest\nDemat Account\nGroww AMC\n\u00a9 2016-2026 Groww. All rights reserved.\nVersion: 7.3.0\nShare Market\nIndices\nF&O\nMutual Funds\nETFs\nFunds By Groww\nCalculators\nIPO\nMiscellaneous\nTop Gainers Stocks\n52 Weeks High Stocks\nTata Motors\nNHPC\nITC\nWipro\nTop Losers Stocks\n52 Weeks Low Stocks\nIREDA\nState Bank of India\nAdani Power\nCDSL\nMost Traded Stocks\nStocks Market Calender\nTata Steel\nTata Power\nBharat Heavy Electricals\nIndian Oil Corporation\nStocks Feed\nSuzlon Energy\nZomato (Eternal)\nYes Bank\nInfosys\nNBCC\nShow More\nOthers:\nNSE\nBSE\nMCX\nTerms and Conditions\nPolicies and Procedures\nRegulatory & Other Info\nPrivacy Policy\nDisclosure\nSMART ODR\nDownload Forms\nInformation Security Practices\nInvestor Charter and Grievance\nBug Bounty",
    "scraped_at": "2026-02-21T03:40:25Z",
    "fund_managers": [
      "Srinivasan Ramamurthy",
      "Nandita Menezes",
      "Arun Agarwal"
    ]
  },
  {
    "page_url": "https://groww.in/mutual-funds/hdfc-large-cap-fund-direct-growth",
    "fund_name": "HDFC Large Cap Fund Direct Growth - NAV, Mutual Fund Performance & Portfolio",
    "amc_name": "HDFC Mutual Fund",
    "category": "Equity",
    "sub_category": "Large Cap",
    "plan_type": "Direct",
    "option": "Growth",
    "latest_nav": null,
    "nav_date": null,
    "nav_change_pct": "+0.33%",
    "aum": null,
    "expense_ratio": "1.00%",
    "risk_level": "Very High Risk",
    "rating": null,
    "min_investment": {
      "lump_sum": null,
      "sip": null
    },
    "exit_load": "Exit load of 1% if redeemed within 1 year",
    "lock_in_period": null,
    "returns": {
      "1y": null,
      "3y": null,
      "5y": null
    },
    "full_text": "Stocks\nF&O\nMutual Funds\nMore\nSearch Groww...\n\u2318K\nLogin/Sign up\nHDFC Large Cap Fund Direct Growth\nEquity\nLarge Cap\nVery High Risk\n+\n0\n1\n2\n3\n4\n5\n6\n7\n8\n9\n0\n1\n2\n3\n4\n5\n6\n7\n8\n9\n.\n0\n1\n2\n3\n4\n5\n6\n7\n8\n9\n0\n1\n2\n3\n4\n5\n6\n7\n8\n9\n%\n3Y annualised\n+0.33%\n1D\n1M\n6M\n1Y\n3Y\n5Y\nAll\nNAV: 20 Feb '26\n\u20b91,266.82\nMin. for SIP\n\u20b9100\nFund size\n\u20b939,620.90 Cr\nExpense ratio\n1.00%\nReturn calculator\nMonthly SIP\nOne time\nMonthly investment\n\u20b9100\nOver the past Total investment Would've become Historic returns Returns\n1 year \u20b91,200 \u20b91,183\n-1.42%\n3 years \u20b93,600 \u20b94,477\n+24.36%\n5 years \u20b96,000 \u20b99,465\n+57.75%\nHoldings (46)\nName Sector Instruments Assets\nICICI Bank Ltd. Financial Equity 9.31%\nHDFC Bank Ltd. Financial Equity 8.97%\nBharti Airtel Ltd. Communication Equity 5.92%\nReliance Industries Ltd. Energy Equity 5.55%\nKotak Mahindra Bank Ltd. Financial Equity 5.25%\nTitan Company Ltd. Consumer Discretionary Equity 4.14%\nAxis Bank Ltd. Financial Equity 3.71%\nInfosys Ltd. Technology Equity 3.57%\nTorrent Pharmaceuticals Ltd. Healthcare Equity 3.18%\nBajaj Auto Ltd. Automobile Equity 2.90%\nSee All\nMinimum investments\nMin. for 1st investment\n\u20b9100\nMin. for 2nd investment\n\u20b9100\nMin. for SIP\n\u20b9100\nReturns and rankings\nAnnualised returns\nAbsolute returns\nName 3Y 5Y 10Y All\nFund returns +16.5% +15.1% +16.1% +13.9%\nCategory average (Equity Large Cap) +15.1% +15.0% +13.2% --\nRank (Equity Large Cap) 40 13 4 --\nExit load, stamp duty and tax\nExit load\nExit load of 1% if redeemed within 1 year\nStamp duty on investment: 0.005% (from July 1st, 2020)\nfrom July 1st 2020\nTax implication\nIf you redeem within one year, returns are taxed at 20%. If you redeem after one year, returns exceeding Rs 1.25 lakh in a financial year are taxed at 12.5%.\nCheck past data\nCompare similar funds\nName 1Y 3Y Fund Size(Cr)\nNippon India Large Cap Fund Direct Growth\n+15.37% +20.09% 50,106.61\nWhiteOak Capital Large Cap Fund Direct Growth\n+15.08% +19.62% 1,142.03\nDSP Large Cap Fund Direct Growth\n+10.88% +18.78% 7,162.86\nICICI Prudential Large Cap Fund Direct Growth\n+13.93% +18.63% 76,645.56\nHDFC Large Cap Fund Direct Growth\n+11.38% +16.54% 39,620.90\nCompare\nFund management\nRB\nRahul Baijal\nJul 2022 - Present\nView details\nDM\nDhruv Muchhal\nJun 2023 - Present\nView details\nAbout HDFC Large Cap Fund Direct Growth\nFund house\nOther plans in the same fund\nRecently viewed\nHDFC Balanced Advantage Fund Direct Growth\n18.6%\n(3Y)\nHDFC Retirement Savings Fund Equity Plan Direct Growth\n18.3%\n(3Y)\nHDFC ELSS Tax Saver Fund Direct Plan Growth\n21.9%\n(3Y)\nHDFC Flexi Cap Direct Plan Growth\n23.0%\n(3Y)\nFAQs\nHow to Invest in HDFC Large Cap Fund Direct Growth?\nWhat kind of returns does HDFC Large Cap Fund Direct Growth provide?\nHow much expense ratio is charged by HDFC Large Cap Fund Direct Growth?\n\n\nWhat is the AUM of HDFC Large Cap Fund Direct Growth?\nHow to Redeem HDFC Large Cap Fund Direct Growth?\nCan I invest in SIP and Lump Sum of HDFC Large Cap Fund Direct Growth?\nWhat is the NAV of HDFC Large Cap Fund Direct Growth?\nWhat is the PE and PB ratio of HDFC Large Cap Fund Direct Growth?\nLooking to invest in mutual funds?\nExplore diversified funds designed for every investor\nInvest Now\nVaishnavi Tech Park, South Tower, 3rd Floor\nSarjapur Main Road, Bellandur, Bengaluru \u2013 560103\nKarnataka\nContact Us\nDownload the App\nGROWW\nAbout Us\nPricing\nBlog\nMedia & Press\nCareers\nHelp & Support\nTrust & Safety\nInvestor Relations\nPRODUCTS\nStocks\nF&O\nMTF\nETF\nIPO\nMutual Funds\nCommodities\nGroww Terminal\n915 Terminal\nStock Screens\nAlgo Trading\nGroww Digest\nDemat Account\nGroww AMC\n\u00a9 2016-2026 Groww. All rights reserved.\nVersion: 7.3.0\nShare Market\nIndices\nF&O\nMutual Funds\nETFs\nFunds By Groww\nCalculators\nIPO\nMiscellaneous\nTop Gainers Stocks\n52 Weeks High Stocks\nTata Motors\nNHPC\nITC\nWipro\nTop Losers Stocks\n52 Weeks Low Stocks\nIREDA\nState Bank of India\nAdani Power\nCDSL\nMost Traded Stocks\nStocks Market Calender\nTata Steel\nTata Power\nBharat Heavy Electricals\nIndian Oil Corporation\nStocks Feed\nSuzlon Energy\nZomato (Eternal)\nYes Bank\nInfosys\nNBCC\nShow More\nOthers:\nNSE\nBSE\nMCX\nTerms and Conditions\nPolicies and Procedures\nRegulatory & Other Info\nPrivacy Policy\nDisclosure\nSMART ODR\nDownload Forms\nInformation Security Practices\nInvestor Charter and Grievance\nBug Bounty",
    "scraped_at": "2026-02-21T03:40:34Z",
    "fund_managers": [
      "Rahul Baijal",
      "Dhruv Muchhal"
    ]
  },
  {
    "page_url": "https://groww.in/mutual-funds/hdfc-i-come-plus-arbitrage-active-fof-direct-growth",
    "fund_name": "HDFC Income Plus Arbitrage Active FoF Direct Growth - NAV, Mutual Fund Performance & Portfolio",
    "amc_name": "HDFC Mutual Fund",
    "category": "Debt",
    "sub_category": "Large Cap",
    "plan_type": "Direct",
    "option": "Growth",
    "latest_nav": null,
    "nav_date": null,
    "nav_change_pct": "-0.04%",
    "aum": null,
    "expense_ratio": "0.07%",
    "risk_level": "Moderate Risk",
    "rating": null,
    "min_investment": {
      "lump_sum": null,
      "sip": null
    },
    "exit_load": "Nil",
    "lock_in_period": null,
    "returns": {
      "1y": null,
      "3y": null,
      "5y": null
    },
    "full_text": "Stocks\nF&O\nMutual Funds\nMore\nSearch Groww...\n\u2318K\nLogin/Sign up\nHDFC Income Plus Arbitrage Active FoF Direct Growth\nDebt\nOthers\nModerate Risk\n+\n0\n1\n2\n3\n4\n5\n6\n7\n8\n9\n0\n1\n2\n3\n4\n5\n6\n7\n8\n9\n.\n0\n1\n2\n3\n4\n5\n6\n7\n8\n9\n0\n1\n2\n3\n4\n5\n6\n7\n8\n9\n%\n3Y annualised\n-0.04%\n1D\n1M\n6M\n1Y\n3Y\n5Y\nAll\nNAV: 20 Feb '26\n\u20b944.36\nMin. for SIP\n\u20b9100\nFund size\n\u20b92,263.90 Cr\nExpense ratio\n0.07%\nReturn calculator\nMonthly SIP\nOne time\nMonthly investment\n\u20b9100\nOver the past Total investment Would've become Historic returns Returns\n1 year \u20b91,200 \u20b91,223\n+1.92%\n3 years \u20b93,600 \u20b94,132\n+14.78%\n5 years \u20b96,000 \u20b98,043\n+34.05%\nHoldings (3)\nName Sector Instruments Assets\nHDFC Corporate Bond Fund Direct Plan-Growth NA Mutual Fund 43.14%\nHDFC Arbitrage Fund Wholesale Direct-Growth NA Mutual Fund 36.44%\nHDFC Money Market Fund Direct-Growth NA Mutual Fund 18.71%\nMinimum investments\nMin. for 1st investment\n\u20b9100\nMin. for 2nd investment\n\u20b9100\nMin. for SIP\n\u20b9100\nReturns and rankings\nAnnualised returns\nAbsolute returns\nName 3Y 5Y 10Y All\nFund returns +12.8% +12.6% +13.6% +11.3%\nCategory average (Debt Others) -- -- -- --\nRank (Debt Others) -- -- -- --\nExit load, stamp duty and tax\nExit load\nNil\nStamp duty on investment: 0.005% (from July 1st, 2020)\nfrom July 1st 2020\nTax implication\nIf you redeem within two years, returns are taxed as per your Income Tax slab. If you redeem after two years, returns are taxed at 12.5%.\nCheck past data\nFund management\nAB\nAnil Bamboli\nJun 2014 - Present\nView details\nAbout HDFC Income Plus Arbitrage Active FoF Direct Growth\nFund house\nRecently viewed\nHDFC Large Cap Fund Direct Growth\n16.5%\n(3Y)\nHDFC Balanced Advantage Fund Direct Growth\n18.6%\n(3Y)\nHDFC Retirement Savings Fund Equity Plan Direct Growth\n18.3%\n(3Y)\nHDFC ELSS Tax Saver Fund Direct Plan Growth\n21.9%\n(3Y)\nFAQs\nHow to Invest in HDFC Income Plus Arbitrage Active FoF Direct Growth?\nWhat kind of returns does HDFC Income Plus Arbitrage Active FoF Direct Growth provide?\nHow much expense ratio is charged by HDFC Income Plus Arbitrage Active FoF Direct Growth?\n\n\nWhat is the AUM of HDFC Income Plus Arbitrage Active FoF Direct Growth?\nHow to Redeem HDFC Income Plus Arbitrage Active FoF Direct Growth?\nCan I invest in SIP and Lump Sum of HDFC Income Plus Arbitrage Active FoF Direct Growth?\nWhat is the NAV of HDFC Income Plus Arbitrage Active FoF Direct Growth?\nWhat is the PE and PB ratio of HDFC Income Plus Arbitrage Active FoF Direct Growth?\nLooking to invest in mutual funds?\nExplore diversified funds designed for every investor\nInvest Now\nVaishnavi Tech Park, South Tower, 3rd Floor\nSarjapur Main Road, Bellandur, Bengaluru \u2013 560103\nKarnataka\nContact Us\nDownload the App\nGROWW\nAbout Us\nPricing\nBlog\nMedia & Press\nCareers\nHelp & Support\nTrust & Safety\nInvestor Relations\nPRODUCTS\nStocks\nF&O\nMTF\nETF\nIPO\nMutual Funds\nCommodities\nGroww Terminal\n915 Terminal\nStock Screens\nAlgo Trading\nGroww Digest\nDemat Account\nGroww AMC\n\u00a9 2016-2026 Groww. All rights reserved.\nVersion: 7.3.0\nShare Market\nIndices\nF&O\nMutual Funds\nETFs\nFunds By Groww\nCalculators\nIPO\nMiscellaneous\nTop Gainers Stocks\n52 Weeks High Stocks\nTata Motors\nNHPC\nITC\nWipro\nTop Losers Stocks\n52 Weeks Low Stocks\nIREDA\nState Bank of India\nAdani Power\nCDSL\nMost Traded Stocks\nStocks Market Calender\nTata Steel\nTata Power\nBharat Heavy Electricals\nIndian Oil Corporation\nStocks Feed\nSuzlon Energy\nZomato (Eternal)\nYes Bank\nInfosys\nNBCC\nShow More\nOthers:\nNSE\nBSE\nMCX\nTerms and Conditions\nPolicies and Procedures\nRegulatory & Other Info\nPrivacy Policy\nDisclosure\nSMART ODR\nDownload Forms\nInformation Security Practices\nInvestor Charter and Grievance\nBug Bounty",
    "scraped_at": "2026-02-21T03:40:43Z",
    "fund_managers": [
      "Anil Bamboli"
    ]
  },
  {
    "page_url": "https://groww.in/mutual-funds/hdfc-short-term-opportunities-fund-direct-growth",
    "fund_name": "HDFC Short Term Debt Fund Direct Plan Growth - NAV, Mutual Fund Performance & Portfolio",
    "amc_name": "HDFC Mutual Fund",
    "category": "Debt",
    "sub_category": "Large Cap",
    "plan_type": "Direct",
    "option": "Growth",
    "latest_nav": null,
    "nav_date": null,
    "nav_change_pct": "-0.02%",
    "aum": null,
    "expense_ratio": "0.40%",
    "risk_level": "Moderate Risk",
    "rating": null,
    "min_investment": {
      "lump_sum": null,
      "sip": null
    },
    "exit_load": "Nil",
    "lock_in_period": null,
    "returns": {
      "1y": null,
      "3y": null,
      "5y": null
    },
    "full_text": "Stocks\nF&O\nMutual Funds\nMore\nSearch Groww...\n\u2318K\nLogin/Sign up\nHDFC Short Term Debt Fund Direct Plan Growth\nDebt\nShort Duration\nModerate Risk\n+\n0\n1\n2\n3\n4\n5\n6\n7\n8\n9\n.\n0\n1\n2\n3\n4\n5\n6\n7\n8\n9\n0\n1\n2\n3\n4\n5\n6\n7\n8\n9\n%\n3Y annualised\n-0.02%\n1D\n1M\n6M\n1Y\n3Y\n5Y\nAll\nNAV: 20 Feb '26\n\u20b934.35\nMin. for SIP\n\u20b9100\nFund size\n\u20b917,416.20 Cr\nExpense ratio\n0.40%\nReturn calculator\nMonthly SIP\nOne time\nMonthly investment\n\u20b9100\nOver the past Total investment Would've become Historic returns Returns\n1 year \u20b91,200 \u20b91,242\n+3.50%\n3 years \u20b93,600 \u20b94,026\n+11.83%\n5 years \u20b96,000 \u20b97,110\n+18.50%\nHoldings (150)\nName Sector Instruments Assets\nGOI Sovereign GOI Sec 2.95%\nAditya Birla Renewables Ltd. Energy Bonds/NCD 2.51%\nJubilant Beverages Ltd. Consumer Staples Debenture 2.37%\nJTPM Metal Traders Ltd. Metals & Mining Debenture 2.13%\nGOI Sovereign GOI Sec 2.04%\nJamnagar Utilities and Power Pvt. Ltd. Capital Goods Debenture 2.03%\nShivshakti Securitisation Trust Others Sec. Debt 2.02%\nGOI Sovereign GOI Sec 1.48%\nNational Bank For Agriculture & Rural Development Financial Debenture 1.45%\nBajaj Housing Finance Ltd. Financial Debenture 1.45%\nSee All\nMinimum investments\nMin. for 1st investment\n\u20b9100\nMin. for 2nd investment\n\u20b9100\nMin. for SIP\n\u20b9100\nReturns and rankings\nAnnualised returns\nAbsolute returns\nName 3Y 5Y 10Y All\nFund returns +8.0% +6.7% +7.7% +8.0%\nCategory average (Debt Short Duration) +7.1% +5.9% +6.6% --\nRank (Debt Short Duration) 6 8 6 --\nExit load, stamp duty and tax\nExit load\nNil\nStamp duty on investment: 0.005% (from July 1st, 2020)\nfrom July 1st 2020\nTax implication\nReturns are taxed as per your Income Tax slab.\nCheck past data\nCompare similar funds\nName 1Y 3Y Fund Size(Cr)\nNippon India Short Duration Fund Direct Growth\n+8.13% +8.20% 8,683.99\nAxis Short Duration Fund Direct Growth\n+8.20% +8.16% 11,708.64\nAditya Birla Sun Life Short Term Direct Fund Direct Growth\n+7.94% +8.14% 9,747.73\nHDFC Short Term Debt Fund Direct Plan Growth\n+7.73% +8.03% 17,416.20\nSBI Short Term Debt Fund Direct Growth\n+7.80% +7.87% 17,219.19\nCompare\nFund management\nAB\nAnil Bamboli\nDec 2012 - Present\nView details\nDM\nDhruv Muchhal\nJun 2023 - Present\nView details\nAbout HDFC Short Term Debt Fund Direct Plan Growth\nFund house\nOther plans in the same fund\nRecently viewed\nHDFC Income Plus Arbitrage Active FoF Direct Growth\n12.8%\n(3Y)\nHDFC Large Cap Fund Direct Growth\n16.5%\n(3Y)\nHDFC Balanced Advantage Fund Direct Growth\n18.6%\n(3Y)\nHDFC Retirement Savings Fund Equity Plan Direct Growth\n18.3%\n(3Y)\nFAQs\nHow to Invest in HDFC Short Term Debt Fund Direct Plan Growth?\nWhat kind of returns does HDFC Short Term Debt Fund Direct Plan Growth provide?\nHow much expense ratio is charged by HDFC Short Term Debt Fund Direct Plan Growth?\n\n\nWhat is the AUM of HDFC Short Term Debt Fund Direct Plan Growth?\nHow to Redeem HDFC Short Term Debt Fund Direct Plan Growth?\nCan I invest in SIP and Lump Sum of HDFC Short Term Debt Fund Direct Plan Growth?\nWhat is the NAV of HDFC Short Term Debt Fund Direct Plan Growth?\nWhat is the PE and PB ratio of HDFC Short Term Debt Fund Direct Plan Growth?\nLooking to invest in mutual funds?\nExplore diversified funds designed for every investor\nInvest Now\nVaishnavi Tech Park, South Tower, 3rd Floor\nSarjapur Main Road, Bellandur, Bengaluru \u2013 560103\nKarnataka\nContact Us\nDownload the App\nGROWW\nAbout Us\nPricing\nBlog\nMedia & Press\nCareers\nHelp & Support\nTrust & Safety\nInvestor Relations\nPRODUCTS\nStocks\nF&O\nMTF\nETF\nIPO\nMutual Funds\nCommodities\nGroww Terminal\n915 Terminal\nStock Screens\nAlgo Trading\nGroww Digest\nDemat Account\nGroww AMC\n\u00a9 2016-2026 Groww. All rights reserved.\nVersion: 7.3.0\nShare Market\nIndices\nF&O\nMutual Funds\nETFs\nFunds By Groww\nCalculators\nIPO\nMiscellaneous\nTop Gainers Stocks\n52 Weeks High Stocks\nTata Motors\nNHPC\nITC\nWipro\nTop Losers Stocks\n52 Weeks Low Stocks\nIREDA\nState Bank of India\nAdani Power\nCDSL\nMost Traded Stocks\nStocks Market Calender\nTata Steel\nTata Power\nBharat Heavy Electricals\nIndian Oil Corporation\nStocks Feed\nSuzlon Energy\nZomato (Eternal)\nYes Bank\nInfosys\nNBCC\nShow More\nOthers:\nNSE\nBSE\nMCX\nTerms and Conditions\nPolicies and Procedures\nRegulatory & Other Info\nPrivacy Policy\nDisclosure\nSMART ODR\nDownload Forms\nInformation Security Practices\nInvestor Charter and Grievance\nBug Bounty",
    "scraped_at": "2026-02-21T03:40:53Z",
    "fund_managers": [
      "Anil Bamboli",
      "Dhruv Muchhal"
    ]
  },
  {
    "page_url": "https://groww.in/mutual-funds/hdfc-infrastructure-fund-direct-growth",
    "fund_name": "HDFC Infrastructure Fund Direct Growth - NAV, Mutual Fund Performance & Portfolio",
    "amc_name": "HDFC Mutual Fund",
    "category": "Equity",
    "sub_category": "Large Cap",
    "plan_type": "Direct",
    "option": "Growth",
    "latest_nav": null,
    "nav_date": null,
    "nav_change_pct": "+0.59%",
    "aum": null,
    "expense_ratio": "1.15%",
    "risk_level": "Very High Risk",
    "rating": null,
    "min_investment": {
      "lump_sum": null,
      "sip": null
    },
    "exit_load": "Exit load of 1%, if redeemed within 30 days.",
    "lock_in_period": null,
    "returns": {
      "1y": null,
      "3y": null,
      "5y": null
    },
    "full_text": "Stocks\nF&O\nMutual Funds\nMore\nSearch Groww...\n\u2318K\nLogin/Sign up\nHDFC Infrastructure Fund Direct Growth\nEquity\nSectoral\nVery High Risk\n+\n0\n1\n2\n3\n4\n5\n6\n7\n8\n9\n0\n1\n2\n3\n4\n5\n6\n7\n8\n9\n.\n0\n1\n2\n3\n4\n5\n6\n7\n8\n9\n1\n2\n3\n4\n5\n6\n7\n8\n9\n%\n3Y annualised\n+0.59%\n1D\n1M\n6M\n1Y\n3Y\n5Y\nAll\nNAV: 20 Feb '26\n\u20b952.91\nMin. for SIP\n\u20b9100\nFund size\n\u20b92,366.20 Cr\nExpense ratio\n1.15%\nReturn calculator\nMonthly SIP\nOne time\nMonthly investment\n\u20b9100\nOver the past Total investment Would've become Historic returns Returns\n1 year \u20b91,200 \u20b91,240\n+3.33%\n3 years \u20b93,600 \u20b94,463\n+23.97%\n5 years \u20b96,000 \u20b910,290\n+71.50%\nHoldings (60)\nName Sector Instruments Assets\nLarsen & Toubro Ltd. Construction Equity 6.71%\nICICI Bank Ltd. Financial Equity 6.30%\nHDFC Bank Ltd. Financial Equity 5.50%\nKalpataru Projects International Ltd. Capital Goods Equity 3.67%\nJ Kumar Infraprojects Ltd. Construction Equity 3.38%\nNTPC Ltd. Energy Equity 3.31%\nState Bank of India Financial Equity 3.21%\nReliance Industries Ltd. Energy Equity 2.95%\nInterglobe Aviation Ltd. Services Equity 2.91%\nBharti Airtel Ltd. Communication Equity 2.91%\nSee All\nMinimum investments\nMin. for 1st investment\n\u20b9100\nMin. for 2nd investment\n\u20b9100\nMin. for SIP\n\u20b9100\nReturns and rankings\nAnnualised returns\nAbsolute returns\nName 3Y 5Y 10Y All\nFund returns +28.4% +24.9% +14.9% +12.6%\nCategory average (Equity Sectoral) +22.4% +24.9% +15.4% --\nRank (Equity Sectoral) 3 6 19 --\nExit load, stamp duty and tax\nExit load\nExit load of 1%, if redeemed within 30 days.\nStamp duty on investment: 0.005% (from July 1st, 2020)\nfrom July 1st 2020\nTax implication\nIf you redeem within one year, returns are taxed at 20%. If you redeem after one year, returns exceeding Rs 1.25 lakh in a financial year are taxed at 12.5%.\nCheck past data\nFund management\nDM\nDhruv Muchhal\nJun 2023 - Present\nView details\nAS\nAshish Shah\nOct 2025 - Present\nView details\nAbout HDFC Infrastructure Fund Direct Growth\nFund house\nOther plans in the same fund\nRecently viewed\nHDFC Short Term Debt Fund Direct Plan Growth\n8.0%\n(3Y)\nHDFC Income Plus Arbitrage Active FoF Direct Growth\n12.8%\n(3Y)\nHDFC Large Cap Fund Direct Growth\n16.5%\n(3Y)\nHDFC Balanced Advantage Fund Direct Growth\n18.6%\n(3Y)\nFAQs\nHow to Invest in HDFC Infrastructure Fund Direct Growth?\nWhat kind of returns does HDFC Infrastructure Fund Direct Growth provide?\nHow much expense ratio is charged by HDFC Infrastructure Fund Direct Growth?\n\n\nWhat is the AUM of HDFC Infrastructure Fund Direct Growth?\nHow to Redeem HDFC Infrastructure Fund Direct Growth?\nCan I invest in SIP and Lump Sum of HDFC Infrastructure Fund Direct Growth?\nWhat is the NAV of HDFC Infrastructure Fund Direct Growth?\nWhat is the PE and PB ratio of HDFC Infrastructure Fund Direct Growth?\nLooking to invest in mutual funds?\nExplore diversified funds designed for every investor\nInvest Now\nVaishnavi Tech Park, South Tower, 3rd Floor\nSarjapur Main Road, Bellandur, Bengaluru \u2013 560103\nKarnataka\nContact Us\nDownload the App\nGROWW\nAbout Us\nPricing\nBlog\nMedia & Press\nCareers\nHelp & Support\nTrust & Safety\nInvestor Relations\nPRODUCTS\nStocks\nF&O\nMTF\nETF\nIPO\nMutual Funds\nCommodities\nGroww Terminal\n915 Terminal\nStock Screens\nAlgo Trading\nGroww Digest\nDemat Account\nGroww AMC\n\u00a9 2016-2026 Groww. All rights reserved.\nVersion: 7.3.0\nShare Market\nIndices\nF&O\nMutual Funds\nETFs\nFunds By Groww\nCalculators\nIPO\nMiscellaneous\nTop Gainers Stocks\n52 Weeks High Stocks\nTata Motors\nNHPC\nITC\nWipro\nTop Losers Stocks\n52 Weeks Low Stocks\nIREDA\nState Bank of India\nAdani Power\nCDSL\nMost Traded Stocks\nStocks Market Calender\nTata Steel\nTata Power\nBharat Heavy Electricals\nIndian Oil Corporation\nStocks Feed\nSuzlon Energy\nZomato (Eternal)\nYes Bank\nInfosys\nNBCC\nShow More\nOthers:\nNSE\nBSE\nMCX\nTerms and Conditions\nPolicies and Procedures\nRegulatory & Other Info\nPrivacy Policy\nDisclosure\nSMART ODR\nDownload Forms\nInformation Security Practices\nInvestor Charter and Grievance\nBug Bounty",
    "scraped_at": "2026-02-21T03:41:03Z",
    "fund_managers": [
      "Ashish Shah",
      "Dhruv Muchhal"
    ]
  },
  {
    "page_url": "https://groww.in/mutual-funds/hdfc-multi-cap-fund-direct-growth",
    "fund_name": "HDFC Multi Cap Fund Direct Growth - NAV, Mutual Fund Performance & Portfolio",
    "amc_name": "HDFC Mutual Fund",
    "category": "Equity",
    "sub_category": "Large Cap",
    "plan_type": "Direct",
    "option": "Growth",
    "latest_nav": null,
    "nav_date": null,
    "nav_change_pct": "+0.37%",
    "aum": null,
    "expense_ratio": "0.79%",
    "risk_level": "Very High Risk",
    "rating": null,
    "min_investment": {
      "lump_sum": null,
      "sip": null
    },
    "exit_load": "Exit load of 1% if redeemed within 1 year.",
    "lock_in_period": null,
    "returns": {
      "1y": null,
      "3y": null,
      "5y": null
    },
    "full_text": "Stocks\nF&O\nMutual Funds\nMore\nSearch Groww...\n\u2318K\nLogin/Sign up\nHDFC Multi Cap Fund Direct Growth\nEquity\nMulti Cap\nVery High Risk\n+\n0\n1\n2\n3\n4\n5\n6\n7\n8\n9\n0\n1\n2\n3\n4\n5\n6\n7\n8\n9\n.\n0\n1\n2\n3\n4\n5\n6\n7\n8\n9\n0\n1\n2\n3\n4\n5\n6\n7\n8\n9\n%\n3Y annualised\n+0.37%\n1D\n1M\n6M\n1Y\n3Y\nAll\nNAV: 20 Feb '26\n\u20b919.73\nMin. for SIP\n\u20b9100\nFund size\n\u20b919,182.58 Cr\nExpense ratio\n0.79%\nReturn calculator\nMonthly SIP\nOne time\nMonthly investment\n\u20b9100\nOver the past Total investment Would've become Historic returns Returns\n3 months \u20b9300 \u20b9299\n-0.33%\n1 year \u20b91,200 \u20b91,230\n+2.50%\n3 years \u20b93,600 \u20b94,253\n+18.14%\nHoldings (140)\nName Sector Instruments Assets\nHDFC Bank Ltd. Financial Equity 4.68%\nICICI Bank Ltd. Financial Equity 3.07%\nAxis Bank Ltd. Financial Equity 2.78%\nReliance Industries Ltd. Energy Equity 2.76%\nBritannia Industries Ltd. Consumer Staples Equity 2.41%\nBharti Airtel Ltd. Communication Equity 2.15%\nInfosys Ltd. Technology Equity 1.86%\nLarsen & Toubro Ltd. Construction Equity 1.72%\nMahindra & Mahindra Ltd. Automobile Equity 1.49%\nKotak Mahindra Bank Ltd. Financial Equity 1.44%\nSee All\nMinimum investments\nMin. for 1st investment\n\u20b9100\nMin. for 2nd investment\n\u20b9100\nMin. for SIP\n\u20b9100\nReturns and rankings\nAnnualised returns\nAbsolute returns\nName 6M 1Y 3Y All\nFund returns -0.6% +13.0% +20.7% +17.6%\nCategory average (Equity Multi Cap) -0.8% +0.9% +18.5% --\nRank (Equity Multi Cap) -- 21 9 --\nExit load, stamp duty and tax\nExit load\nExit load of 1% if redeemed within 1 year.\nStamp duty on investment: 0.005% (from July 1st, 2020)\nfrom July 1st 2020\nTax implication\nIf you redeem within one year, returns are taxed at 20%. If you redeem after one year, returns exceeding Rs 1.25 lakh in a financial year are taxed at 12.5%.\nCheck past data\nCompare similar funds\nName 1Y 3Y Fund Size(Cr)\nKotak Multicap Fund Direct Growth\n+18.35% +25.53% 22,709.75\nAxis Multicap Fund Direct Growth\n+13.45% +23.63% 9,091.56\nNippon India Multi Cap Fund Direct Growth\n+15.87% +22.80% 48,808.64\nICICI Prudential Multicap Fund Direct Plan Growth\n+12.84% +21.12% 15,845.20\nHDFC Multi Cap Fund Direct Growth\n+13.00% +20.66% 19,182.58\nCompare\nFund management\nAK\nAmar Kalkundrikar\nAug 2025 - Present\nView details\nDM\nDhruv Muchhal\nJun 2023 - Present\nView details\nAbout HDFC Multi Cap Fund Direct Growth\nFund house\nOther plans in the same fund\nRecently viewed\nHDFC Infrastructure Fund Direct Growth\n28.4%\n(3Y)\nHDFC Short Term Debt Fund Direct Plan Growth\n8.0%\n(3Y)\nHDFC Income Plus Arbitrage Active FoF Direct Growth\n12.8%\n(3Y)\nHDFC Large Cap Fund Direct Growth\n16.5%\n(3Y)\nFAQs\nHow to Invest in HDFC Multi Cap Fund Direct Growth?\nWhat kind of returns does HDFC Multi Cap Fund Direct Growth provide?\nHow much expense ratio is charged by HDFC Multi Cap Fund Direct Growth?\n\n\nWhat is the AUM of HDFC Multi Cap Fund Direct Growth?\nHow to Redeem HDFC Multi Cap Fund Direct Growth?\nCan I invest in SIP and Lump Sum of HDFC Multi Cap Fund Direct Growth?\nWhat is the NAV of HDFC Multi Cap Fund Direct Growth?\nWhat is the PE and PB ratio of HDFC Multi Cap Fund Direct Growth?\nLooking to invest in mutual funds?\nExplore diversified funds designed for every investor\nInvest Now\nVaishnavi Tech Park, South Tower, 3rd Floor\nSarjapur Main Road, Bellandur, Bengaluru \u2013 560103\nKarnataka\nContact Us\nDownload the App\nGROWW\nAbout Us\nPricing\nBlog\nMedia & Press\nCareers\nHelp & Support\nTrust & Safety\nInvestor Relations\nPRODUCTS\nStocks\nF&O\nMTF\nETF\nIPO\nMutual Funds\nCommodities\nGroww Terminal\n915 Terminal\nStock Screens\nAlgo Trading\nGroww Digest\nDemat Account\nGroww AMC\n\u00a9 2016-2026 Groww. All rights reserved.\nVersion: 7.3.0\nShare Market\nIndices\nF&O\nMutual Funds\nETFs\nFunds By Groww\nCalculators\nIPO\nMiscellaneous\nTop Gainers Stocks\n52 Weeks High Stocks\nTata Motors\nNHPC\nITC\nWipro\nTop Losers Stocks\n52 Weeks Low Stocks\nIREDA\nState Bank of India\nAdani Power\nCDSL\nMost Traded Stocks\nStocks Market Calender\nTata Steel\nTata Power\nBharat Heavy Electricals\nIndian Oil Corporation\nStocks Feed\nSuzlon Energy\nZomato (Eternal)\nYes Bank\nInfosys\nNBCC\nShow More\nOthers:\nNSE\nBSE\nMCX\nTerms and Conditions\nPolicies and Procedures\nRegulatory & Other Info\nPrivacy Policy\nDisclosure\nSMART ODR\nDownload Forms\nInformation Security Practices\nInvestor Charter and Grievance\nBug Bounty",
    "scraped_at": "2026-02-21T03:41:12Z",
    "fund_managers": [
      "Amar Kalkundrikar",
      "Dhruv Muchhal"
    ]
  },
  {
    "page_url": "https://groww.in/mutual-funds/hdfc-small-cap-fund-direct-growth",
    "fund_name": "HDFC Small Cap Fund Direct Growth - NAV, Mutual Fund Performance & Portfolio",
    "amc_name": "HDFC Mutual Fund",
    "category": "Equity",
    "sub_category": "Small Cap",
    "plan_type": "Direct",
    "option": "Growth",
    "latest_nav": null,
    "nav_date": null,
    "nav_change_pct": "+0.21%",
    "aum": null,
    "expense_ratio": "0.73%",
    "risk_level": "Very High Risk",
    "rating": null,
    "min_investment": {
      "lump_sum": null,
      "sip": null
    },
    "exit_load": "Exit load of 1% if redeemed within 1 year",
    "lock_in_period": null,
    "returns": {
      "1y": null,
      "3y": null,
      "5y": null
    },
    "full_text": "Stocks\nF&O\nMutual Funds\nMore\nSearch Groww...\n\u2318K\nLogin/Sign up\nHDFC Small Cap Fund Direct Growth\nEquity\nSmall Cap\nVery High Risk\n+\n0\n1\n2\n3\n4\n5\n6\n7\n8\n9\n1\n2\n3\n4\n5\n6\n7\n8\n9\n.\n0\n1\n2\n3\n4\n5\n6\n7\n8\n9\n0\n1\n2\n3\n4\n5\n6\n7\n8\n9\n%\n3Y annualised\n+0.21%\n1D\n1M\n6M\n1Y\n3Y\n5Y\nAll\nNAV: 20 Feb '26\n\u20b9153.43\nMin. for SIP\n\u20b9100\nFund size\n\u20b936,940.54 Cr\nExpense ratio\n0.73%\nReturn calculator\nMonthly SIP\nOne time\nMonthly investment\n\u20b9100\nOver the past Total investment Would've become Historic returns Returns\n1 year \u20b91,200 \u20b91,063\n-11.42%\n3 years \u20b93,600 \u20b94,341\n+20.58%\n5 years \u20b96,000 \u20b910,441\n+74.02%\nHoldings (85)\nName Sector Instruments Assets\nFirstsource Solutions Ltd. Services Equity 4.79%\nBank Of Baroda Financial Equity 3.80%\neClerx Services Ltd. Services Equity 3.78%\nAster DM Healthcare Ltd. Healthcare Equity 3.58%\nEris Lifesciences Ltd. Healthcare Equity 2.44%\nIndian Bank Financial Equity 2.39%\nGabriel India Ltd. Automobile Equity 2.34%\nFortis Healthcare Ltd. Healthcare Equity 2.18%\nKrishna Institute of Medical Sciences Ltd Healthcare Equity 1.82%\nThe Great Eastern Shipping Company Ltd. Energy Equity 1.70%\nSee All\nMinimum investments\nMin. for 1st investment\n\u20b9100\nMin. for 2nd investment\n\u20b9100\nMin. for SIP\n\u20b9100\nReturns and rankings\nAnnualised returns\nAbsolute returns\nName 3Y 5Y 10Y All\nFund returns +19.4% +21.9% +20.5% +18.8%\nCategory average (Equity Small Cap) +19.7% +22.6% +16.1% --\nRank (Equity Small Cap) 20 8 3 --\nExit load, stamp duty and tax\nExit load\nExit load of 1% if redeemed within 1 year\nStamp duty on investment: 0.005% (from July 1st, 2020)\nfrom July 1st 2020\nTax implication\nIf you redeem within one year, returns are taxed at 20%. If you redeem after one year, returns exceeding Rs 1.25 lakh in a financial year are taxed at 12.5%.\nCheck past data\nCompare similar funds\nName 1Y 3Y Fund Size(Cr)\nBandhan Small Cap Fund Direct Growth\n+14.72% +31.40% 19,266.54\nInvesco India Smallcap Fund Direct Growth\n+15.55% +25.85% 9,008.55\nNippon India Small Cap Fund Direct Growth\n+11.10% +21.76% 65,812.16\nQuant Small Cap Fund Direct Plan Growth\n+7.00% +20.17% 27,384.03\nHDFC Small Cap Fund Direct Growth\n+12.37% +19.36% 36,940.54\nCompare\nFund management\nCS\nChirag Setalvad\nJun 2014 - Present\nView details\nDM\nDhruv Muchhal\nJun 2023 - Present\nView details\nAbout HDFC Small Cap Fund Direct Growth\nFund house\nOther plans in the same fund\nRecently viewed\nHDFC Multi Cap Fund Direct Growth\n20.7%\n(3Y)\nHDFC Infrastructure Fund Direct Growth\n28.4%\n(3Y)\nHDFC Short Term Debt Fund Direct Plan Growth\n8.0%\n(3Y)\nHDFC Income Plus Arbitrage Active FoF Direct Growth\n12.8%\n(3Y)\nFAQs\nHow to Invest in HDFC Small Cap Fund Direct Growth?\nWhat kind of returns does HDFC Small Cap Fund Direct Growth provide?\nHow much expense ratio is charged by HDFC Small Cap Fund Direct Growth?\n\n\nWhat is the AUM of HDFC Small Cap Fund Direct Growth?\nHow to Redeem HDFC Small Cap Fund Direct Growth?\nCan I invest in SIP and Lump Sum of HDFC Small Cap Fund Direct Growth?\nWhat is the NAV of HDFC Small Cap Fund Direct Growth?\nWhat is the PE and PB ratio of HDFC Small Cap Fund Direct Growth?\nLooking to invest in mutual funds?\nExplore diversified funds designed for every investor\nInvest Now\nVaishnavi Tech Park, South Tower, 3rd Floor\nSarjapur Main Road, Bellandur, Bengaluru \u2013 560103\nKarnataka\nContact Us\nDownload the App\nGROWW\nAbout Us\nPricing\nBlog\nMedia & Press\nCareers\nHelp & Support\nTrust & Safety\nInvestor Relations\nPRODUCTS\nStocks\nF&O\nMTF\nETF\nIPO\nMutual Funds\nCommodities\nGroww Terminal\n915 Terminal\nStock Screens\nAlgo Trading\nGroww Digest\nDemat Account\nGroww AMC\n\u00a9 2016-2026 Groww. All rights reserved.\nVersion: 7.3.0\nShare Market\nIndices\nF&O\nMutual Funds\nETFs\nFunds By Groww\nCalculators\nIPO\nMiscellaneous\nTop Gainers Stocks\n52 Weeks High Stocks\nTata Motors\nNHPC\nITC\nWipro\nTop Losers Stocks\n52 Weeks Low Stocks\nIREDA\nState Bank of India\nAdani Power\nCDSL\nMost Traded Stocks\nStocks Market Calender\nTata Steel\nTata Power\nBharat Heavy Electricals\nIndian Oil Corporation\nStocks Feed\nSuzlon Energy\nZomato (Eternal)\nYes Bank\nInfosys\nNBCC\nShow More\nOthers:\nNSE\nBSE\nMCX\nTerms and Conditions\nPolicies and Procedures\nRegulatory & Other Info\nPrivacy Policy\nDisclosure\nSMART ODR\nDownload Forms\nInformation Security Practices\nInvestor Charter and Grievance\nBug Bounty",
    "scraped_at": "2026-02-21T03:41:21Z",
    "fund_managers": [
      "Dhruv Muchhal",
      "Chirag Setalvad"
    ]
  },
  {
    "page_url": "https://groww.in/mutual-funds/hdfc-large-and-mid-cap-fund-direct-growth",
    "fund_name": "HDFC Large and Mid Cap Fund Direct Growth - NAV, Mutual Fund Performance & Portfolio",
    "amc_name": "HDFC Mutual Fund",
    "category": "Equity",
    "sub_category": "Mid Cap",
    "plan_type": "Direct",
    "option": "Growth",
    "latest_nav": null,
    "nav_date": null,
    "nav_change_pct": "+0.27%",
    "aum": null,
    "expense_ratio": "0.86%",
    "risk_level": "Very High Risk",
    "rating": null,
    "min_investment": {
      "lump_sum": null,
      "sip": null
    },
    "exit_load": "Exit load of 1% if redeemed within 1 year",
    "lock_in_period": null,
    "returns": {
      "1y": null,
      "3y": null,
      "5y": null
    },
    "full_text": "Stocks\nF&O\nMutual Funds\nMore\nSearch Groww...\n\u2318K\nLogin/Sign up\nHDFC Large and Mid Cap Fund Direct Growth\nEquity\nLarge & MidCap\nVery High Risk\n+\n0\n1\n2\n3\n4\n5\n6\n7\n8\n9\n0\n1\n2\n3\n4\n5\n6\n7\n8\n9\n.\n0\n1\n2\n3\n4\n5\n6\n7\n8\n9\n0\n1\n2\n3\n4\n5\n6\n7\n8\n9\n%\n3Y annualised\n+0.27%\n1D\n1M\n6M\n1Y\n3Y\n5Y\nAll\nNAV: 20 Feb '26\n\u20b9362.83\nMin. for SIP\n\u20b9100\nFund size\n\u20b928,239.50 Cr\nExpense ratio\n0.86%\nReturn calculator\nMonthly SIP\nOne time\nMonthly investment\n\u20b9100\nOver the past Total investment Would've become Historic returns Returns\n1 year \u20b91,200 \u20b91,245\n+3.75%\n3 years \u20b93,600 \u20b94,346\n+20.72%\n5 years \u20b96,000 \u20b99,056\n+50.93%\nHoldings (238)\nName Sector Instruments Assets\nHDFC Bank Ltd. Financial Equity 4.83%\nICICI Bank Ltd. Financial Equity 3.31%\nAxis Bank Ltd. Financial Equity 2.06%\nBharti Airtel Ltd. Communication Equity 1.99%\nInfosys Ltd. Technology Equity 1.88%\nState Bank of India Financial Equity 1.61%\nMphasis Ltd. Technology Equity 1.50%\nMax Financial Services Ltd. Financial Equity 1.49%\nFortis Healthcare Ltd. Healthcare Equity 1.43%\nMahindra & Mahindra Financial Services Ltd. Financial Equity 1.31%\nSee All\nMinimum investments\nMin. for 1st investment\n\u20b9100\nMin. for 2nd investment\n\u20b9100\nMin. for SIP\n\u20b9100\nReturns and rankings\nAnnualised returns\nAbsolute returns\nName 3Y 5Y 10Y All\nFund returns +21.1% +19.4% +17.0% +13.7%\nCategory average (Equity Large & MidCap) +17.5% +18.0% +14.7% --\nRank (Equity Large & MidCap) 9 5 11 --\nExit load, stamp duty and tax\nExit load\nExit load of 1% if redeemed within 1 year\nStamp duty on investment: 0.005% (from July 1st, 2020)\nfrom July 1st 2020\nTax implication\nIf you redeem within one year, returns are taxed at 20%. If you redeem after one year, returns exceeding Rs 1.25 lakh in a financial year are taxed at 12.5%.\nCheck past data\nCompare similar funds\nName 1Y 3Y Fund Size(Cr)\nMotilal Oswal Large and Midcap Fund Direct Growth\n+17.01% +25.36% 14,601.65\nBandhan Large & Mid Cap Fund Direct Growth\n+16.93% +24.76% 13,967.60\nICICI Prudential Large & Mid Cap Fund Direct Plan Growth\n+15.63% +22.38% 27,444.64\nNippon India Vision Large & Mid Cap Direct Growth\n+13.89% +21.85% 6,751.46\nSBI Large & Midcap Fund Direct Plan Growth\n+17.85% +19.68% 37,496.73\nCompare\nFund management\nGA\nGopal Agrawal\nJul 2020 - Present\nView details\nDM\nDhruv Muchhal\nJun 2023 - Present\nView details\nAbout HDFC Large and Mid Cap Fund Direct Growth\nFund house\nOther plans in the same fund\nRecently viewed\nHDFC Small Cap Fund Direct Growth\n19.4%\n(3Y)\nHDFC Multi Cap Fund Direct Growth\n20.7%\n(3Y)\nHDFC Infrastructure Fund Direct Growth\n28.4%\n(3Y)\nHDFC Short Term Debt Fund Direct Plan Growth\n8.0%\n(3Y)\nFAQs\nHow to Invest in HDFC Large and Mid Cap Fund Direct Growth?\nWhat kind of returns does HDFC Large and Mid Cap Fund Direct Growth provide?\nHow much expense ratio is charged by HDFC Large and Mid Cap Fund Direct Growth?\n\n\nWhat is the AUM of HDFC Large and Mid Cap Fund Direct Growth?\nHow to Redeem HDFC Large and Mid Cap Fund Direct Growth?\nCan I invest in SIP and Lump Sum of HDFC Large and Mid Cap Fund Direct Growth?\nWhat is the NAV of HDFC Large and Mid Cap Fund Direct Growth?\nWhat is the PE and PB ratio of HDFC Large and Mid Cap Fund Direct Growth?\nLooking to invest in mutual funds?\nExplore diversified funds designed for every investor\nInvest Now\nVaishnavi Tech Park, South Tower, 3rd Floor\nSarjapur Main Road, Bellandur, Bengaluru \u2013 560103\nKarnataka\nContact Us\nDownload the App\nGROWW\nAbout Us\nPricing\nBlog\nMedia & Press\nCareers\nHelp & Support\nTrust & Safety\nInvestor Relations\nPRODUCTS\nStocks\nF&O\nMTF\nETF\nIPO\nMutual Funds\nCommodities\nGroww Terminal\n915 Terminal\nStock Screens\nAlgo Trading\nGroww Digest\nDemat Account\nGroww AMC\n\u00a9 2016-2026 Groww. All rights reserved.\nVersion: 7.3.0\nShare Market\nIndices\nF&O\nMutual Funds\nETFs\nFunds By Groww\nCalculators\nIPO\nMiscellaneous\nTop Gainers Stocks\n52 Weeks High Stocks\nTata Motors\nNHPC\nITC\nWipro\nTop Losers Stocks\n52 Weeks Low Stocks\nIREDA\nState Bank of India\nAdani Power\nCDSL\nMost Traded Stocks\nStocks Market Calender\nTata Steel\nTata Power\nBharat Heavy Electricals\nIndian Oil Corporation\nStocks Feed\nSuzlon Energy\nZomato (Eternal)\nYes Bank\nInfosys\nNBCC\nShow More\nOthers:\nNSE\nBSE\nMCX\nTerms and Conditions\nPolicies and Procedures\nRegulatory & Other Info\nPrivacy Policy\nDisclosure\nSMART ODR\nDownload Forms\nInformation Security Practices\nInvestor Charter and Grievance\nBug Bounty",
    "scraped_at": "2026-02-21T03:41:30Z",
    "fund_managers": [
      "Dhruv Muchhal",
      "Gopal Agrawal"
    ]
  },
  {
    "page_url": "https://groww.in/mutual-funds/hdfc-multi-asset-active-fof-direct-growth",
    "fund_name": "HDFC Multi Asset Active FoF Direct Growth - NAV, Mutual Fund Performance & Portfolio",
    "amc_name": "HDFC Mutual Fund",
    "category": "Hybrid",
    "sub_category": "Large Cap",
    "plan_type": "Direct",
    "option": "Growth",
    "latest_nav": null,
    "nav_date": null,
    "nav_change_pct": "+0.18%",
    "aum": null,
    "expense_ratio": "0.07%",
    "risk_level": "High Risk",
    "rating": null,
    "min_investment": {
      "lump_sum": null,
      "sip": null
    },
    "exit_load": "Exit Load for units in excess of 15% of the investment,1% will be charged for redemption within 365 days.",
    "lock_in_period": null,
    "returns": {
      "1y": null,
      "3y": null,
      "5y": null
    },
    "full_text": "Stocks\nF&O\nMutual Funds\nMore\nSearch Groww...\n\u2318K\nLogin/Sign up\nHDFC Multi Asset Active FoF Direct Growth\nHybrid\nMulti Asset Allocation\nHigh Risk\n+\n0\n1\n2\n3\n4\n5\n6\n7\n8\n9\n0\n1\n2\n3\n4\n5\n6\n7\n8\n9\n.\n0\n1\n2\n3\n4\n5\n6\n7\n8\n9\n0\n1\n2\n3\n4\n5\n6\n7\n8\n9\n%\n3Y annualised\n+0.18%\n1D\n1M\n6M\n1Y\n3Y\nAll\nNAV: 20 Feb '26\n\u20b920.66\nMin. for SIP\n\u20b9100\nFund size\n\u20b95,658.58 Cr\nExpense ratio\n0.07%\nReturn calculator\nMonthly SIP\nOne time\nMonthly investment\n\u20b9100\nOver the past Total investment Would've become Historic returns Returns\n3 months \u20b9300 \u20b9309\n+3.00%\n1 year \u20b91,200 \u20b91,265\n+5.42%\n3 years \u20b93,600 \u20b94,610\n+28.06%\nHoldings (19)\nName Sector Instruments Assets\nHDFC Large Cap Fund Direct-Growth NA Mutual Fund 16.61%\nHDFC Flexi Cap Direct Plan-Growth NA Mutual Fund 14.93%\nHDFC Gold ETF NA Mutual Fund 11.31%\nHDFC Short Term Debt Fund Direct Plan-Growth NA Mutual Fund 9.20%\nHDFC Corporate Bond Fund Direct Plan-Growth NA Mutual Fund 9.12%\nHDFC Low Duration Fund Direct-Growth NA Mutual Fund 5.15%\nHDFC Medium Term Debt Fund Direct-Growth NA Mutual Fund 4.10%\nHDFC Small Cap Fund Direct- Growth NA Mutual Fund 3.78%\nHDFC Large and Mid Cap Fund Direct- Growth NA Mutual Fund 3.02%\nHDFC Technology Fund Direct - Growth NA Mutual Fund 2.98%\nSee All\nMinimum investments\nMin. for 1st investment\n\u20b9100\nMin. for 2nd investment\n\u20b9100\nMin. for SIP\n\u20b9100\nReturns and rankings\nAnnualised returns\nAbsolute returns\nName 6M 1Y 3Y All\nFund returns +7.3% +16.9% +17.9% +16.3%\nCategory average (Hybrid Multi Asset Allocation) +8.6% +15.1% +17.8% --\nRank (Hybrid Multi Asset Allocation) -- 17 6 --\nExit load, stamp duty and tax\nExit load\nExit Load for units in excess of 15% of the investment,1% will be charged for redemption within 365 days.\nStamp duty on investment: 0.005% (from July 1st, 2020)\nfrom July 1st 2020\nTax implication\nIf you redeem within two years, returns are taxed as per your Income Tax slab. If you redeem after two years, returns are taxed at 12.5%.\nCheck past data\nCompare similar funds\nName 1Y 3Y Fund Size(Cr)\nNippon India Multi Asset Allocation Fund Direct Growth\n+26.34% +22.81% 12,513.31\nUTI Multi Asset Allocation Fund Direct Growth\n+16.10% +21.51% 6,847.91\nSBI Multi Asset Allocation Fund Direct Growth\n+23.71% +21.13% 14,943.80\nICICI Prudential Multi Asset Fund Direct Growth\n+17.27% +20.33% 80,768.23\nHDFC Multi Asset Allocation Fund Direct Growth\n+17.11% +16.77% 5,713.61\nCompare\nFund management\nAB\nAnil Bamboli\nApr 2021 - Present\nView details\nSR\nSrinivasan Ramamurthy\nJan 2022 - Present\nView details\nBK\nBhagyesh Kagalkar\nFeb 2022 - Present\nView details\nAbout HDFC Multi Asset Active FoF Direct Growth\nFund house\nRecently viewed\nHDFC Large and Mid Cap Fund Direct Growth\n21.1%\n(3Y)\nHDFC Small Cap Fund Direct Growth\n19.4%\n(3Y)\nHDFC Multi Cap Fund Direct Growth\n20.7%\n(3Y)\nHDFC Infrastructure Fund Direct Growth\n28.4%\n(3Y)\nFAQs\nHow to Invest in HDFC Multi Asset Active FoF Direct Growth?\nWhat kind of returns does HDFC Multi Asset Active FoF Direct Growth provide?\nHow much expense ratio is charged by HDFC Multi Asset Active FoF Direct Growth?\n\n\nWhat is the AUM of HDFC Multi Asset Active FoF Direct Growth?\nHow to Redeem HDFC Multi Asset Active FoF Direct Growth?\nCan I invest in SIP and Lump Sum of HDFC Multi Asset Active FoF Direct Growth?\nWhat is the NAV of HDFC Multi Asset Active FoF Direct Growth?\nWhat is the PE and PB ratio of HDFC Multi Asset Active FoF Direct Growth?\nLooking to invest in mutual funds?\nExplore diversified funds designed for every investor\nInvest Now\nVaishnavi Tech Park, South Tower, 3rd Floor\nSarjapur Main Road, Bellandur, Bengaluru \u2013 560103\nKarnataka\nContact Us\nDownload the App\nGROWW\nAbout Us\nPricing\nBlog\nMedia & Press\nCareers\nHelp & Support\nTrust & Safety\nInvestor Relations\nPRODUCTS\nStocks\nF&O\nMTF\nETF\nIPO\nMutual Funds\nCommodities\nGroww Terminal\n915 Terminal\nStock Screens\nAlgo Trading\nGroww Digest\nDemat Account\nGroww AMC\n\u00a9 2016-2026 Groww. All rights reserved.\nVersion: 7.3.0\nShare Market\nIndices\nF&O\nMutual Funds\nETFs\nFunds By Groww\nCalculators\nIPO\nMiscellaneous\nTop Gainers Stocks\n52 Weeks High Stocks\nTata Motors\nNHPC\nITC\nWipro\nTop Losers Stocks\n52 Weeks Low Stocks\nIREDA\nState Bank of India\nAdani Power\nCDSL\nMost Traded Stocks\nStocks Market Calender\nTata Steel\nTata Power\nBharat Heavy Electricals\nIndian Oil Corporation\nStocks Feed\nSuzlon Energy\nZomato (Eternal)\nYes Bank\nInfosys\nNBCC\nShow More\nOthers:\nNSE\nBSE\nMCX\nTerms and Conditions\nPolicies and Procedures\nRegulatory & Other Info\nPrivacy Policy\nDisclosure\nSMART ODR\nDownload Forms\nInformation Security Practices\nInvestor Charter and Grievance\nBug Bounty",
    "scraped_at": "2026-02-21T03:41:40Z",
    "fund_managers": [
      "Anil Bamboli",
      "Bhagyesh Kagalkar",
      "Srinivasan Ramamurthy"
    ]
  },
  {
    "page_url": "https://groww.in/mutual-funds/hdfc-nifty50-equal-weight-index-fund-direct-growth",
    "fund_name": "HDFC NIFTY50 Equal Weight Index Fund Direct Growth - NAV, Mutual Fund Performance & Portfolio",
    "amc_name": "HDFC Mutual Fund",
    "category": "Equity",
    "sub_category": "Large Cap",
    "plan_type": "Direct",
    "option": "Growth",
    "latest_nav": null,
    "nav_date": null,
    "nav_change_pct": "+0.62%",
    "aum": null,
    "expense_ratio": "0.40%",
    "risk_level": "Very High Risk",
    "rating": null,
    "min_investment": {
      "lump_sum": null,
      "sip": null
    },
    "exit_load": "Nil",
    "lock_in_period": null,
    "returns": {
      "1y": null,
      "3y": null,
      "5y": null
    },
    "full_text": "Stocks\nF&O\nMutual Funds\nMore\nSearch Groww...\n\u2318K\nLogin/Sign up\nHDFC NIFTY50 Equal Weight Index Fund Direct Growth\nEquity\nLarge Cap\nVery High Risk\n+\n0\n1\n2\n3\n4\n5\n6\n7\n8\n9\n0\n1\n2\n3\n4\n5\n6\n7\n8\n9\n.\n1\n2\n3\n4\n5\n6\n7\n8\n9\n0\n1\n2\n3\n4\n5\n6\n7\n8\n9\n%\n3Y annualised\n+0.62%\n1D\n1M\n6M\n1Y\n3Y\nAll\nNAV: 20 Feb '26\n\u20b918.86\nMin. for SIP\n\u20b9100\nFund size\n\u20b91,637.94 Cr\nExpense ratio\n0.40%\nReturn calculator\nMonthly SIP\nOne time\nMonthly investment\n\u20b9100\nOver the past Total investment Would've become Historic returns Returns\n3 months \u20b9300 \u20b9302\n+0.67%\n1 year \u20b91,200 \u20b91,277\n+6.42%\n3 years \u20b93,600 \u20b94,384\n+21.78%\nHoldings (51)\nName Sector Instruments Assets\nOil And Natural Gas Corporation Ltd. Energy Equity 2.32%\nTata Steel Ltd. Metals & Mining Equity 2.31%\nBharat Electronics Ltd. Capital Goods Equity 2.28%\nAxis Bank Ltd. Financial Equity 2.26%\nState Bank of India Financial Equity 2.26%\nJSW Steel Ltd. Metals & Mining Equity 2.25%\nHindalco Industries Ltd. Metals & Mining Equity 2.24%\nNTPC Ltd. Energy Equity 2.23%\nCoal India Ltd. Energy Equity 2.22%\nTech Mahindra Ltd. Technology Equity 2.19%\nSee All\nMinimum investments\nMin. for 1st investment\n\u20b9100\nMin. for 2nd investment\n\u20b9100\nMin. for SIP\n\u20b9100\nReturns and rankings\nAnnualised returns\nAbsolute returns\nName 6M 1Y 3Y All\nFund returns +4.9% +16.7% +18.9% +15.1%\nCategory average (Equity Large Cap) +1.3% +7.1% +15.1% --\nRank (Equity Large Cap) -- 7 24 --\nExit load, stamp duty and tax\nExit load\nNil\nStamp duty on investment: 0.005% (from July 1st, 2020)\nfrom July 1st 2020\nTax implication\nIf you redeem within one year, returns are taxed at 20%. If you redeem after one year, returns exceeding Rs 1.25 lakh in a financial year are taxed at 12.5%.\nCheck past data\nCompare similar funds\nName 1Y 3Y Fund Size(Cr)\nNippon India Large Cap Fund Direct Growth\n+15.37% +20.09% 50,106.61\nWhiteOak Capital Large Cap Fund Direct Growth\n+15.08% +19.62% 1,142.03\nDSP Large Cap Fund Direct Growth\n+10.88% +18.78% 7,162.86\nICICI Prudential Large Cap Fund Direct Growth\n+13.93% +18.63% 76,645.56\nHDFC Large Cap Fund Direct Growth\n+11.38% +16.54% 39,620.90\nCompare\nFund management\nAA\nArun Agarwal\nJan 2022 - Present\nView details\nNM\nNandita Menezes\nMar 2025 - Present\nView details\nAbout HDFC NIFTY50 Equal Weight Index Fund Direct Growth\nFund house\nRecently viewed\nHDFC Multi Asset Active FoF Direct Growth\n17.9%\n(3Y)\nHDFC Large and Mid Cap Fund Direct Growth\n21.1%\n(3Y)\nHDFC Small Cap Fund Direct Growth\n19.4%\n(3Y)\nHDFC Multi Cap Fund Direct Growth\n20.7%\n(3Y)\nFAQs\nHow to Invest in HDFC NIFTY50 Equal Weight Index Fund Direct Growth?\nWhat kind of returns does HDFC NIFTY50 Equal Weight Index Fund Direct Growth provide?\nHow much expense ratio is charged by HDFC NIFTY50 Equal Weight Index Fund Direct Growth?\n\n\nWhat is the AUM of HDFC NIFTY50 Equal Weight Index Fund Direct Growth?\nHow to Redeem HDFC NIFTY50 Equal Weight Index Fund Direct Growth?\nCan I invest in SIP and Lump Sum of HDFC NIFTY50 Equal Weight Index Fund Direct Growth?\nWhat is the NAV of HDFC NIFTY50 Equal Weight Index Fund Direct Growth?\nWhat is the PE and PB ratio of HDFC NIFTY50 Equal Weight Index Fund Direct Growth?\nLooking to invest in mutual funds?\nExplore diversified funds designed for every investor\nInvest Now\nVaishnavi Tech Park, South Tower, 3rd Floor\nSarjapur Main Road, Bellandur, Bengaluru \u2013 560103\nKarnataka\nContact Us\nDownload the App\nGROWW\nAbout Us\nPricing\nBlog\nMedia & Press\nCareers\nHelp & Support\nTrust & Safety\nInvestor Relations\nPRODUCTS\nStocks\nF&O\nMTF\nETF\nIPO\nMutual Funds\nCommodities\nGroww Terminal\n915 Terminal\nStock Screens\nAlgo Trading\nGroww Digest\nDemat Account\nGroww AMC\n\u00a9 2016-2026 Groww. All rights reserved.\nVersion: 7.3.0\nShare Market\nIndices\nF&O\nMutual Funds\nETFs\nFunds By Groww\nCalculators\nIPO\nMiscellaneous\nTop Gainers Stocks\n52 Weeks High Stocks\nTata Motors\nNHPC\nITC\nWipro\nTop Losers Stocks\n52 Weeks Low Stocks\nIREDA\nState Bank of India\nAdani Power\nCDSL\nMost Traded Stocks\nStocks Market Calender\nTata Steel\nTata Power\nBharat Heavy Electricals\nIndian Oil Corporation\nStocks Feed\nSuzlon Energy\nZomato (Eternal)\nYes Bank\nInfosys\nNBCC\nShow More\nOthers:\nNSE\nBSE\nMCX\nTerms and Conditions\nPolicies and Procedures\nRegulatory & Other Info\nPrivacy Policy\nDisclosure\nSMART ODR\nDownload Forms\nInformation Security Practices\nInvestor Charter and Grievance\nBug Bounty",
    "scraped_at": "2026-02-21T03:41:49Z",
    "fund_managers": [
      "Arun Agarwal",
      "Nandita Menezes"
    ]
  },
  {
    "page_url": "https://groww.in/mutual-funds/hdfc-banking-financial-services-fund-direct-growth",
    "fund_name": "HDFC Banking & Financial Services Fund Direct Growth - NAV, Mutual Fund Performance & Portfolio",
    "amc_name": "HDFC Mutual Fund",
    "category": "Equity",
    "sub_category": "Mid Cap",
    "plan_type": "Direct",
    "option": "Growth",
    "latest_nav": null,
    "nav_date": null,
    "nav_change_pct": "+0.45%",
    "aum": null,
    "expense_ratio": "0.79%",
    "risk_level": "Very High Risk",
    "rating": null,
    "min_investment": {
      "lump_sum": null,
      "sip": null
    },
    "exit_load": "Exit load of 1%, if redeemed within 30 days.",
    "lock_in_period": null,
    "returns": {
      "1y": null,
      "3y": null,
      "5y": null
    },
    "full_text": "Stocks\nF&O\nMutual Funds\nMore\nSearch Groww...\n\u2318K\nLogin/Sign up\nHDFC Banking & Financial Services Fund Direct Growth\nEquity\nSectoral\nVery High Risk\n+\n0\n1\n2\n3\n4\n5\n6\n7\n8\n9\n0\n1\n2\n3\n4\n5\n6\n7\n8\n9\n.\n0\n1\n2\n3\n4\n5\n6\n7\n8\n9\n0\n1\n2\n3\n4\n5\n6\n7\n8\n9\n%\n3Y annualised\n+0.45%\n1D\n1M\n6M\n1Y\n3Y\nAll\nNAV: 20 Feb '26\n\u20b919.70\nMin. for SIP\n\u20b9100\nFund size\n\u20b94,485.99 Cr\nExpense ratio\n0.79%\nReturn calculator\nMonthly SIP\nOne time\nMonthly investment\n\u20b9100\nOver the past Total investment Would've become Historic returns Returns\n3 months \u20b9300 \u20b9291\n-3.00%\n1 year \u20b91,200 \u20b91,138\n-5.17%\n3 years \u20b93,600 \u20b94,204\n+16.78%\nHoldings (29)\nName Sector Instruments Assets\nHDFC Bank Ltd. Financial Equity 18.85%\nICICI Bank Ltd. Financial Equity 15.10%\nAxis Bank Ltd. Financial Equity 8.67%\nKotak Mahindra Bank Ltd. Financial Equity 8.04%\nState Bank of India Financial Equity 6.72%\nShriram Finance Ltd Financial Equity 4.42%\nBajaj Finance Ltd. Financial Equity 4.09%\nAU Small Finance Bank Ltd. Financial Equity 3.18%\nSBI Life Insurance Company Ltd. Insurance Equity 3.07%\nCan Fin Homes Ltd. Financial Equity 2.29%\nSee All\nMinimum investments\nMin. for 1st investment\n\u20b9100\nMin. for 2nd investment\n\u20b9100\nMin. for SIP\n\u20b9100\nReturns and rankings\nAnnualised returns\nAbsolute returns\nName 6M 1Y 3Y All\nFund returns +9.7% +27.1% +20.1% +15.7%\nCategory average (Equity Sectoral) +4.0% +16.5% +14.4% --\nRank (Equity Sectoral) -- 8 9 --\nExit load, stamp duty and tax\nExit load\nExit load of 1%, if redeemed within 30 days.\nStamp duty on investment: 0.005% (from July 1st, 2020)\nfrom July 1st 2020\nTax implication\nIf you redeem within one year, returns are taxed at 20%. If you redeem after one year, returns exceeding Rs 1.25 lakh in a financial year are taxed at 12.5%.\nCheck past data\nFund management\nAL\nAnand Laddha\nJun 2021 - Present\nView details\nDM\nDhruv Muchhal\nJun 2023 - Present\nView details\nAbout HDFC Banking & Financial Services Fund Direct Growth\nFund house\nOther plans in the same fund\nRecently viewed\nHDFC NIFTY50 Equal Weight Index Fund Direct Growth\n18.9%\n(3Y)\nHDFC Multi Asset Active FoF Direct Growth\n17.9%\n(3Y)\nHDFC Large and Mid Cap Fund Direct Growth\n21.1%\n(3Y)\nHDFC Small Cap Fund Direct Growth\n19.4%\n(3Y)\nFAQs\nHow to Invest in HDFC Banking & Financial Services Fund Direct Growth?\nWhat kind of returns does HDFC Banking & Financial Services Fund Direct Growth provide?\nHow much expense ratio is charged by HDFC Banking & Financial Services Fund Direct Growth?\n\n\nWhat is the AUM of HDFC Banking & Financial Services Fund Direct Growth?\nHow to Redeem HDFC Banking & Financial Services Fund Direct Growth?\nCan I invest in SIP and Lump Sum of HDFC Banking & Financial Services Fund Direct Growth?\nWhat is the NAV of HDFC Banking & Financial Services Fund Direct Growth?\nWhat is the PE and PB ratio of HDFC Banking & Financial Services Fund Direct Growth?\nLooking to invest in mutual funds?\nExplore diversified funds designed for every investor\nInvest Now\nVaishnavi Tech Park, South Tower, 3rd Floor\nSarjapur Main Road, Bellandur, Bengaluru \u2013 560103\nKarnataka\nContact Us\nDownload the App\nGROWW\nAbout Us\nPricing\nBlog\nMedia & Press\nCareers\nHelp & Support\nTrust & Safety\nInvestor Relations\nPRODUCTS\nStocks\nF&O\nMTF\nETF\nIPO\nMutual Funds\nCommodities\nGroww Terminal\n915 Terminal\nStock Screens\nAlgo Trading\nGroww Digest\nDemat Account\nGroww AMC\n\u00a9 2016-2026 Groww. All rights reserved.\nVersion: 7.3.0\nShare Market\nIndices\nF&O\nMutual Funds\nETFs\nFunds By Groww\nCalculators\nIPO\nMiscellaneous\nTop Gainers Stocks\n52 Weeks High Stocks\nTata Motors\nNHPC\nITC\nWipro\nTop Losers Stocks\n52 Weeks Low Stocks\nIREDA\nState Bank of India\nAdani Power\nCDSL\nMost Traded Stocks\nStocks Market Calender\nTata Steel\nTata Power\nBharat Heavy Electricals\nIndian Oil Corporation\nStocks Feed\nSuzlon Energy\nZomato (Eternal)\nYes Bank\nInfosys\nNBCC\nShow More\nOthers:\nNSE\nBSE\nMCX\nTerms and Conditions\nPolicies and Procedures\nRegulatory & Other Info\nPrivacy Policy\nDisclosure\nSMART ODR\nDownload Forms\nInformation Security Practices\nInvestor Charter and Grievance\nBug Bounty",
    "scraped_at": "2026-02-21T03:41:58Z",
    "fund_managers": [
      "Anand Laddha",
      "Dhruv Muchhal"
    ]
  },
  {
    "page_url": "https://groww.in/mutual-funds/hdfc-nifty-100-equal-weight-index-fund-direct-growth",
    "fund_name": "HDFC NIFTY 100 Equal Weight Index Fund Direct Growth - NAV, Mutual Fund Performance & Portfolio",
    "amc_name": "HDFC Mutual Fund",
    "category": "Equity",
    "sub_category": "Large Cap",
    "plan_type": "Direct",
    "option": "Growth",
    "latest_nav": null,
    "nav_date": null,
    "nav_change_pct": "+0.69%",
    "aum": null,
    "expense_ratio": "0.40%",
    "risk_level": "Very High Risk",
    "rating": null,
    "min_investment": {
      "lump_sum": null,
      "sip": null
    },
    "exit_load": "Nil",
    "lock_in_period": null,
    "returns": {
      "1y": null,
      "3y": null,
      "5y": null
    },
    "full_text": "Stocks\nF&O\nMutual Funds\nMore\nSearch Groww...\n\u2318K\nLogin/Sign up\nHDFC NIFTY 100 Equal Weight Index Fund Direct Growth\nEquity\nLarge Cap\nVery High Risk\n+\n0\n1\n2\n3\n4\n5\n6\n7\n8\n9\n0\n1\n2\n3\n4\n5\n6\n7\n8\n9\n.\n0\n1\n2\n3\n4\n5\n6\n7\n8\n9\n0\n1\n2\n3\n4\n5\n6\n7\n8\n9\n%\n3Y annualised\n+0.69%\n1D\n1M\n6M\n1Y\n3Y\nAll\nNAV: 20 Feb '26\n\u20b917.22\nMin. for SIP\n\u20b9100\nFund size\n\u20b9421.36 Cr\nExpense ratio\n0.40%\nReturn calculator\nMonthly SIP\nOne time\nMonthly investment\n\u20b9100\nOver the past Total investment Would've become Historic returns Returns\n3 months \u20b9300 \u20b9302\n+0.67%\n1 year \u20b91,200 \u20b91,263\n+5.25%\n3 years \u20b93,600 \u20b94,354\n+20.94%\nHoldings (102)\nName Sector Instruments Assets\nOil And Natural Gas Corporation Ltd. Energy Equity 1.17%\nJindal Steel Ltd. Metals & Mining Equity 1.17%\nTata Steel Ltd. Metals & Mining Equity 1.16%\nBharat Electronics Ltd. Capital Goods Equity 1.15%\nVedanta Ltd. Metals & Mining Equity 1.15%\nJSW Steel Ltd. Metals & Mining Equity 1.13%\nState Bank of India Financial Equity 1.13%\nAxis Bank Ltd. Financial Equity 1.13%\nHindalco Industries Ltd. Metals & Mining Equity 1.12%\nNTPC Ltd. Energy Equity 1.12%\nSee All\nMinimum investments\nMin. for 1st investment\n\u20b9100\nMin. for 2nd investment\n\u20b9100\nMin. for SIP\n\u20b9100\nReturns and rankings\nAnnualised returns\nAbsolute returns\nName 6M 1Y 3Y All\nFund returns +3.0% +15.8% +20.2% +14.6%\nCategory average (Equity Large Cap) +1.3% +7.1% +15.1% --\nRank (Equity Large Cap) -- 11 16 --\nExit load, stamp duty and tax\nExit load\nNil\nStamp duty on investment: 0.005% (from July 1st, 2020)\nfrom July 1st 2020\nTax implication\nIf you redeem within one year, returns are taxed at 20%. If you redeem after one year, returns exceeding Rs 1.25 lakh in a financial year are taxed at 12.5%.\nCheck past data\nCompare similar funds\nName 1Y 3Y Fund Size(Cr)\nNippon India Large Cap Fund Direct Growth\n+15.37% +20.09% 50,106.61\nWhiteOak Capital Large Cap Fund Direct Growth\n+15.08% +19.62% 1,142.03\nDSP Large Cap Fund Direct Growth\n+10.88% +18.78% 7,162.86\nICICI Prudential Large Cap Fund Direct Growth\n+13.93% +18.63% 76,645.56\nHDFC Large Cap Fund Direct Growth\n+11.38% +16.54% 39,620.90\nCompare\nFund management\nAA\nArun Agarwal\nMar 2022 - Present\nView details\nNM\nNandita Menezes\nMar 2025 - Present\nView details\nAbout HDFC NIFTY 100 Equal Weight Index Fund Direct Growth\nFund house\nRecently viewed\nHDFC Banking & Financial Services Fund Direct Growth\n20.1%\n(3Y)\nHDFC NIFTY50 Equal Weight Index Fund Direct Growth\n18.9%\n(3Y)\nHDFC Multi Asset Active FoF Direct Growth\n17.9%\n(3Y)\nHDFC Large and Mid Cap Fund Direct Growth\n21.1%\n(3Y)\nFAQs\nHow to Invest in HDFC NIFTY 100 Equal Weight Index Fund Direct Growth?\nWhat kind of returns does HDFC NIFTY 100 Equal Weight Index Fund Direct Growth provide?\nHow much expense ratio is charged by HDFC NIFTY 100 Equal Weight Index Fund Direct Growth?\n\n\nWhat is the AUM of HDFC NIFTY 100 Equal Weight Index Fund Direct Growth?\nHow to Redeem HDFC NIFTY 100 Equal Weight Index Fund Direct Growth?\nCan I invest in SIP and Lump Sum of HDFC NIFTY 100 Equal Weight Index Fund Direct Growth?\nWhat is the NAV of HDFC NIFTY 100 Equal Weight Index Fund Direct Growth?\nWhat is the PE and PB ratio of HDFC NIFTY 100 Equal Weight Index Fund Direct Growth?\nLooking to invest in mutual funds?\nExplore diversified funds designed for every investor\nInvest Now\nVaishnavi Tech Park, South Tower, 3rd Floor\nSarjapur Main Road, Bellandur, Bengaluru \u2013 560103\nKarnataka\nContact Us\nDownload the App\nGROWW\nAbout Us\nPricing\nBlog\nMedia & Press\nCareers\nHelp & Support\nTrust & Safety\nInvestor Relations\nPRODUCTS\nStocks\nF&O\nMTF\nETF\nIPO\nMutual Funds\nCommodities\nGroww Terminal\n915 Terminal\nStock Screens\nAlgo Trading\nGroww Digest\nDemat Account\nGroww AMC\n\u00a9 2016-2026 Groww. All rights reserved.\nVersion: 7.3.0\nShare Market\nIndices\nF&O\nMutual Funds\nETFs\nFunds By Groww\nCalculators\nIPO\nMiscellaneous\nTop Gainers Stocks\n52 Weeks High Stocks\nTata Motors\nNHPC\nITC\nWipro\nTop Losers Stocks\n52 Weeks Low Stocks\nIREDA\nState Bank of India\nAdani Power\nCDSL\nMost Traded Stocks\nStocks Market Calender\nTata Steel\nTata Power\nBharat Heavy Electricals\nIndian Oil Corporation\nStocks Feed\nSuzlon Energy\nZomato (Eternal)\nYes Bank\nInfosys\nNBCC\nShow More\nOthers:\nNSE\nBSE\nMCX\nTerms and Conditions\nPolicies and Procedures\nRegulatory & Other Info\nPrivacy Policy\nDisclosure\nSMART ODR\nDownload Forms\nInformation Security Practices\nInvestor Charter and Grievance\nBug Bounty",
    "scraped_at": "2026-02-21T03:42:07Z",
    "fund_managers": [
      "Arun Agarwal",
      "Nandita Menezes"
    ]
  },
  {
    "page_url": "https://groww.in/mutual-funds/hdfc-nifty-next-50-index-fund-direct-growth",
    "fund_name": "HDFC NIFTY Next 50 Index Fund Direct Growth - NAV, Mutual Fund Performance & Portfolio",
    "amc_name": "HDFC Mutual Fund",
    "category": "Equity",
    "sub_category": "Large Cap",
    "plan_type": "Direct",
    "option": "Growth",
    "latest_nav": null,
    "nav_date": null,
    "nav_change_pct": "+0.64%",
    "aum": null,
    "expense_ratio": "0.30%",
    "risk_level": "Very High Risk",
    "rating": null,
    "min_investment": {
      "lump_sum": null,
      "sip": null
    },
    "exit_load": "Nil",
    "lock_in_period": null,
    "returns": {
      "1y": null,
      "3y": null,
      "5y": null
    },
    "full_text": "Stocks\nF&O\nMutual Funds\nMore\nSearch Groww...\n\u2318K\nLogin/Sign up\nHDFC NIFTY Next 50 Index Fund Direct Growth\nEquity\nLarge Cap\nVery High Risk\n+\n0\n1\n2\n3\n4\n5\n6\n7\n8\n9\n0\n1\n2\n3\n4\n5\n6\n7\n8\n9\n.\n0\n1\n2\n3\n4\n5\n6\n7\n8\n9\n0\n1\n2\n3\n4\n5\n6\n7\n8\n9\n%\n3Y annualised\n+0.64%\n1D\n1M\n6M\n1Y\n3Y\nAll\nNAV: 20 Feb '26\n\u20b916.38\nMin. for SIP\n\u20b9100\nFund size\n\u20b92,143.99 Cr\nExpense ratio\n0.30%\nReturn calculator\nMonthly SIP\nOne time\nMonthly investment\n\u20b9100\nOver the past Total investment Would've become Historic returns Returns\n3 months \u20b9300 \u20b9287\n-4.33%\n1 year \u20b91,200 \u20b91,047\n-12.75%\n3 years \u20b93,600 \u20b94,321\n+20.03%\nHoldings (51)\nName Sector Instruments Assets\nVedanta Ltd. Metals & Mining Equity 5.10%\nHindustan Aeronautics Ltd. Capital Goods Equity 3.87%\nTVS Motor Company Ltd. Automobile Equity 3.81%\nDivi's Laboratories Ltd. Healthcare Equity 3.39%\nBharat Petroleum Corporation Ltd. Energy Equity 3.12%\nBritannia Industries Ltd. Consumer Staples Equity 3.05%\nCholamandalam Investment and Finance Company Ltd. Financial Equity 3.05%\nVarun Beverages Ltd. Consumer Staples Equity 2.85%\nTata Power Company Ltd. Energy Equity 2.71%\nIndian Oil Corporation Ltd. Energy Equity 2.69%\nSee All\nMinimum investments\nMin. for 1st investment\n\u20b9100\nMin. for 2nd investment\n\u20b9100\nMin. for SIP\n\u20b9100\nReturns and rankings\nAnnualised returns\nAbsolute returns\nName 6M 1Y 3Y All\nFund returns +2.0% +14.3% +22.1% +12.1%\nCategory average (Equity Large Cap) +1.3% +7.1% +15.1% --\nRank (Equity Large Cap) -- 26 14 --\nExit load, stamp duty and tax\nExit load\nNil\nStamp duty on investment: 0.005% (from July 1st, 2020)\nfrom July 1st 2020\nTax implication\nIf you redeem within one year, returns are taxed at 20%. If you redeem after one year, returns exceeding Rs 1.25 lakh in a financial year are taxed at 12.5%.\nCheck past data\nCompare similar funds\nName 1Y 3Y Fund Size(Cr)\nNippon India Large Cap Fund Direct Growth\n+15.37% +20.09% 50,106.61\nWhiteOak Capital Large Cap Fund Direct Growth\n+15.08% +19.62% 1,142.03\nDSP Large Cap Fund Direct Growth\n+10.88% +18.78% 7,162.86\nICICI Prudential Large Cap Fund Direct Growth\n+13.93% +18.63% 76,645.56\nHDFC Large Cap Fund Direct Growth\n+11.38% +16.54% 39,620.90\nCompare\nFund management\nAA\nArun Agarwal\nJan 2022 - Present\nView details\nNM\nNandita Menezes\nMar 2025 - Present\nView details\nAbout HDFC NIFTY Next 50 Index Fund Direct Growth\nFund house\nRecently viewed\nHDFC NIFTY 100 Equal Weight Index Fund Direct Growth\n20.2%\n(3Y)\nHDFC Banking & Financial Services Fund Direct Growth\n20.1%\n(3Y)\nHDFC NIFTY50 Equal Weight Index Fund Direct Growth\n18.9%\n(3Y)\nHDFC Multi Asset Active FoF Direct Growth\n17.9%\n(3Y)\nFAQs\nHow to Invest in HDFC NIFTY Next 50 Index Fund Direct Growth?\nWhat kind of returns does HDFC NIFTY Next 50 Index Fund Direct Growth provide?\nHow much expense ratio is charged by HDFC NIFTY Next 50 Index Fund Direct Growth?\n\n\nWhat is the AUM of HDFC NIFTY Next 50 Index Fund Direct Growth?\nHow to Redeem HDFC NIFTY Next 50 Index Fund Direct Growth?\nCan I invest in SIP and Lump Sum of HDFC NIFTY Next 50 Index Fund Direct Growth?\nWhat is the NAV of HDFC NIFTY Next 50 Index Fund Direct Growth?\nWhat is the PE and PB ratio of HDFC NIFTY Next 50 Index Fund Direct Growth?\nLooking to invest in mutual funds?\nExplore diversified funds designed for every investor\nInvest Now\nVaishnavi Tech Park, South Tower, 3rd Floor\nSarjapur Main Road, Bellandur, Bengaluru \u2013 560103\nKarnataka\nContact Us\nDownload the App\nGROWW\nAbout Us\nPricing\nBlog\nMedia & Press\nCareers\nHelp & Support\nTrust & Safety\nInvestor Relations\nPRODUCTS\nStocks\nF&O\nMTF\nETF\nIPO\nMutual Funds\nCommodities\nGroww Terminal\n915 Terminal\nStock Screens\nAlgo Trading\nGroww Digest\nDemat Account\nGroww AMC\n\u00a9 2016-2026 Groww. All rights reserved.\nVersion: 7.3.0\nShare Market\nIndices\nF&O\nMutual Funds\nETFs\nFunds By Groww\nCalculators\nIPO\nMiscellaneous\nTop Gainers Stocks\n52 Weeks High Stocks\nTata Motors\nNHPC\nITC\nWipro\nTop Losers Stocks\n52 Weeks Low Stocks\nIREDA\nState Bank of India\nAdani Power\nCDSL\nMost Traded Stocks\nStocks Market Calender\nTata Steel\nTata Power\nBharat Heavy Electricals\nIndian Oil Corporation\nStocks Feed\nSuzlon Energy\nZomato (Eternal)\nYes Bank\nInfosys\nNBCC\nShow More\nOthers:\nNSE\nBSE\nMCX\nTerms and Conditions\nPolicies and Procedures\nRegulatory & Other Info\nPrivacy Policy\nDisclosure\nSMART ODR\nDownload Forms\nInformation Security Practices\nInvestor Charter and Grievance\nBug Bounty",
    "scraped_at": "2026-02-21T03:42:16Z",
    "fund_managers": [
      "Arun Agarwal",
      "Nandita Menezes"
    ]
  },
  {
    "page_url": "https://groww.in/mutual-funds/hdfc-corporate-debt-opportunities-fund-direct-growth",
    "fund_name": "HDFC Credit Risk Debt Fund Direct Growth - NAV, Mutual Fund Performance & Portfolio",
    "amc_name": "HDFC Mutual Fund",
    "category": "Debt",
    "sub_category": null,
    "plan_type": "Direct",
    "option": "Growth",
    "latest_nav": null,
    "nav_date": null,
    "nav_change_pct": "+0.01%",
    "aum": null,
    "expense_ratio": "1.07%",
    "risk_level": "High Risk",
    "rating": null,
    "min_investment": {
      "lump_sum": null,
      "sip": null
    },
    "exit_load": "Exit load for units in excess of 15% of the investment, 1% will be charged for redemption within 12 months and 0.50% if redeemed after 12 months but within 18 months.",
    "lock_in_period": null,
    "returns": {
      "1y": null,
      "3y": null,
      "5y": null
    },
    "full_text": "Stocks\nF&O\nMutual Funds\nMore\nSearch Groww...\n\u2318K\nLogin/Sign up\nHDFC Credit Risk Debt Fund Direct Growth\nDebt\nCredit Risk\nHigh Risk\n+\n0\n1\n2\n3\n4\n5\n6\n7\n8\n9\n.\n0\n1\n2\n3\n4\n5\n6\n7\n8\n9\n0\n1\n2\n3\n4\n5\n6\n7\n8\n9\n%\n3Y annualised\n+0.01%\n1D\n1M\n6M\n1Y\n3Y\n5Y\nAll\nNAV: 20 Feb '26\n\u20b927.20\nMin. for SIP\n\u20b9100\nFund size\n\u20b96,876.49 Cr\nExpense ratio\n1.07%\nReturn calculator\nMonthly SIP\nOne time\nMonthly investment\n\u20b9100\nOver the past Total investment Would've become Historic returns Returns\n1 year \u20b91,200 \u20b91,251\n+4.25%\n3 years \u20b93,600 \u20b94,076\n+13.22%\n5 years \u20b96,000 \u20b97,269\n+21.15%\nHoldings (77)\nName Sector Instruments Assets\nSandur Manganese & Iron Ores Ltd. Metals & Mining NCD 4.09%\nGMR Airports Ltd. Construction Bonds 3.94%\nTata Projects Ltd. Construction NCD 3.65%\nTata Power Company Ltd. Energy Debenture 3.32%\nJubilant Beverages Ltd. Consumer Staples Debenture 2.99%\nBamboo Hotel And Global Centre (Delhi) Pvt Ltd. Class A Services Debenture 2.93%\nKalpataru Projects International Ltd. Capital Goods NCD 2.91%\nSK Finance Ltd. Financial NCD 2.90%\nJubilant Bevco Ltd. Consumer Staples Debenture 2.78%\nNirma Ltd. Consumer Staples Debenture 2.56%\nSee All\nMinimum investments\nMin. for 1st investment\n\u20b9100\nMin. for 2nd investment\n\u20b9100\nMin. for SIP\n\u20b9100\nReturns and rankings\nAnnualised returns\nAbsolute returns\nName 3Y 5Y 10Y All\nFund returns +8.3% +7.4% +8.3% +8.8%\nCategory average (Debt Credit Risk) +8.7% +9.0% +6.4% --\nRank (Debt Credit Risk) 11 12 5 --\nExit load, stamp duty and tax\nExit load\nExit load for units in excess of 15% of the investment, 1% will be charged for redemption within 12 months and 0.50% if redeemed after 12 months but within 18 months.\nStamp duty on investment: 0.005% (from July 1st, 2020)\nfrom July 1st 2020\nTax implication\nReturns are taxed as per your Income Tax slab.\nCheck past data\nCompare similar funds\nName 1Y 3Y Fund Size(Cr)\nAditya Birla Sun Life Credit Risk Fund Direct Growth\n+14.13% +12.96% 1,138.04\nInvesco India Credit Risk Fund Direct Growth\n+10.11% +10.56% 158.25\nNippon India Credit Risk Fund Direct Growth\n+9.65% +9.26% 1,030.58\nAxis Credit Risk Fund Direct Growth\n+9.56% +8.77% 362.79\nBaroda BNP Paribas Credit Risk Fund Direct Growth\n+8.55% +8.65% 186.08\nCompare\nFund management\nSM\nShobhit Mehrotra\nMar 2014 - Present\nView details\nDM\nDhruv Muchhal\nJun 2023 - Present\nView details\nAbout HDFC Credit Risk Debt Fund Direct Growth\nFund house\nOther plans in the same fund\nRecently viewed\nHDFC NIFTY Next 50 Index Fund Direct Growth\n22.1%\n(3Y)\nHDFC NIFTY 100 Equal Weight Index Fund Direct Growth\n20.2%\n(3Y)\nHDFC Banking & Financial Services Fund Direct Growth\n20.1%\n(3Y)\nHDFC NIFTY50 Equal Weight Index Fund Direct Growth\n18.9%\n(3Y)\nFAQs\nHow to Invest in HDFC Credit Risk Debt Fund Direct Growth?\nWhat kind of returns does HDFC Credit Risk Debt Fund Direct Growth provide?\nHow much expense ratio is charged by HDFC Credit Risk Debt Fund Direct Growth?\n\n\nWhat is the AUM of HDFC Credit Risk Debt Fund Direct Growth?\nHow to Redeem HDFC Credit Risk Debt Fund Direct Growth?\nCan I invest in SIP and Lump Sum of HDFC Credit Risk Debt Fund Direct Growth?\nWhat is the NAV of HDFC Credit Risk Debt Fund Direct Growth?\nWhat is the PE and PB ratio of HDFC Credit Risk Debt Fund Direct Growth?\nLooking to invest in mutual funds?\nExplore diversified funds designed for every investor\nInvest Now\nVaishnavi Tech Park, South Tower, 3rd Floor\nSarjapur Main Road, Bellandur, Bengaluru \u2013 560103\nKarnataka\nContact Us\nDownload the App\nGROWW\nAbout Us\nPricing\nBlog\nMedia & Press\nCareers\nHelp & Support\nTrust & Safety\nInvestor Relations\nPRODUCTS\nStocks\nF&O\nMTF\nETF\nIPO\nMutual Funds\nCommodities\nGroww Terminal\n915 Terminal\nStock Screens\nAlgo Trading\nGroww Digest\nDemat Account\nGroww AMC\n\u00a9 2016-2026 Groww. All rights reserved.\nVersion: 7.3.0\nShare Market\nIndices\nF&O\nMutual Funds\nETFs\nFunds By Groww\nCalculators\nIPO\nMiscellaneous\nTop Gainers Stocks\n52 Weeks High Stocks\nTata Motors\nNHPC\nITC\nWipro\nTop Losers Stocks\n52 Weeks Low Stocks\nIREDA\nState Bank of India\nAdani Power\nCDSL\nMost Traded Stocks\nStocks Market Calender\nTata Steel\nTata Power\nBharat Heavy Electricals\nIndian Oil Corporation\nStocks Feed\nSuzlon Energy\nZomato (Eternal)\nYes Bank\nInfosys\nNBCC\nShow More\nOthers:\nNSE\nBSE\nMCX\nTerms and Conditions\nPolicies and Procedures\nRegulatory & Other Info\nPrivacy Policy\nDisclosure\nSMART ODR\nDownload Forms\nInformation Security Practices\nInvestor Charter and Grievance\nBug Bounty",
    "scraped_at": "2026-02-21T03:42:26Z",
    "fund_managers": [
      "Shobhit Mehrotra",
      "Dhruv Muchhal"
    ]
  }
]